A New State of Organized Crime	https://journals.lib.sfu.ca/index.php/jicw/article/view/2359	D Shanti - The Journal of Intelligence, Conflict, and Warfare, 2020 - journals.lib.sfu.ca	- Those groups who may have some hierarchical structure lack the ability to properly govern--activities within the darknet market -Lusthaus- 2013 - For example- forums are marketplaces where--illicit goods and services are advertised and sold -Broadhurst et al.- 2014- p. 7- Lusthaus -	Related articles	https://journals.lib.sfu.ca/index.php/jicw/article/download/2359/1755	A-New-State-of-Organized-Crime	6/2/2021 12:37:27 PM
Leveraging information security and computational trust for cybersecurity	https://link.springer.com/article/10.1007/s11227-015-1543-4	R de Oliveira Albuquerque, LJG Villalba… - The Journal of …, 2016 - Springer	- or even anticipate and prevent cyber attacks. P2P- BitTorrent- TOR- I2P- closed forums---anonymity networks- deep web and darknet are subject of interest in cyber security--studies. Cyber alliances. To be able to go further in cyber -	Cited by 17	https://www.researchgate.net/profile/Rafael_De_Sousa_Junior/publication/283499126_Leveraging_information_security_and_computational_trust_for_cybersecurity/links/5727877908ae586b21e29332/Leveraging-information-security-and-computational-trust-for-cybersecurity.pdf	Leveraging-information-security-and-computational-trust-for-cybersecurity	6/2/2021 12:37:30 PM
OSINT and the Dark Web	https://link.springer.com/chapter/10.1007/978-3-319-47671-1_8	G Kalpakis, T Tsikrika, N Cunningham, C Iliou… - Open Source …, 2016 - Springer	- file sharing- Web page publishing -ie the so-called freesites-- and user communication -ie chat--forums- without any fear of censorship. It is based on a decentralised architecture- making it less--vulnerable to attacks. Unlike Tor and I2P- Freenet solely acts as a darknet where the -	Cited by 12	https://www.academia.edu/download/62944709/Open_Source_Intelligence_Investigation_Babak_Akhgar_201620200413-31731-11f17l3.pdf#page=117	OSINT-and-the-Dark-Web	6/2/2021 12:37:37 PM
Taming the 800 pound gorilla: The rise and decline of NTP DDoS attacks	https://dl.acm.org/doi/abs/10.1145/2663716.2663717	J Czyz, M Kallitsis, M Gharaibeh… - Proceedings of the …, 2014 - dl.acm.org	- Through a dataset that measures a large fraction of global Internet traffic- we show a three order--of magnitude rise in NTP. Using a large darknet- we observe a similar rise in global scanning--activity- both malicious and research - Keywords DDoS- NTP- Darknet -	Cited by 162	https://conferences.sigcomm.org/imc/2014/papers/p435.pdf	Taming-the-800-pound-gorilla--The-rise-and-decline-of-NTP-DDoS-attacks	6/2/2021 12:37:42 PM
DRUG MARKETS AND ANONYMIZING TECHNOLOGIES	https://www.spir.aoir.org/ojs/index.php/spir/article/view/10463	M Tzanetakis, D Décary-Hétu, S Bakken… - AoIR Selected Papers …, 2018 - spir.aoir.org	- including AlphaBay- Agora- Dream Market- Nucleus and Outlaw- associated discussion forums---eg- official market forums- Subreddit DarkNetMarkets - Despite these obstacles- cryptomarkets--emerged as a -transformative criminal innovation- on the darknet -Aldridge - D-cary-H-tu -	All 4 versions	https://www.spir.aoir.org/ojs/index.php/spir/article/download/10463/8335	DRUG-MARKETS-AND-ANONYMIZING-TECHNOLOGIES	6/2/2021 12:37:46 PM
Will growth in cryptomarket drug buying increase the harms of illicit drugs?	https://onlinelibrary.wiley.com/doi/abs/10.1111/add.13899	J Aldridge, A Stevens, MJ Barratt - Addiction, 2018 - Wiley Online Library	- drugs. From the 1990s- user-centred discussion forums and websites -eg - 84. As--with cryptomarkets themselves- there are mechanisms through which engagement--with discussion forums may affect both benefits and harms -	Cited by 56	https://onlinelibrary.wiley.com/doi/pdfdirect/10.1111/add.13899	Will-growth-in-cryptomarket-drug-buying-increase-the-harms-of-illicit-drugs-	6/2/2021 12:37:50 PM
Driving Cybersecurity Policy Insights From Information on the Internet	https://ieeexplore.ieee.org/abstract/document/9137670/	QH Wang, SM Miller, RH Deng - IEEE Security & Privacy, 2020 - ieeexplore.ieee.org	- Although publicly accessible forums may not capture the most malicious activities in hacker com---munities compared to what is happening on the darknet- they are more likely to attract less--determined hackers or the curious because of relatively easy entry and low legal risk -	Related articles	https://ink.library.smu.edu.sg/cgi/viewcontent.cgi?article=6383&context=sis_research	Driving-Cybersecurity-Policy-Insights-From-Information-on-the-Internet	6/2/2021 12:37:54 PM
Innovation and adaptation in jihadist digital security	https://www.tandfonline.com/doi/full/10.1080/00396338.2017.1282678	A Brantly - Survival, 2017 - Taylor & Francis	- 4- no. 5- 2010. 20 The author has observed this nontrust environment on a regular basis within--various jihadist forums and chatrooms - 33 See Daniel Moore and Thomas Rid- -Cryptopolitik and--the Darknet-- Survival- vol. 58- no. 1- February-March 2016- pp. 7-38 -	Cited by 17	https://www.academia.edu/download/55802925/Innovation_and_Adaptation.pdf	Innovation-and-adaptation-in-jihadist-digital-security	6/2/2021 12:37:58 PM
An analysis of bitcoin acceptance in Indonesia	https://journal.binus.ac.id/index.php/comtech/article/view/3885	FE Gunawan, R Novendra - ComTech: Computer, Mathematics …, 2017 - journal.binus.ac.id	- For the reason- Bitcoin is widely used in the transactions on the deep web or darknet such as--buying non-prescription medicines - The results showed that by analyzing several sources of--publicly available information via web-scraped forums and Bitcoin-s transaction ledger- the -	Cited by 21	https://journal.binus.ac.id/index.php/comtech/article/download/3885/3272	An-analysis-of-bitcoin-acceptance-in-Indonesia	6/2/2021 12:38:11 PM
The value of unsolicited online data in drug policy research	https://www.sciencedirect.com/science/article/pii/S0955395919300313	O Enghoff, J Aldridge - International Journal of Drug Policy, 2019 - Elsevier	- comprised a qualitative analysis of text-based data collected over 11 months from nine online--platforms -blogs- discussion forums and -story - Illicit drug trade on the conventional web -often--termed the -clearnet- in contrast to the encrypted -darknet-- has historically mainly included -	Cited by 21	https://www.sciencedirect.com/science/article/pii/S0955395919300313	The-value-of-unsolicited-online-data-in-drug-policy-research	6/2/2021 12:38:15 PM
Characterising the online weapons trafficking on cryptomarkets	https://www.sciencedirect.com/science/article/pii/S0379073817305157	D Rhumorbarbe, D Werner, Q Gilliéron, L Staehli… - Forensic science …, 2018 - Elsevier	- For example- it seems that the name -The Armory- is still in use- which leads to debates on forums--since scam is - bulletin by the NDARC -22-- an independent researcher-s website -23-- the--HiddenWiki platform -24- listing various .onion resources and the website DarkNet Stats -25 -	Cited by 16	https://serval.unil.ch/resource/serval:BIB_BD1327FE2C2B.P001/REF.pdf	Characterising-the-online-weapons-trafficking-on-cryptomarkets	6/2/2021 12:38:22 PM
Social support for active substance users: A content analysis of r/drugs	https://www.tandfonline.com/doi/shareview/10.1080/10410236.2019.1587691	K Wombacher, SE Sheff, N Itrich - Health communication, 2019 - Taylor & Francis	- Research can be extended to look at forums and websites that discuss where and how to--purchase drugs through the darknet. These sites help to teach users how to buy illegal substances---and in some cases other illegal goods- through darknet marketplaces -	Cited by 4	https://www.researchgate.net/profile/Kevin_Wombacher/publication/331875092_Social_Support_for_Active_Substance_Users_A_Content_Analysis_of_rDrugs/links/5f9acd0892851c14bcf0c93e/Social-Support-for-Active-Substance-Users-A-Content-Analysis-of-r-Drugs.pdf	Social-support-for-active-substance-users--A-content-analysis-of-r-drugs	6/2/2021 12:38:26 PM
Everything you always wanted to know about drug	https://www.research.manchester.ac.uk/portal/files/38628774/Everything_you_always_wanted_to_knowAAM.pdf	MJ Barratt, J Aldridge - Science International, 2016 - research.manchester.ac.uk	- Page 5. 2 While in hacker forums the term -cryptomarket--a term further developed by Martin---2014--was used to describe these anonymous online marketplaces- darknet markets or DNMs--is the -indigenous- term mostly used at present to describe these phenomena -	Cited by 1	https://www.research.manchester.ac.uk/portal/files/38628774/Everything_you_always_wanted_to_knowAAM.pdf	Everything-you-always-wanted-to-know-about-drug	6/2/2021 12:38:35 PM
Analysis of System Performance Metrics Towards the Detection of Cryptojacking in IOT Devices	https://scholar.dsu.edu/theses/360/	R Matthews - 2021 - scholar.dsu.edu	- organizations may be more likely to involve law enforcement. Cryptojacking is not technically--difficult to implement as turnkey cryptojacking software can be found on darknet Page 13. 2 forums---Huang et al.- 2014-. The more devices compromised the more cryptocurrency will be -		https://scholar.dsu.edu/cgi/viewcontent.cgi?article=1360&context=theses	Analysis-of-System-Performance-Metrics-Towards-the-Detection-of-Cryptojacking-in-IOT-Devices	6/2/2021 12:38:39 PM
Collective dynamics of dark web marketplaces	https://arxiv.org/abs/1911.09536	A ElBahrawy, L Alessandretti, L Rusnac… - arXiv preprint arXiv …, 2019 - arxiv.org	- Considering a novel dataset of Bitcoin transactions for 31 large dark markets and their users---we in- vestigated how the darknet market ecosystem is - raids may have so-far neglected effects--on user migration- and broaden the research to include the effect of online forums on the -	Cited by 2	https://arxiv.org/pdf/1911.09536	Collective-dynamics-of-dark-web-marketplaces	6/2/2021 12:38:51 PM
Cryptocurrencies: Threats and Investigative Opportunities for Law Enforcement	https://dspace.cuni.cz/handle/20.500.11956/101806	E Gonzalez - 2018 - dspace.cuni.cz	- transaction activity- speculators who try to make profits by leveraging the rise of value--in Bitcoin- and criminals harnessing the digital currency and Darknet technologies--to receive and send - market sites on the Darknet -Shen- 2018- -	Cited by 2	https://dspace.cuni.cz/bitstream/handle/20.500.11956/101806/120311105.pdf?sequence	Cryptocurrencies--Threats-and-Investigative-Opportunities-for-Law-Enforcement	6/2/2021 12:39:00 PM
Active cyber defense certainty: A digital self-defense in the modern age	https://heinonline.org/hol-cgi-bin/get_pdf.cgi?handle=hein.journals/okcu43&section=16	H Gandhi - Okla. City UL Rev., 2019 - HeinOnline	- a software update that patches the security flaw.- 94 Many enterprises use the same--business-managements software- so a small zero-day exploit could have a wide-spread- negative--impact.95 In fact- zero-day exploits are so popular that an entire part of the Darknet--a portion -	Cited by 4	http://law.okcu.edu/wp-content/uploads/2020/07/5-43-2-Gandhi.pdf	Active-cyber-defense-certainty--A-digital-self-defense-in-the-modern-age	6/2/2021 12:39:03 PM
Multi-class and Multi-label classification of Darkweb Data	https://core.ac.uk/download/pdf/157755550.pdf	R Patil - 2018 - core.ac.uk	- forums discuss on various cyber-security related topics such as worms- botnet- zero-days- hacking--tools- backdoor services and etc. 2.2 Related Work -Nunes et al. -2016-- presents a system that--helps gather cyber threat intelligence from various social platforms on the darknet -	Related articles	https://core.ac.uk/download/pdf/157755550.pdf	Multi-class-and-Multi-label-classification-of-Darkweb-Data	6/2/2021 12:39:09 PM
Using computational techniques to study social influence online	https://journals.sagepub.com/doi/abs/10.1177/1368430220937354	A Cork, R Everson, M Levine… - Group Processes & …, 2020 - journals.sagepub.com	The social identity approach suggests that group prototypical individuals--have greater influence over fellow group members. This effect has been--well-studied offline. Here- we use a novel method of...	Cited by 3	https://journals.sagepub.com/doi/pdf/10.1177/1368430220937354	Using-computational-techniques-to-study-social-influence-online	6/2/2021 12:39:13 PM
Stolen identity valuation and market evolution on the dark web	https://www.cybercrimejournal.com/Steelvol13issue1IJCC2019.pdf	CMS Steel - International Journal of Cyber Criminology, 2019 - cybercrimejournal.com	- It-s dark in there- Using systems analysis to investigate trust and engagement in dark web--forums. In Lecture Notes in Computer Science -pp. 117-128-. Lacson- W.- - Jones- B. -2016-.--The 21st century darknet market- Lessons from the fall of silk road -	Cited by 3	https://www.cybercrimejournal.com/Steelvol13issue1IJCC2019.pdf	Stolen-identity-valuation-and-market-evolution-on-the-dark-web	6/2/2021 12:39:16 PM
“How will I get my next week's script?” Reactions of Reddit opioid forum users to changes in treatment access in the early months of the coronavirus pandemic	https://www.sciencedirect.com/science/article/pii/S0955395921000384	N Krawczyk, AM Bunting, D Frank, J Arshonsky… - International Journal of …, 2021 - Elsevier	- in care. In this study- we explore the influence of COVID-19 on access to- experiences--with- and motivations for OUD treatment through a qualitative analysis of public--discussion forums on Reddit. Methods. We collected data -	All 6 versions	https://www.academia.edu/download/66069778/how_will_i_get_my_next_script.pdf	-How-will-I-get-my-next-week-s-script---Reactions-of-Reddit-opioid-forum-users-to-changes-in-treatment-access-in-the-early-months-of-the-coronavirus-pandemic	6/2/2021 12:39:20 PM
Crypto-Market Enforcement-New Strategy and Tactics1	https://www.swansea.ac.uk/media/Crypto-Market-Enforcemnet-New-Strategy-and-Tactics.pdf	A Afilipoaie, P Shortis - Policy, 2018 - swansea.ac.uk	- Therefore feedback- community forums and the honesty of administrators in mediating disputes--play a central role in the functionality of cryptomarkets.24 By targeting these elements that--underpin - -The Network Structure of Opioid Distribution on a Darknet Cryptomarket.- Journal -	Cited by 11	https://www.swansea.ac.uk/media/Crypto-Market-Enforcemnet-New-Strategy-and-Tactics.pdf	Crypto-Market-Enforcement-New-Strategy-and-Tactics1	6/2/2021 12:39:25 PM
Ar Tor tinklo naudojimas neprieštarauja viešojo intereso viršenybės principui?	https://vb.vdu.lt/object/elaba:16070569/	M Pocius - 2016 - vb.vdu.lt	- The Darknet has also a lighter side- as the opportunity to use alternative and a high--level of security search engines- data storages- e-mail services- data sharing- chat--rooms- social networks- whistleblower forums- news portals -		https://vb.vdu.lt/object/elaba:16070569/16070569.pdf	Ar-Tor-tinklo-naudojimas-neprie-tarauja-vie-ojo-intereso-vir-enyb-s-principui-	6/2/2021 12:39:36 PM
Georganiseerde criminaliteit en ICT. Rapportage in het kader van de vijfde ronde van de Monitor Georganiseerde Criminaliteit	https://repub.eur.nl/pub/112417/Repub_112417.pdf	EW Kruisbergen, ER Leukfeldt, ER Kleemans, R Roks - 2018 - repub.eur.nl	- Met name bij high-tech netwerken spelen online forums daar- om een belangrijke rol bij het vinden--van facilitators die beschikken over - Verkopers van drugs die handelen op een darknet market--ontvangen de opbrengsten van hun handelswaar vaak in een cryptomunt- eenheid -	Cited by 15	https://repub.eur.nl/pub/112417/Repub_112417.pdf	Georganiseerde-criminaliteit-en-ICT--Rapportage-in-het-kader-van-de-vijfde-ronde-van-de-Monitor-Georganiseerde-Criminaliteit	6/2/2021 12:39:42 PM
Cyber security incident handling, warning and response system for the european critical information infrastructures (cybersane)	https://link.springer.com/chapter/10.1007/978-3-030-20257-6_41	S Papastergiou, H Mouratidis… - … Engineering Applications of …, 2019 - Springer	- The Deep and Dark Web mining and intelligence -DarkNet- component provides the appropriate--Social Information Mining capabilities that will - Such situations are- organization of hacktivist--activities in underground forums or IRC channels- external situations that can become a -	Cited by 2	https://arxiv.org/pdf/2003.05720	Cyber-security-incident-handling--warning-and-response-system-for-the-european-critical-information-infrastructures--cybersane-	6/2/2021 12:39:48 PM
What are hackers looking for?	http://www.annales.org/enjeux-numeriques/DG/2019/DG-2019-12/EnjNum19d_4Gommes.pdf	J Gommes - annales.org	- In general- -darknet- refers to any form of information and communication technology on the--underground web- the usual place for illegal activities or acts of dissidence. On darknets- forums--open access to other forums- and so on- till reaching the platforms where major -	Related articles	http://www.annales.org/enjeux-numeriques/DG/2019/DG-2019-12/EnjNum19d_4Gommes.pdf	What-are-hackers-looking-for-	6/2/2021 12:39:53 PM
DOSSIER ZETETIQUE	https://cortecs.org/wp-content/uploads/2016/01/CorteX_s21_31_Darknet_Aubert_Besnier_Marco_Thevenon.pdf	T Romain, B Benjamin, A Vincent, M Florian - cortecs.org	- Il va pr-senter au journaliste un site provenant du -darknet-- ce site permettrait d-acheter des--coordonn-es de cartes bancaires vol-es - Regarder sur les forums les sujets - leurs propos peut---clairer les n-ophytes m-me si ils doivent se familiariser avec les termes employ-s- ou -		https://cortecs.org/wp-content/uploads/2016/01/CorteX_s21_31_Darknet_Aubert_Besnier_Marco_Thevenon.pdf	DOSSIER-ZETETIQUE	6/2/2021 12:39:58 PM
Behaviour and Characteristics of Perpetrators of Online-facilitated Child Sexual Abuse and Exploitation	https://www.iicsa.org.uk/key-documents/3720/view/rapid-evidence-assessment-behaviour-characteristics-perpetrators-online-facilitated-child-sexual-abuse-exploitation.pdf	J DeMarco, S Sharrock, T Crowther… - … : Independent Inquiry into …, 2018 - iicsa.org.uk	- This reflects a trend for illegal content being hidden more professionally- shifting away from--peer-to-peer networks into deeper parts of cyberspace- with a higher volume of CSA material--being shared and published in forums on the darknet -the part of the internet that can only -	Cited by 15	https://www.iicsa.org.uk/key-documents/3720/view/rapid-evidence-assessment-behaviour-characteristics-perpetrators-online-facilitated-child-sexual-abuse-exploitation.pdf	Behaviour-and-Characteristics-of-Perpetrators-of-Online-facilitated-Child-Sexual-Abuse-and-Exploitation	6/2/2021 12:40:02 PM
Supporting Social Networks with Agent-Based Services	https://www.researchgate.net/profile/Michele_Tomaiuolo/publication/262165001_Supporting_Social_Networks_With_Agent-Based_Services/links/00463536115cf31051000000/Supporting-Social-Networks-With-Agent-Based-Services.pdf	E Franchi, A Poggi, M Tomaiuolo - International Journal of Virtual …, 2013 - researchgate.net	- It uses a -best-effort- unreliable routing algorithm to find content and namespaces- over both---OpenNet- and -DarkNet- connections. Various quite popular uncensored forums are built on--Freenet- but they usually suffer a large amount of spam coming from anonymous sources -	Cited by 2	https://www.researchgate.net/profile/Michele_Tomaiuolo/publication/262165001_Supporting_Social_Networks_With_Agent-Based_Services/links/00463536115cf31051000000/Supporting-Social-Networks-With-Agent-Based-Services.pdf	Supporting-Social-Networks-with-Agent-Based-Services	6/2/2021 12:40:06 PM
Security and Machine Learning Adoption in IoT: A Preliminary Study of IoT Developer Discussions	https://arxiv.org/abs/2104.00634	G Uddin - arXiv preprint arXiv:2104.00634, 2021 - arxiv.org	- With interests in IoT growing- we observe discussions of IoT developers in online forums like--Stack Overflow -SO- - IoT device like a Ubuntu ML system- - I-m trying to feed my Raspberry Pi--MPEG Video stream into a Ubuntu machine learning system called Darknet.- Q42824871 -	All 3 versions	https://arxiv.org/pdf/2104.00634	Security-and-Machine-Learning-Adoption-in-IoT--A-Preliminary-Study-of-IoT-Developer-Discussions	6/2/2021 12:40:11 PM
Road Damage Detection and Classi cation Using Deep Neural Networks with Smartphone Images	https://papers.ssrn.com/sol3/papers.cfm?abstract_id=3627382	M Faramarzi - Available at SSRN 3627382, 2020 - papers.ssrn.com	- But finally- YOLO in DarkFlow and Darknet were selected for this study- because other methods--faced with technical issues in the prosses which could not be challenged in this short period of--time- also- YOLO had a very complete GitHub page and forums on that were activate -	Cited by 1	https://www.researchgate.net/profile/M_Faramarzi/publication/342179672_Road_Damage_Detection_and_Classification_Using_Deep_Neural_Networks_YOLOv4_with_Smartphone_Images/links/5f15fe754585151299ab4f38/Road-Damage-Detection-and-Classification-Using-Deep-Neural-Networks-YOLOv4-with-Smartphone-Images.pdf	Road-Damage-Detection-and-Classi-cation-Using-Deep-Neural-Networks-with-Smartphone-Images	6/2/2021 12:40:15 PM
Technology and organised crime in the smart city: an ethnographic study of the illicit drug trade	https://cityterritoryarchitecture.springeropen.com/articles/10.1186/s40410-018-0091-7	M Berry - City, Territory and Architecture, 2018 - cityterritoryarchitecture.springeropen …	The term -smart city- has circulated across the developed world affecting urban development--programmes and government strategies. Such -future cities- are heralded for their efficient--networked technologies embedded within the fabric of urban environments that provide new -	Cited by 12	https://cityterritoryarchitecture.springeropen.com/articles/10.1186/s40410-018-0091-7	Technology-and-organised-crime-in-the-smart-city--an-ethnographic-study-of-the-illicit-drug-trade	6/2/2021 12:40:19 PM
Child sex abuse images and exploitation materials	https://papers.ssrn.com/sol3/papers.cfm?abstract_id=3384499	R Broadhurst - Roderic Broadhurst, Child Sex Abuse Images and …, 2019 - papers.ssrn.com	- This reflects a trend for illegal content being hidden more professionally- shifting away from--peer-to-peer networks into deeper parts of cyberspace- with a higher volume of CSA material--being shared and published in forums on the darknet- -NatCen Social Research- 2018- 15- -	Cited by 11	https://www.researchgate.net/profile/Roderic_Broadhurst/publication/336867783_Child_sex_abuse_images_and_exploitation_materials/links/5df813eea6fdcc28372692f8/Child-sex-abuse-images-and-exploitation-materials.pdf	Child-sex-abuse-images-and-exploitation-materials	6/2/2021 12:40:23 PM
# Drugsforsale: An exploration of the use of social media and encrypted messaging apps to supply and access drugs	https://www.sciencedirect.com/science/article/pii/S0955395918302111	L Moyle, A Childs, R Coomber, MJ Barratt - International Journal of Drug …, 2019 - Elsevier	- supplier-s username is often obtained from other locations -eg- other social media apps---cryptomarket vendor pages or cryptomarket forums- or it is a - other cryptomarkets limits access--to its members by outsiders -van Hout - Bingham- 2013- and access to the darknet is therefore -	Cited by 48	https://www.researchgate.net/profile/Leah_Moyle/publication/330060775_Drugsforsale_An_exploration_of_the_use_of_social_media_and_encrypted_messaging_apps_to_supply_and_access_drugs/links/5cd92b2092851c4eab9a0ad5/Drugsforsale-An-exploration-of-the-use-of-social-media-and-encrypted-messaging-apps-to-supply-and-access-drugs.pdf	--Drugsforsale--An-exploration-of-the-use-of-social-media-and-encrypted-messaging-apps-to-supply-and-access-drugs	6/2/2021 12:40:26 PM
Reputation in the Internet black market: an empirical and theoretical analysis of the Deep Web	https://www.cambridge.org/core/journals/journal-of-institutional-economics/article/reputation-in-the-internet-black-market-an-empirical-and-theoretical-analysis-of-the-deep-web/560A8645D47BBDDC4E71101EC1C100CA	RA Hardy, JR Norgaard - Journal of Institutional Economics, 2016 - cambridge.org	- Each buyer and seller is known by a unique username- their true identity is secret. Users--of the Deep Web- through forums and blogs- create a wealth of information to keep users--updated on the happenings of the market -DarkNet Markets- 2014- -	Cited by 91	https://pdfs.semanticscholar.org/f286/0c94c2b8de28edccb0ebd6454606a6546bea.pdf	Reputation-in-the-Internet-black-market--an-empirical-and-theoretical-analysis-of-the-Deep-Web	6/2/2021 12:40:31 PM
The Cynicism of Modern Cybercrime: Automating the Analysis of Surface Web Marketplaces	https://arxiv.org/abs/2105.11805	N Lykousas, V Koutsokostas, F Casino… - arXiv preprint arXiv …, 2021 - arxiv.org	- darknet marketplaces -54-- the involved stakeholders and their communication patterns -20-- and--their modus operandi -53-. Of particular interest to researchers- are the marketplaces dedicated--to the sale of stolen personal and financial information- known as -carding forums- -	All 2 versions	https://arxiv.org/pdf/2105.11805	The-Cynicism-of-Modern-Cybercrime--Automating-the-Analysis-of-Surface-Web-Marketplaces	6/2/2021 12:40:39 PM
How has the rise of the Internet changed terrorism?	https://www.academia.edu/download/53070243/Internet_and_Terrorism.pdf	S Engelkes - 2017 - academia.edu	- emergence of chat rooms and forums in the early 2000s to the use of social media today. However---with evolving possibilities of encrypted communication and driven by counter- terrorism efforts--to filter out extremist content- terrorists have increasingly migrated to the Darknet -	Related articles	https://www.academia.edu/download/53070243/Internet_and_Terrorism.pdf	How-has-the-rise-of-the-Internet-changed-terrorism-	6/2/2021 12:40:43 PM
