Cybercrimes against the electricity infrastructure: exploring hacker and industry perceptions	https://rucore.libraries.rutgers.edu/rutgers-lib/37331/	A Rege - 2012 - rucore.libraries.rutgers.edu	- First- it seeks to compare industry and hacker perceptions on electricity ICS threats- vulnerabilities---and consequences - A total of 323 participants from both industry and -ethical- hacking communities--completed PARE RISKS surveys- which were analyzed using non-parametric -	Cited by 7	https://rucore.libraries.rutgers.edu/rutgers-lib/37331/PDF/1/	Cybercrimes-against-the-electricity-infrastructure--exploring-hacker-and-industry-perceptions	6/2/2021 9:57:31 PM
Engineering professional development	http://mspnet-static.s3.amazonaws.com/BurghardtHacker.pdf	D Burghardt, M Hacker - Professional …, 2007 - mspnet-static.s3.amazonaws.com	The Math Science Technology Education Partnership -MSTP- 2003- is one of the NSF MSP---targeted projects that has as its primary mission the improvement of middle school--mathematics instruction and student learning in mathematics- science- and technology -	Cited by 9	http://mspnet-static.s3.amazonaws.com/BurghardtHacker.pdf	Engineering-professional-development	6/2/2021 9:57:35 PM
Macrophyte wrack on sandy beaches of the US Pacific Northwest is linked to proximity of source habitat, ocean upwelling, and beach morphology	https://www.int-res.com/abstracts/meps/v594/p263-269/	JN Reimer, SD Hacker, BA Menge… - Marine Ecology Progress …, 2018 - int-res.com	Marine macrophyte wrack -macroalgae and seagrasses- frequently washes onto beaches--but little is known about the factors controlling its biogeographic variability. We report on a--large-scale study of macrophyte wrack deposition patterns on the US Pacific Northwest -	Cited by 5	https://www.lubchencomengelab.com/uploads/1/1/9/0/119053103/reimer_2018.pdf	Macrophyte-wrack-on-sandy-beaches-of-the-US-Pacific-Northwest-is-linked-to-proximity-of-source-habitat--ocean-upwelling--and-beach-morphology	6/2/2021 9:57:40 PM
The Hacker Ethic and the Effective Use of ICTs in Alternative Economic Cultures	https://repositorio.tec.mx/handle/11285/636176	J Castellanos Rivadeneira - 2019 - repositorio.tec.mx	- in the wind -----40 The Hacker Ethic- Abasolo and Ik- ta K-op-------44 The Hacker Ethic and - democracy in the economic and technical--spheres- and will help the development of local communities -	Related articles	https://repositorio.tec.mx/ortec/bitstream/handle/11285/636176/The%20Hacker%20Ethic%20and%20the%20Effective%20use%20of%20ICTs%20in%20Alternative%20Economic%20Cultures.pdf?sequence=1&isAllowed=y	The-Hacker-Ethic-and-the-Effective-Use-of-ICTs-in-Alternative-Economic-Cultures	6/2/2021 9:57:44 PM
A food politics of the possible? Growing sustainable food systems through networks of knowledge	https://link.springer.com/content/pdf/10.1007/s10460-015-9592-0.pdf	A Blay-Palmer, R Sonnino, J Custot - Agriculture and Human Values, 2016 - Springer	- farmer-to-consumer initiatives --create new economic subjectivities through relations of interde---pendence and mutual reliance between consumers and producers.-- Post-capitalist possibilities--have been explored directly through tenant rights- hacker communities and alternative -	Cited by 137	http://orca.cf.ac.uk/71042/1/R%20Sonnino%202015%20A%20food%20politics%20post%20print.pdf	A-food-politics-of-the-possible--Growing-sustainable-food-systems-through-networks-of-knowledge	6/2/2021 9:57:51 PM
Oysters and aquaculture practices affect eelgrass density and productivity in a Pacific Northwest estuary	https://bioone.org/journals/Journal-of-Shellfish-Research/volume-28/issue-2/035.028.0207/Oysters-and-Aquaculture-Practices-Affect-Eelgrass-Density-and-Productivity-in/10.2983/035.028.0207.short	HM Tallis, JL Ruesink, B Dumbauld, S Hacker… - Journal of Shellfish …, 2009 - BioOne	The presence of bivalves and bivalve aquaculture can have positive and negative impacts--on seagrass and associated benthic communities. Some oyster -Crassostrea gigas---aquaculture methods recently have been restricted to reduce benthic disturbance and -	Cited by 62	https://pubag.nal.usda.gov/download/55679/PDF	Oysters-and-aquaculture-practices-affect-eelgrass-density-and-productivity-in-a-Pacific-Northwest-estuary	6/2/2021 9:57:56 PM
Evolution of open source networks in industry	https://www.tandfonline.com/doi/abs/10.1080/01972240490481027	PB Laat - The Information Society, 2004 - Taylor & Francis	- For several reasons- this tale of unfolding networks is a fascinating one. Over the--last two decades- hacker communities have proven that mutual love of hacking--may produce reliable results quickly. The achievements of the -	Cited by 22	https://www.researchgate.net/profile/Paul_De_Laat/publication/220175571_Evolution_of_Open_Source_Networks_in_Industry/links/5798840708ae33e89fb07484/Evolution-of-Open-Source-Networks-in-Industry.pdf	Evolution-of-open-source-networks-in-industry	6/2/2021 9:58:00 PM
What the digitalisation of music tells us about capitalism, culture and the power of the information technology sector	https://www.tandfonline.com/doi/abs/10.1080/1369118X.2017.1340498	D Hesmondhalgh, LM Meier - Information, Communication & …, 2018 - Taylor & Francis	- disruptive innovations as ultimately the products of amateurs- as when Leyshon -2014- p. 4---attributes transformation to software formats such as MP3 which- in his words- -emerged from--their various redoubts within relatively small computer-literate and hacker communities- -	Cited by 81	https://www.tandfonline.com/doi/pdf/10.1080/1369118X.2017.1340498	What-the-digitalisation-of-music-tells-us-about-capitalism--culture-and-the-power-of-the-information-technology-sector	6/2/2021 9:58:04 PM
Open source movements as a model for organising	https://www.tandfonline.com/doi/abs/10.1057/palgrave.ejis.3000373	J Ljungberg - European Journal of Information Systems, 2000 - Taylor & Francis	- These movements are based on virtual networking on the Internet and the web. They are loosely--coupled communities kept together by strong common values related to hacker culture. Work--seems to be totally distributed- delegated and loosely coupled -	Cited by 301	https://www.researchgate.net/profile/Jan_Ljungberg/publication/221408272_Open_Source_Movements_as_a_Model_for_Organizing/links/59e0a2c2458515371616c1fc/Open-Source-Movements-as-a-Model-for-Organizing.pdf	Open-source-movements-as-a-model-for-organising	6/2/2021 9:58:08 PM
Users and peers. From citizen science to P2P science	https://jcom.sissa.it/archive/09/01/Jcom0901%282010%29E.abstract	A Delfanti - 2010 - jcom.sissa.it	- resources freely available online. Second- we are witnessing the spread of a maker--culture ranging from free software to open hardware projects- from hacker communities--to open design and community gardens. This layer is where -	Cited by 45	https://jcom.sissa.it/archive/09/01/Jcom0901%282010%29E.pdf	Users-and-peers--From-citizen-science-to-P2P-science	6/2/2021 9:58:13 PM
Exploring Deviant Hacker Networks (DHN) On Social Media Platforms.	http://search.ebscohost.com/login.aspx?direct=true&profile=ehost&scope=site&authtype=crawler&jrnl=15587215&AN=119275323&h=R4O6oTOtOiZP2Pt57FxJX2J3BOlud%2Fcs7u14NvW73n4IY0%2FIm7znvHIgbg65zxx0Fgup6ii7qzmJikTFDeBVJQ%3D%3D&crl=c	S Al-khateeb, KJ Conlan, N Agarwal… - Journal of Digital …, 2016 - search.ebscohost.com	- Exploring Deviant Hacker Networks - Results showed that focal structures are more interactive--than average individu- als and more interactive than communities in the evolution of a mass protest---ie- the interaction rate of focal structures are signif- icantly higher than the average -	Cited by 7	https://commons.erau.edu/cgi/viewcontent.cgi?article=1375&context=jdfsl&httpsredir=1&referer=	Exploring-Deviant-Hacker-Networks--DHN--On-Social-Media-Platforms-	6/2/2021 9:58:17 PM
Plant diversity shapes microbe‐rhizosphere effects on P mobilisation from organic matter in soil	https://onlinelibrary.wiley.com/doi/abs/10.1111/ele.12530	N Hacker, A Ebeling, A Gessler, G Gleixner… - Ecology …, 2015 - Wiley Online Library	Plant species richness -PSR- increases nutrient uptake which depletes bioavailable nutrient--pools in soil. No such relationship between plant uptake and availability in soil was found for--phosphorus -P-. We explored PSR effects on P mobilisation -phosphatase activity -PA-- in -	Cited by 36	https://www.academia.edu/download/45852469/Plant_diversity_shapes_microberhizospher20160522-15053-1kq0i3u.pdf	Plant-diversity-shapes-microbe-rhizosphere-effects-on-P-mobilisation-from-organic-matter-in-soil	6/2/2021 9:58:22 PM
I Heart Hacker News	http://static.barik.net/barik/publications/fsenier2015/fse15nier-nierid52-p-f44a348-24911-preprint.pdf	T Barik, B Johnson, E Murphy-Hill - static.barik.net	- Keywords grounded theory- computer-mediated discourse- Hacker News---representativeness- theoretical saturation - For technical communities who engage largely--in quantitative research- three of these requirements cause much angst -	Related articles	http://static.barik.net/barik/publications/fsenier2015/fse15nier-nierid52-p-f44a348-24911-preprint.pdf	I-Heart-Hacker-News	6/2/2021 9:58:26 PM
Political contestation in Chinese digital spaces: Deepening the critical inquiry	https://journals.sagepub.com/doi/abs/10.1177/0920203X14539910	G Yang - China Information, 2014 - journals.sagepub.com	Although research on the Chinese Internet is thriving- our understanding--of its multidimensional character- its diverse forms- actors- and dynamics--remains limited. This is due to a tendency to foc...	Cited by 69	https://www.academia.edu/download/43397331/2014_Yang_Intro_to_China_Info_special_issue.pdf	Political-contestation-in-Chinese-digital-spaces--Deepening-the-critical-inquiry	6/2/2021 9:58:31 PM
Congeneric variation in surfgrasses and ocean conditions influence macroinvertebrate community structure	https://www.int-res.com/abstracts/meps/v433/p53-63/	OM Moulton, SD Hacker - Marine Ecology Progress Series, 2011 - int-res.com	Foundation species are important components of ecosystems because they provide habitat--and ameliorate stressful conditions for residents. Comparisons of congeneric foundation--species have mostly been limited to comparisons of native and invasive species- with less -	Cited by 5	https://www.int-res.com/articles/meps2011/433/m433p053.pdf	Congeneric-variation-in-surfgrasses-and-ocean-conditions-influence-macroinvertebrate-community-structure	6/2/2021 9:58:35 PM
Bathing in Bacteria: Mycobacteria Relative Abundance on Showerhead Biofilms	https://scholar.colorado.edu/downloads/7w62f871s	RG Hacker-Cary - 2017 - scholar.colorado.edu	Mycobacterium is a genus of Actinobacteria that contains many human pathogens- causing--diseases such as tuberculosis- leprosy- and nontuberculous mycobacteria -NTM- lung--disease. Diagnosed cases of NTM lung disease- are increasing rapidly across the United -	Related articles	https://scholar.colorado.edu/downloads/7w62f871s	Bathing-in-Bacteria--Mycobacteria-Relative-Abundance-on-Showerhead-Biofilms	6/2/2021 9:58:41 PM
The promise and the promises of making in science education	https://www.tandfonline.com/doi/abs/10.1080/03057267.2016.1275380	B Bevan - Studies in Science Education, 2017 - Taylor & Francis	- These new makerspaces- like the hacker communities that preceded them- celebrate creativity--and have been characterised as communities of practice in which Makers share knowledge---skills- and social networks -Sheridan et al.- 2014- Van Holm- 2015- -	Cited by 146	https://www.ecsite.eu/sites/default/files/bevan_making_sse-min.pdf	The-promise-and-the-promises-of-making-in-science-education	6/2/2021 9:58:46 PM
Linking Earth Observation and taxonomic, structural and functional biodiversity: Local to ecosystem perspectives	https://www.sciencedirect.com/science/article/pii/S1470160X16303223	…, M Beckmann, C Boehm, H Feilhauer, JM Hacker… - Ecological …, 2016 - Elsevier	Impacts of human civilization on ecosystems threaten global biodiversity. In a changing--environment- traditional in situ approaches to biodiversity monitoring have made significant--steps forward to quantify and evaluate BD at many scales but still- these methods are limited -	Cited by 122	https://www.researchgate.net/profile/Angela_Lausch/publication/304076764_Linking_Earth_Observation_and_taxonomic_structural_and_functional_biodiversity_Local_to_ecosystem_perspectives/links/59ee2ff4a6fdcc32187dafe5/Linking-Earth-Observation-and-taxonomic-structural-and-functional-biodiversity-Local-to-ecosystem-perspectives.pdf	Linking-Earth-Observation-and-taxonomic--structural-and-functional-biodiversity--Local-to-ecosystem-perspectives	6/2/2021 9:58:50 PM
A Social and Religious History of the Jews, Vol. 18: Late Middle Ages and Era of European Expansion: The Ottoman Empire, Persia, Ethiopia, India and China	https://www.academia.edu/download/59105664/044._Joseph_R._Hacker_-_Review_of_A_Social_and_Religious_History_of_the_Jews__Vol._18__by_Salo_W._Baron20190501-8861-1xfm665.pdf	JR Hacker - 1986 - academia.edu	Salo Baron-s monumental History of the Jews encompasses Jewish history from an- cient to modern--times. This is the last in the ten-volume series -vols. 9 to 18- covering the years 1200-1650- or--the -Late Middle Ages and Era of European Expansion.- Volumes 9 through 15 are dedicated -		https://www.academia.edu/download/59105664/044._Joseph_R._Hacker_-_Review_of_A_Social_and_Religious_History_of_the_Jews__Vol._18__by_Salo_W._Baron20190501-8861-1xfm665.pdf	A-Social-and-Religious-History-of-the-Jews--Vol--18--Late-Middle-Ages-and-Era-of-European-Expansion--The-Ottoman-Empire--Persia--Ethiopia--India-and-China	6/2/2021 9:58:54 PM
Geek and Hacker Stories	https://pdfs.semanticscholar.org/3c28/ddd561b2879113ec46003d7b373e0b87cbe5.pdf	B Alleyne - pdfs.semanticscholar.org	B. Alleyne- Goldsmiths College- University of London- London- UK Geek and Hacker Stories Code---Culture and Storytelling from the Technosphere y Brings contemporary geek communities and--geek culture to life with media case studies- ethnography and narrative analy- sis y -	All 2 versions	https://pdfs.semanticscholar.org/3c28/ddd561b2879113ec46003d7b373e0b87cbe5.pdf	Geek-and-Hacker-Stories	6/2/2021 9:58:58 PM
WikiLeaks, Anonymous, and the exercise of individuality: Protesting in the cloud	https://link.springer.com/chapter/10.1057/9781137275745_12	S Milan - Beyond WikiLeaks, 2013 - Springer	- Although taking action such as launching a DDoS attack gains symbolic meaning -and--effectiveness in practice- in inter- action with the community of peers and in the reputation system--that regulates tech and hacker communities- it relies on individual activities where the -	Cited by 61	http://psulibrary.palawan.edu.ph/wtbooks/resources/pdf/903782.pdf#page=218	WikiLeaks--Anonymous--and-the-exercise-of-individuality--Protesting-in-the-cloud	6/2/2021 9:59:05 PM
Determinants of herder attitudes towards the Vulnerable snow leopard Panthera uncia in Yushu Prefecture, China	https://www.cambridge.org/core/journals/oryx/article/determinants-of-herder-attitudes-towards-the-vulnerable-snow-leopard-panthera-uncia-in-yushu-prefecture-china/FE00ECC4DD64090074878094954BA081	CE Hacker, Y Dai, Y Cheng, Y Zhang, Y Zhang… - Oryx, 2020 - cambridge.org	Yushu Prefecture in Qinghai Province provides some of the largest known stretches of--habitat for the Vulnerable snow leopard Panthera uncia in China. People living in these--areas are dependent on agropastoralism. Support from local communities is necessary for -	Cited by 2	https://www.cambridge.org/core/services/aop-cambridge-core/content/view/FE00ECC4DD64090074878094954BA081/S0030605319001315a.pdf/div-class-title-determinants-of-herder-attitudes-towards-the-vulnerable-snow-leopard-span-class-italic-panthera-uncia-span-in-yushu-prefecture-china-div.pdf	Determinants-of-herder-attitudes-towards-the-Vulnerable-snow-leopard-Panthera-uncia-in-Yushu-Prefecture--China	6/2/2021 9:59:10 PM
The comfort, energy and health implications of London's urban heat island	https://journals.sagepub.com/doi/abs/10.1177/0143624410394530	…, S Evans, R Giridharan, JN Hacker… - Building Services …, 2011 - journals.sagepub.com	- PhD - M. Batty- BA PhD FBA FRS - SE Belcher- MA PhD FRMetS - SI Bohnenstengel- BSc MSc--PhD - D. Carruthers- PhD - Z. Chalabi- BSc PhD - B. Croxford- BEng PhD - C. Demanuele- BSc--MSc - S. Evans- BA MSc - R. Giridharan- BArch MUr.Design PhD - JN Hacker- BSc PhD -	Cited by 128	https://journals.sagepub.com/doi/pdf/10.1177/0143624410394530	The-comfort--energy-and-health-implications-of-London-s-urban-heat-island	6/2/2021 9:59:15 PM
On perception and reality in wireless air traffic communication security	https://ieeexplore.ieee.org/abstract/document/7589091/	M Strohmeier, M Schäfer, R Pinheiro… - IEEE transactions on …, 2016 - ieeexplore.ieee.org	- We systematically integrate knowledge from the academic and hacker communities with--technology standards to analyze the security of these applications- providing a complete--overview over their vulnerabilities- existing attacks- and countermeasures -	Cited by 85	https://arxiv.org/pdf/1602.08777	On-perception-and-reality-in-wireless-air-traffic-communication-security	6/2/2021 9:59:23 PM
Networked and Digitally Based Actions for Citizen-centered Design: Transparency Hacker, a Case Study	http://papers.cumincad.org/data/works/att/sigradi2015_12.19.pdf	DK Hanns - Blucher Design Proceedings, 2015 - papers.cumincad.org	- Recording the history of and describing how initiatives related to civic participation based--on sharing- and in particular hackactivism in its online and offline forms- have fared as--well as communities- eg the case of -nibus Hacker -Hacker Bus- -	Related articles	http://papers.cumincad.org/data/works/att/sigradi2015_12.19.pdf	Networked-and-Digitally-Based-Actions-for-Citizen-centered-Design--Transparency-Hacker--a-Case-Study	6/2/2021 9:59:29 PM
The heroic hacker: Legends of the computer age	https://www.researchgate.net/profile/Erik_Brunvand/publication/2665101_The_Heroic_Hacker_Legends_of_the_Computer_Age/links/5434104f0cf2bf1f1f27b4af/The-Heroic-Hacker-Legends-of-the-Computer-Age.pdf	E Brunvand - Online im Internet. URL: http://www. cs. utah. edu …, 1996 - researchgate.net	- Although I-m sure that there are analogous communities of people skilled in similarly complicated--disciplines- the computer hacker culture is connected intimately with the electronic stored-program--computer. Computers of this type have existed only since the 1950-s -	Cited by 12	https://www.researchgate.net/profile/Erik_Brunvand/publication/2665101_The_Heroic_Hacker_Legends_of_the_Computer_Age/links/5434104f0cf2bf1f1f27b4af/The-Heroic-Hacker-Legends-of-the-Computer-Age.pdf	The-heroic-hacker--Legends-of-the-computer-age	6/2/2021 9:59:32 PM
Flexible complexity management and engineering by innovative services	https://link.springer.com/article/10.1007/s40171-013-0056-3	N Kryvinska, TJ Hacker, F Xhafa, M Alexander - 2014 - Springer	The management and engineering of innovative services for a global client base in a service--economy struggles with continuously increasing complexity -Benedettini and Neely 2012a-.--To address the problem of growing complexity- one of the objectives of Service Science is to -	Cited by 10	https://link.springer.com/article/10.1007/s40171-013-0056-3	Flexible-complexity-management-and-engineering-by-innovative-services	6/2/2021 9:59:36 PM
“There Simply Is No Unified Hacker Movement.” Why We Should Consider the Plurality of Hacker and Maker Cultures	https://www.degruyter.com/document/doi/10.14361/dcs-2017-0112/html	S Kubitschko - Digital Culture & Society, 2017 - degruyter.com	- EDS- In the previously mentioned paper- you also describe some historical examples of how--hacker collectives have called attention to issues relevant - How do such practices differ from--activities as we could observe them- for example in hacking communities in the United States -	Related articles	https://137.248.186.7/bitstream/handle/doc/3181/DIGITAL-CULTURE-AND-SOCIETY_3_1_2017_185-195_Kubitschko_Conversation_.pdf?sequence=4&isAllowed=y	-There-Simply-Is-No-Unified-Hacker-Movement---Why-We-Should-Consider-the-Plurality-of-Hacker-and-Maker-Cultures	6/2/2021 9:59:40 PM
Hacktivism and cyberwars: Rebels with a cause?	https://www.taylorfrancis.com/books/mono/10.4324/9780203490037/hacktivism-cyberwars-tim-jordan-paul-taylor	T Jordan, P Taylor - 2004 - taylorfrancis.com	- PacMan. The microserf and hacker-cracker communities exhibited ambivalent political--credentials. The early hacker desire to promote free access to computers and--information as a means of 14 Hacking and hacktivism Page 22 -	Cited by 587	https://www.thing.net/~rdom/ucsd/3somesPlus/hacktivismcyberwars.pdf	Hacktivism-and-cyberwars--Rebels-with-a-cause-	6/2/2021 9:59:45 PM
Demographic and spatial analysis of West Nile virus and St. Louis encephalitis in Houston, Texas	https://bioone.org/journals/Journal-of-the-American-Mosquito-Control-Association/volume-22/issue-2/8756-971X(2006)22[254:DASAOW]2.0.CO;2/DEMOGRAPHIC-AND-SPATIAL-ANALYSIS-OF-WEST-NILE-VIRUS-AND-ST/10.2987/8756-971X(2006)22[254:DASAOW]2.0.CO;2.short	J Rios, CS Hacker, CA Hailey, RE Parsons - Journal of the American …, 2006 - BioOne	This descriptive prevalence study describes the relationships between mosquito density and--the presence of arboviruses -in mosquitoes and humans- with various socioeconomic and--environmental factors present near the time of the arbovirus outbreak in Harris County -	Cited by 43	https://www.researchgate.net/profile/Janelle_Rios/publication/6774840_Demographic_and_spatial_analysis_of_West_Nile_virus_and_St_Louis_encephalitis_in_Houston_Texas/links/58f138bc458515ff23ab3c63/Demographic-and-spatial-analysis-of-West-Nile-virus-and-St-Louis-encephalitis-in-Houston-Texas.pdf	Demographic-and-spatial-analysis-of-West-Nile-virus-and-St--Louis-encephalitis-in-Houston--Texas	6/2/2021 9:59:49 PM
… Amin, Talia Bar, Erling Barth, Fran Blau, Richard Burkhauser, Henry Farber, Dan Feenberg, Richard Freeman, Claudia Goldin, David Hacker, Larry Kahn, Subal …	https://www.emerald.com/insight/content/doi/10.1108/S0147-912120140000041009/full/html?utm_source=TrendMD&utm_medium=cpc&utm_campaign=Research_in_Labor_Economics_TrendMD_1	SW Polachek, X Zhang, X Zhou - Gender convergence in the labor …, 2015 - emerald.com	- We thank Vikesh Amin- Talia Bar- Erling Barth- Fran Blau- Richard Burkhauser- Henry Farber---Dan Feenberg- Richard Freeman- Claudia Goldin- David Hacker- Larry Kahn- Subal Kumbhakar---Shelly Lundberg- Haim Ofek- Thomas Rawski- Susan Wolcott- Dennis Yang- Xi Yang -	Cited by 15	https://www.econstor.eu/bitstream/10419/104683/1/dp8570.pdf	--Amin--Talia-Bar--Erling-Barth--Fran-Blau--Richard-Burkhauser--Henry-Farber--Dan-Feenberg--Richard-Freeman--Claudia-Goldin--David-Hacker--Larry-Kahn--Subal--	6/2/2021 9:59:55 PM
The Terrorist–Hacker/Hacktivist Distinction: An Investigation of Self-Identified Hackers and Hacktivists	https://books.google.com/books?hl=en&lr=&id=KrcrDwAAQBAJ&oi=fnd&pg=PA77&dq=%2Bhacker+%2Bcommunities&ots=yPOdpnzcMu&sig=QRvsMXbELt0NKdorWYMgkfLOWQ4	LM Tanczer - M. Conway, L. Jarvis, O. Lehane, S. Macdonald & L …, 2017 - books.google.com	- the media. The equation of hacking and hacktivism with cyberterrorism is believed--connected to overestimations of their capabilities and to attempts to construct the--hacker and hacktivist communities as malicious. This hyped -	Cited by 8	https://discovery.ucl.ac.uk/id/eprint/10053647/1/The%20Terrorist%20%E2%80%93%20Hacker%20Hacktivist%20Distinction%20-%20An%20Investigation%20of%20Self-Identified%20Hackers%20and%20Hacktivists.pdf	The-Terrorist-Hacker-Hacktivist-Distinction--An-Investigation-of-Self-Identified-Hackers-and-Hacktivists	6/2/2021 10:00:01 PM
Social innovation, democracy and makerspaces	https://papers.ssrn.com/sol3/papers.cfm?abstract_id=2986245	A Smith - 2017 - papers.ssrn.com	- Some makerspaces call themselves hackerspaces- and connect to a tradition of workshops that--goes back to hacker communities and autonomous movements in the 1990s and earlier -Maxigas---2012-. A more formalized network of workshops adopts the label FabLabs -	Cited by 36	https://www.academia.edu/download/53814997/Smith_2017_SWPS_Social_innovation_makerspaces.pdf	Social-innovation--democracy-and-makerspaces	6/2/2021 10:00:05 PM
""" It Doesn't Have to Be This Way"": Hacker Perspectives on Privacy"	https://www.jstor.org/stable/24361631	K Steinmetz, J Gerber - Social Justice, 2015 - JSTOR	Page 1. -It Doesn-t Have to Be This Way-- Hacker Perspectives on Privacy Kevin Steinmetz--- Jurg Gerber - As a step toward understanding these perceptions- the current study engages--in a qualitative content analysis of 2600- The Hacker Quarterly -	Cited by 21	http://socialjusticejournal.org/archive/137_41_3/137_02_Steinmetz.pdf	--It-Doesn-t-Have-to-Be-This-Way---Hacker-Perspectives-on-Privacy	6/2/2021 10:00:09 PM
Reexamining environmental justice: a statistical analysis of historical hazardous waste landfill siting patterns in metropolitan Texas	https://www.jstor.org/stable/42863494	T Yandle, D Burton - Social science quarterly, 1996 - JSTOR	- Page 2. 478 Social Science Quarterly predominantly white communities - As of September 1994---three states had passed environmental equity laws- three states had passed resolutions- and--legislators in six states had introduced legislation -Hacker- 1994- -	Cited by 190	http://envs.emory.edu/home/documents/yandle-pdf/yandle-and-burton-1996-main-article.pdf	Reexamining-environmental-justice--a-statistical-analysis-of-historical-hazardous-waste-landfill-siting-patterns-in-metropolitan-Texas	6/2/2021 10:00:19 PM
