Complex interactions between marine sponges and their symbiotic microbial communities	https://aslopubs.onlinelibrary.wiley.com/doi/abs/10.4319/lo.2011.56.5.1577	CJ Freeman, RW Thacker - Limnology and Oceanography, 2011 - Wiley Online Library	- microbial communities Christopher J. Freeman- and Robert W. Thacker - 2008-. In what might--be the most ancient microbe-metazoan association- marine sponges host abundant and diverse--communities of symbiotic microbes -Webster and Blackall 2009- -	Cited by 140	https://aslopubs.onlinelibrary.wiley.com/doi/pdf/10.4319/lo.2011.56.5.1577	Complex-interactions-between-marine-sponges-and-their-symbiotic-microbial-communities	6/2/2021 9:28:55 PM
Synergies among producer firms, lead users, and user communities: The case of the LEGO producer–user ecosystem	https://onlinelibrary.wiley.com/doi/abs/10.1111/jpim.12127	C Hienerth, C Lettl, P Keinz - Journal of Product Innovation …, 2014 - Wiley Online Library	- In the third step- synergetic interactions among the focal producer firm- the user communities---and the lead users were identified - As one LEGO executive put it- -We simply did not know what--to do.- Moreover- one hacker noted- -There was almost a full year without a word from -	Cited by 147	https://onlinelibrary.wiley.com/doi/pdf/10.1111/jpim.12127	Synergies-among-producer-firms--lead-users--and-user-communities--The-case-of-the-LEGO-producer-user-ecosystem	6/2/2021 9:28:59 PM
Differing consequences of removing ecosystem-modifying invaders: significance of impact and community context to restoration potential	https://link.springer.com/chapter/10.1007/978-3-540-79236-9_21	SD Hacker, MN Dethier - Biological invasions in marine ecosystems, 2009 - Springer	In recent years there has been a strong focus on the colonization of invasive species and--their impacts on native and nonindigenous species -Parker et al. 1999- Ruiz et al. 1999---Simberloff and Von Holle 1999- Davis and Thompson 2000- Kolar and Lodge 2001- -	Cited by 20	https://www.researchgate.net/profile/Megan_Dethier/publication/226809649_Differing_Consequences_of_Removing_Ecosystem-Modifying_Invaders_Significance_of_Impact_and_Community_Context_to_Restoration_Potential/links/53e8f0f80cf28f342f3e53c6/Differing-Consequences-of-Removing-Ecosystem-Modifying-Invaders-Significance-of-Impact-and-Community-Context-to-Restoration-Potential.pdf	Differing-consequences-of-removing-ecosystem-modifying-invaders--significance-of-impact-and-community-context-to-restoration-potential	6/2/2021 9:29:03 PM
Changes in bacterial communities of the marine sponge Mycale laxissima on transfer into aquaculture	https://www.ncbi.nlm.nih.gov/pmc/articles/pmc2258574/	NM Mohamed, JJ Enticknap, JE Lohr… - Applied and …, 2008 - ncbi.nlm.nih.gov	- doi- 10.1128-AEM.02047-07. PMCID- PMC2258574. PMID- 18156319. Changes in Bacterial--Communities of the Marine Sponge Mycale laxissima on Transfer into Aquaculture - - - - -56-.--Denaturing gradient gel electrophoresis -DGGE- of bacterial communities -	Cited by 96	https://www.ncbi.nlm.nih.gov/pmc/articles/pmc2258574/	Changes-in-bacterial-communities-of-the-marine-sponge-Mycale-laxissima-on-transfer-into-aquaculture	6/2/2021 9:29:08 PM
Effects of trampling limitation on coastal dune plant communities	https://link.springer.com/content/pdf/10.1007/s00267-012-9809-6.pdf	R Santoro, T Jucker, I Prisco, M Carboni… - Environmental …, 2012 - Springer	- They show that dune vegetation communities can be improved in relatively short time periods--through the - Springer- Heidelberg- pp 279-296 Barbier EB- Hacker SD- Kennedy C- Koch EW---Stier AC- Silliman BR -2011- The value of estuarine and coastal ecosystem services -	Cited by 104	https://www.academia.edu/download/44943666/Effects_of_trampling_limitation_on_coast20160421-19660-2l932a.pdf	Effects-of-trampling-limitation-on-coastal-dune-plant-communities	6/2/2021 9:29:13 PM
Forming communities of practice in higher education: A theoretical perspective	http://uir.unisa.ac.za/handle/10500/14634	M Jakovljevic, S Buckley, M Bushney - 2013 - uir.unisa.ac.za	- function. The activity is socially mediated- consciousness and meaning are always--formed in joint- collective activity -Leont-ev- 1978- Hacker- 1994- through knowledge--sharing within communities of practice. 4. CONCLUSION -	Cited by 33	http://uir.unisa.ac.za/bitstream/handle/10500/14634/37_MakeLearn_2013_Jakovljevic_Buckley.pdf?sequence=3	Forming-communities-of-practice-in-higher-education--A-theoretical-perspective	6/2/2021 9:29:21 PM
Dynamics and spatial organization of plant communities in water-limited systems	https://www.sciencedirect.com/science/article/pii/S0040580907000603	E Gilad, M Shachak, E Meron - Theoretical population biology, 2007 - Elsevier	- plant interactions- as abiotic stresses or consumer pressures increase -Bertness and Callaway---1994- Bertness and Hacker- 1994- Greenlee - In water-limited systems such changes have been--observed in woody-herbaceous communities under conditions of increased aridity -	Cited by 95	https://in.bgu.ac.il/en/bidr/SIDEER/DSEEP/Ehud_Meron/Documents/Papers/Gilad2007tpb.pdf	Dynamics-and-spatial-organization-of-plant-communities-in-water-limited-systems	6/2/2021 9:29:31 PM
Inter-and intraspecific variations of bacterial communities associated with marine sponges from San Juan Island, Washington	https://www.ncbi.nlm.nih.gov/pmc/articles/pmc2687283/	OO Lee, YH Wong, PY Qian - Applied and environmental …, 2009 - ncbi.nlm.nih.gov	- Published online 2009 Apr 10. doi- 10.1128-AEM.00002-09. PMCID- PMC2687283. PMID---19363076. Inter- and Intraspecific Variations of Bacterial Communities Associated with Marine--Sponges from San Juan Island- Washington - - TRFLP analysis of bacterial communities -	Cited by 80	https://www.ncbi.nlm.nih.gov/pmc/articles/pmc2687283/	Inter-and-intraspecific-variations-of-bacterial-communities-associated-with-marine-sponges-from-San-Juan-Island--Washington	6/2/2021 9:29:37 PM
Non‐linearity in ecosystem services: temporal and spatial variability in coastal protection	https://esajournals.onlinelibrary.wiley.com/doi/abs/10.1890/080126	…, DJ Reed, GME Perillo, SD Hacker… - Frontiers in Ecology …, 2009 - Wiley Online Library	Natural processes tend to vary over time and space- as well as between species. The--ecosystem services these natural processes provide are therefore also highly variable. It is--often assumed that ecosystem services are provided linearly -unvaryingly- at a steady rate- -	Cited by 738	https://esajournals.onlinelibrary.wiley.com/doi/full/10.1890/080126?searchHistoryKey=&prevSearch=null	Non-linearity-in-ecosystem-services--temporal-and-spatial-variability-in-coastal-protection	6/2/2021 9:29:41 PM
Regulating behavior in online communities	https://books.google.com/books?hl=en&lr=&id=lIvBMYVxWJYC&oi=fnd&pg=PA125&dq=%2Bhacker+%2Bcommunities&ots=z_BWksqeLy&sig=Rbym0KR134SaU6i_jju8KWhJIn8	S Kiesler, R Kraut, P Resnick… - … online communities …, 2012 - books.google.com	- Venom- an Italian hacker- bragged-- They can read any message you post- the complaints--too- they simply don-t care- and taunt you.- Ultimately- the Italian hackers left- but at least one--member of alt - For example- in communities like Yelp -http---www. yelp -	Cited by 83	https://www.researchgate.net/profile/Sara-Kiesler/publication/265260679_Regulating_Behavior_in_Online_Communities/links/553e2c2b0cf20184050ddb2c/Regulating-Behavior-in-Online-Communities.pdf	Regulating-behavior-in-online-communities	6/2/2021 9:29:45 PM
Assessing the utility of sponge microbial symbiont communities as models to study global climate change: a case study with Halichondria bowerbanki	https://www.natelemoine.com/pdfs/Lemoine%20et%20al%202008.pdf	N Lemoine, N Buell, A Hill, M Hill - Porifera research: biodiversity …, 2007 - natelemoine.com	- pp. 59-88 Hentschel U- Hopke J- Horn M- Friedrich AB- Wagner M- Hacker J- Moore BS -2002---Molecular evidence for a - 3- 1-9 Jiang L- Morin PJ -2004- Temperature-dependent interactions--explain unexpected responses to environmental warming in communities of competitors -	Cited by 60	https://www.natelemoine.com/pdfs/Lemoine%20et%20al%202008.pdf	Assessing-the-utility-of-sponge-microbial-symbiont-communities-as-models-to-study-global-climate-change--a-case-study-with-Halichondria-bowerbanki	6/2/2021 9:29:49 PM
Research with a hacker ethos: what DIY means for tangible interaction research	https://dl.acm.org/doi/abs/10.1145/2090150.2090156	A Williams, A Gibb, D Weekly - Interactions, 2012 - dl.acm.org	- While the open source hardware movement is creating new models for stimulating and profiting--from technological innovation- hacker-spaces are - Now open source versions of these tools are--beginning to proliferate- and to be affordable to grassroots communities of ordinary -	Cited by 32	http://aliciagibb.com/wp-content/uploads/2013/01/Research-with-a-Hacker-Ethos1.pdf	Research-with-a-hacker-ethos--what-DIY-means-for-tangible-interaction-research	6/2/2021 9:29:53 PM
Spatial pattern analysis in Namaqualand desert plant communities: evidence for general positive interactions	https://link.springer.com/article/10.1023/A:1009857824912	NS Eccles, KJ Esler, RM Cowling - Plant Ecology, 1999 - Springer	- Spatial pattern analysis in Namaqualand desert plant communities- evidence for general positive--interactions - Abstract This paper investigates of the spatial arrangement of individual plants in--mapped plots in two desert communities in the winter rainfall region of South Africa -	Cited by 108	http://uir.unisa.ac.za/bitstream/handle/10500/19758/Spatial%20pattern%20analysis%20in%20Namaqualand%20desert%20plant%20communities.%20evidence%20for%20general%20positive%20interactions..pdf?sequence=1	Spatial-pattern-analysis-in-Namaqualand-desert-plant-communities--evidence-for-general-positive-interactions	6/2/2021 9:30:00 PM
Fear and the safety net: Evidence from secure communities	https://www.nber.org/papers/w24731	M Alsan, C Yang - 2018 - nber.org	- To make progress on this question- we study the introduction of a far-reaching immigration--enforcement program known as Secure Communities -SC- - Estimating direct effects has been--the subject of several studies in public health -Vargas and Pirog 2016- Hacker et al -	Cited by 67	https://www.nber.org/system/files/working_papers/w24731/w24731.pdf	Fear-and-the-safety-net--Evidence-from-secure-communities	6/2/2021 9:30:05 PM
Darknet and deepnet mining for proactive cybersecurity threat intelligence	https://ieeexplore.ieee.org/abstract/document/7745435/	E Nunes, A Diab, A Gunn, E Marin… - … IEEE Conference on …, 2016 - ieeexplore.ieee.org	- plat- forms. Studying these hacker communities gives insights in the social--relationships. Also- the distribution of information amongst users in these--communities based on their skill level and reputation -13-- -14-- -11-. These -	Cited by 137	https://arxiv.org/pdf/1607.08583	Darknet-and-deepnet-mining-for-proactive-cybersecurity-threat-intelligence	6/2/2021 9:30:14 PM
Detection and phylogenetic relationships of highly diverse uncultured acidobacterial communities in Altamira Cave using 23S rRNA sequence analyses	https://www.tandfonline.com/doi/abs/10.1080/01490450500248986	J Zimmermann, JM Gonzalez… - Geomicrobiology …, 2005 - Taylor & Francis	- Views. 96. CrossRef citations to date. Altmetric. Listen. Original Articles. Detection--and Phylogenetic Relationships of Highly Diverse Uncultured Acidobacterial--Communities in Altamira Cave Using 23S rRNA Sequence Analyses -	Cited by 147	https://www.researchgate.net/profile/Johannes_Zimmermann3/publication/248985059_Detection_and_Phylogenetic_Relationships_of_Highly_Diverse_Uncultured_Acidobacterial_Communities_in_Altamira_Cave_Using_23S_rRNA_Sequence_Analyses/links/57a32e4708aef3c1a7b3dc12/Detection-and-Phylogenetic-Relationships-of-Highly-Diverse-Uncultured-Acidobacterial-Communities-in-Altamira-Cave-Using-23S-rRNA-Sequence-Analyses.pdf	Detection-and-phylogenetic-relationships-of-highly-diverse-uncultured-acidobacterial-communities-in-Altamira-Cave-using-23S-rRNA-sequence-analyses	6/2/2021 9:30:17 PM
Culture-independent characterization of bacterial communities associated with the cold-water coral Lophelia pertusa in the northeastern Gulf of Mexico	https://www.ncbi.nlm.nih.gov/pmc/articles/pmc2675238/	CA Kellogg, JT Lisle, JP Galkiewicz - Applied and environmental …, 2009 - ncbi.nlm.nih.gov	- Culture-Independent Characterization of Bacterial Communities Associated with the--Cold-Water Coral Lophelia pertusa in the Northeastern Gulf of Mexico - - - -Fig.3-3- indicate--some conservation of microbial communities within geographic sites -	Cited by 109	https://www.ncbi.nlm.nih.gov/pmc/articles/pmc2675238/	Culture-independent-characterization-of-bacterial-communities-associated-with-the-cold-water-coral-Lophelia-pertusa-in-the-northeastern-Gulf-of-Mexico	6/2/2021 9:30:23 PM
The role of online trading communities in managing internet auction fraud	https://www.jstor.org/stable/25148819	CEH Chua, J Wareham, D Robey - MIS Quarterly, 2007 - JSTOR	- Page 3. Chua et al.-Online Trading Communities - Internet Auction Fraud - The remaining two--characteristics are challenge -reflecting the hacker-s ethic- and multiplication -the value of stolen--information in enabling additional crimes-. Oppenheim 2001- Roth 2000- Snyder 2000- -	Cited by 121	https://scholarsmine.mst.edu/cgi/viewcontent.cgi?article=1285&context=bio_inftec_facwork	The-role-of-online-trading-communities-in-managing-internet-auction-fraud	6/2/2021 9:30:28 PM
Bottom-up and top-down interactions in coastal interface systems	https://books.google.com/books?hl=en&lr=&id=3S47CQAAQBAJ&oi=fnd&pg=PA157&dq=%2Bhacker+%2Bcommunities&ots=g-qRLuCfhc&sig=vbrJpI4Ew2nSTwrFRTjvhTR3atQ	…, KJ Nielsen, J Alberti, F Chan, SD Hacker… - … ecology: bottom-up …, 2015 - books.google.com	158 BAKKER ET AL. conditions dependent on a rhythm set by the tides. In this chapter- we--focus on rocky intertidal and salt marsh ecosystems- which have been extensively studied--on many continents. Both rocky shore and salt marsh communities exhibit strong and -	Cited by 7	https://www.researchgate.net/profile/Maarten_Schrama/publication/278390300_Bottom-up_and_top-down_interactions_in_coastal_interface_systems/links/57ce80c708ae057987ab8c36.pdf	Bottom-up-and-top-down-interactions-in-coastal-interface-systems	6/2/2021 9:30:31 PM
Primate communities: past, present, and possible future	https://onlinelibrary.wiley.com/doi/abs/10.1002/ajpa.20153	KE Reed, LR Bidner - American Journal of Physical …, 2004 - Wiley Online Library	Page 1. Primate Communities- Past- Present- and - ABSTRACT An understanding of the fundamental--causes of the structure of primate communities is impor- tant for studies of primate evolutionary--history- primate behavioral ecology- and development of conservation strategies -	Cited by 88	https://onlinelibrary.wiley.com/doi/pdf/10.1002/ajpa.20153	Primate-communities--past--present--and-possible-future	6/2/2021 9:30:35 PM
Polysaccharide capsule and sialic acid-mediated regulation promote biofilm-like intracellular bacterial communities during cystitis	https://www.ncbi.nlm.nih.gov/pmc/articles/pmc2825929/	GG Anderson, CC Goller, S Justice… - Infection and …, 2010 - ncbi.nlm.nih.gov	- Polysaccharide Capsule and Sialic Acid-Mediated Regulation Promote Biofilm-Like--Intracellular Bacterial Communities during Cystitis - - The formation of IBC has similarities--to that of biofilm communities previously modeled on abiotic surfaces -	Cited by 127	https://www.ncbi.nlm.nih.gov/pmc/articles/pmc2825929/	Polysaccharide-capsule-and-sialic-acid-mediated-regulation-promote-biofilm-like-intracellular-bacterial-communities-during-cystitis	6/2/2021 9:30:41 PM
Aquaculture induced erosion of tropical coastlines throws coastal communities back into poverty	https://www.sciencedirect.com/science/article/pii/S0964569115300223	BK Van Wesenbeeck, T Balke, P Van Eijk… - Ocean & Coastal …, 2015 - Elsevier	- land use models that honour ecological and hydrological integrity of the landscape should be--developed in close collaboration with local communities and the - 1-9. Google Scholar. Barbier--et al.- 2008 EB Barbier- EW Koch- BR Silliman- SD Hacker- E. Wolanski- J. Primavera- EF -	Cited by 57	https://www.sciencedirect.com/science/article/pii/S0964569115300223	Aquaculture-induced-erosion-of-tropical-coastlines-throws-coastal-communities-back-into-poverty	6/2/2021 9:30:44 PM
Renegades on the Frontier of Innovation: The Shanzhai Grassroots Communities of Shenzhen in China's Creative Economy	https://www.tandfonline.com/doi/abs/10.2747/1539-7216.53.2.216	M Keane, EJ Zhao - Eurasian Geography and Economics, 2012 - Taylor & Francis	- It has much to do with small-scale flexible operations- grassroots communities- and -complex--adaptive systems with emergent patterns of behaviour and - Echoing the ethos of contemporary--hacker culture and the renegade -take from the rich- spirit of The Water Margin- shanzhai -	Cited by 55	https://www.researchgate.net/profile/Michael_Keane14/publication/274681951_Renegades_on_the_Frontier_of_Innovation_The_Shanzhai_Grassroots_Communities_of_Shenzhen_in_China%27s_Creative_Economy/links/5d6f721aa6fdcc5bdcaa5682/Renegades-on-the-Frontier-of-Innovation-The-Shanzhai-Grassroots-Communities-of-Shenzhen-in-Chinas-Creative-Economy.pdf	Renegades-on-the-Frontier-of-Innovation--The-Shanzhai-Grassroots-Communities-of-Shenzhen-in-China-s-Creative-Economy	6/2/2021 9:30:48 PM
Motivations in open source software communities: The mediating role of effort intensity and goal commitment	https://www.tandfonline.com/doi/abs/10.2753/JEC1086-4415130403	W Ke, P Zhang - International Journal of Electronic Commerce, 2009 - Taylor & Francis	- Motivations in Open Source Software Communities- The Mediating Role of Effort Intensity and--Goal Commitment - The participants also provide mundane services that are critical for the viability--of the communities- such as documentation and helping new members -	Cited by 121	https://citeseerx.ist.psu.edu/viewdoc/download?doi=10.1.1.304.2734&rep=rep1&type=pdf	Motivations-in-open-source-software-communities--The-mediating-role-of-effort-intensity-and-goal-commitment	6/2/2021 9:30:53 PM
Civic crowdfunding: participatory communities, entrepreneurs and the political economy of place	https://papers.ssrn.com/sol3/papers.cfm?abstract_id=2434615	R Davies - Entrepreneurs and the Political Economy of Place (May …, 2014 - papers.ssrn.com	Page 1. Electronic copy available at- http---ssrn.com-abstract-2434615 Civic Crowdfunding---Participatory Communities- Entrepreneurs and the Political Economy of Place - 2 Page 3. Civic--Crowdfunding- Participatory Communities- Entrepreneurs and the Political Economy of Place -	Cited by 113	https://dspace.mit.edu/bitstream/handle/1721.1/89954/890127961-MIT.pdf;sequence=2	Civic-crowdfunding--participatory-communities--entrepreneurs-and-the-political-economy-of-place	6/2/2021 9:31:01 PM
Habitat-and host-related variation in sponge bacterial symbiont communities in Indonesian waters	https://academic.oup.com/femsec/article-abstract/85/3/465/583704	DFR Cleary, LE Becking, NJ Voogd… - FEMS microbiology …, 2013 - academic.oup.com	- Habitat- and host-related variation in sponge bacterial symbiont communities in Indonesian waters.--Daniel FR Cleary- Daniel FR Cleary. Departamento de Biologia- CESAM - Centro de Estudos--do Ambiente e do Mar- Universidade de Aveiro- Aveiro- Portugal -	Cited by 80	https://academic.oup.com/femsec/article/85/3/465/583704	Habitat-and-host-related-variation-in-sponge-bacterial-symbiont-communities-in-Indonesian-waters	6/2/2021 9:31:08 PM
Composition and predictive functional analysis of bacterial communities in seawater, sediment and sponges in the Spermonde Archipelago, Indonesia	https://link.springer.com/article/10.1007/s00248-015-0632-5	DFR Cleary, NJ de Voogd, ARM Polónia, R Freitas… - Microbial ecology, 2015 - Springer	- Composition and Predictive Functional Analysis of Bacterial Communities in Seawater- Sediment--and Sponges in the Spermonde Archipelago- Indonesia - Although all biotopes housed--compositionally distinct bacterial communities- there were three prominent clusters -	Cited by 51	https://www.researchgate.net/profile/Rossana_Freitas/publication/278331871_Composition_and_Predictive_Functional_Analysis_of_Bacterial_Communities_in_Seawater_Sediment_and_Sponges_in_the_Spermonde_Archipelago_Indonesia/links/5582e44908ae1b14a0a28d9a.pdf	Composition-and-predictive-functional-analysis-of-bacterial-communities-in-seawater--sediment-and-sponges-in-the-Spermonde-Archipelago--Indonesia	6/2/2021 9:31:12 PM
Feeding ecology of benthic mobile predators: experimental analyses of their influence in rocky subtidal communities of the Gulf of Maine	https://www.sciencedirect.com/science/article/pii/002209819190114C	FP Ojeda, JH Dearborn - Journal of Experimental Marine Biology and …, 1991 - Elsevier	- experimental communities F. Patricio Ojeda and John H. Dearborn Department of Zoology---University of Maine- Orono- Maine- USA - These results suggest that fishes may play an important--role on the structure -nd organization of intertidal sessile communities -	Cited by 153	https://www.researchgate.net/profile/F_Ojeda/publication/222884389_Feeding_ecology_of_benthic_mobile_predators_experimental_analyses_of_their_influence_in_rocky_subtidal_communities_of_the_Gulf_of_Maine/links/56814f6808ae1e63f1edc39f.pdf	Feeding-ecology-of-benthic-mobile-predators--experimental-analyses-of-their-influence-in-rocky-subtidal-communities-of-the-Gulf-of-Maine	6/2/2021 9:31:16 PM
Interest communities and flow roles in directed networks: the Twitter network of the UK riots	https://royalsocietypublishing.org/doi/abs/10.1098/rsif.2014.0940	M Beguerisse-Díaz… - Journal of The …, 2014 - royalsocietypublishing.org	- Section. Supplemental Material. Open Access. Research articles. Interest communities and flow--roles in directed networks- the Twitter network of the UK riots. Mariano Beguerisse-D-az - 2. Results.--2.1. Flow-based -interest communities-- a view of the network at different resolutions -	Cited by 87	https://royalsocietypublishing.org/doi/pdf/10.1098/rsif.2014.0940	Interest-communities-and-flow-roles-in-directed-networks--the-Twitter-network-of-the-UK-riots	6/2/2021 9:31:21 PM
Evaluation of patch management strategies	http://web.mit.edu/ha22286/www/papers/IJCI08.pdf	H Okhravi, D Nicol - … Journal of Computational Intelligence: Theory and …, 2008 - mit.edu	Page 1. 1 Abstract-Discovery of new vulnerabilities in software pieces from various vendors--and quick exploitation of such vulnerabilities by hacker communities to gain access to computers--and resources necessitate fast and efficient management and deployment of patches -	Cited by 26	http://web.mit.edu/ha22286/www/papers/IJCI08.pdf	Evaluation-of-patch-management-strategies	6/2/2021 9:31:26 PM
The Diversity of Bacterial Communities Associated with Atlantic Cod Gadus morhua	https://link.springer.com/content/pdf/10.1007/s00248-007-9288-0.pdf	B Wilson, BS Danilowicz, WG Meijer - Microbial ecology, 2008 - Springer	ORIGINAL ARTICLE The Diversity of Bacterial Communities Associated - assemblages. Whereas--communities from fish caught in the Baltic and Icelandic Seas were relatively stable over the three--seasons- those from fish from the North Sea changed significantly over time -	Cited by 88	https://www.academia.edu/download/53210315/s00248-007-9288-020170520-19852-psjdzp.pdf	The-Diversity-of-Bacterial-Communities-Associated-with-Atlantic-Cod-Gadus-morhua	6/2/2021 9:31:32 PM
Associated bacterial communities of two deep-water sponges	https://www.int-res.com/abstracts/ame/v39/n1/p47-55/	JB Olson, PJ McCarthy - Aquatic microbial ecology, 2005 - int-res.com	- combination of approaches will continue to provide more information on the com- position and--function of microbial communities than either - University of Washington- Seattle- WA Friedrich--AB- Merkert H- Fendert T- Hacker J- Proksch P- Hentschel U -1999- Microbial diversity in -	Cited by 69	https://www.int-res.com/articles/ame2005/39/a039p047.pdf	Associated-bacterial-communities-of-two-deep-water-sponges	6/2/2021 9:31:38 PM
Online hacker forum censorship: Would banning the bad guys attract good guys?	https://ink.library.smu.edu.sg/sis_research/3421/	QH Wang, LT Zhang, MK Qiao - 2017 - ink.library.smu.edu.sg	- Instead banning malicious attack discussion on online hacker forums may force the black--hat back to the underground hacker communities- thus making the potential cybersecurity--threats invisible to the public and hence hard to be tackled -	Cited by 4	https://ink.library.smu.edu.sg/cgi/viewcontent.cgi?article=4422&context=sis_research	Online-hacker-forum-censorship--Would-banning-the-bad-guys-attract-good-guys-	6/2/2021 9:31:42 PM
