Киберпреступность в отношении несовершеннолетних с использованием информационно-телекоммуникационных сетей: понятия, предложения …	https://cyberleninka.ru/article/n/kiberprestupnost-v-otnoshenii-nesovershennoletnih-s-ispolzovaniem-informatsionno-telekommunikatsionnyh-setey-ponyatiya	АА Оганов - Вестник Московского университета МВД России, 2020 - cyberleninka.ru	- development of the Internet- which is necessary to focus legislation- conferences- meetings---congresses- forums- meetings- etc - ------------ ----- ----------- ------------------------- ---------- - ------------- ------------ - ----- ------ ---- DarkNet- VPN -	Cited by 1	https://cyberleninka.ru/article/n/kiberprestupnost-v-otnoshenii-nesovershennoletnih-s-ispolzovaniem-informatsionno-telekommunikatsionnyh-setey-ponyatiya	----------------------------------------------------------------------------------------------------------------------------------	6/2/2021 12:55:41 PM
The Rise of the Right-Wing Violent Extremism Threat in Germany and Its Transnational Character	http://www.esisc.org/upload/publications/analyses/the-rise-of-the-right-wing-violent-extremism-threat-in-germany-and-its-transnational-character/The%20Rise%20of%20the%20Right-Wing%20Violent%20Extremism%20Threat%20in%20Germany%20and%20its%20Transnational%20Character_ESISC.pdf	M Caniglia, L Winkler, S Métais - 2020 - esisc.org	- 8 In the manifesto- distributed one week prior to the attack in right-wing forums and several other--pages including a Telegram channel called -Alt Right-- the perpetrator also outlines the objectives--of the attack- First- to -prove the viability of improvised weapons- second- increase -	Cited by 2	http://www.esisc.org/upload/publications/analyses/the-rise-of-the-right-wing-violent-extremism-threat-in-germany-and-its-transnational-character/The%20Rise%20of%20the%20Right-Wing%20Violent%20Extremism%20Threat%20in%20Germany%20and%20its%20Transnational%20Character_ESISC.pdf	The-Rise-of-the-Right-Wing-Violent-Extremism-Threat-in-Germany-and-Its-Transnational-Character	6/2/2021 12:55:46 PM
FloraGuard: Tackling the online illegal trade in endangered plants through a cross-disciplinary ICT-enabled methodology	https://journals.sagepub.com/doi/abs/10.1177/1043986220910297	A Lavorgna, SE Middleton… - Journal of …, 2020 - journals.sagepub.com	This article presents a part of the ongoing Economic and Social Research--Council -ESRC--funded project -FloraGuard- Tackling the illegal trade in--endangered plants- that relies on cross-disciplinar...	Cited by 5	https://journals.sagepub.com/doi/pdf/10.1177/1043986220910297	FloraGuard--Tackling-the-online-illegal-trade-in-endangered-plants-through-a-cross-disciplinary-ICT-enabled-methodology	6/2/2021 12:55:50 PM
A primer on Open Source Intelligence (OSINT) leveraging existing tools	https://e-archivo.uc3m.es/handle/10016/31698	L González Manzano - 2020 - e-archivo.uc3m.es	- Data in the darknet tools refer to those in which the darknet- that is the networN involving web--sites not indexed by common - a tool to search Neywords in videos and audios for helping in--attacNers monitoring- for instance- analysing content published in forums- social networNs -	Related articles	https://e-archivo.uc3m.es/bitstream/handle/10016/31698/OSINT_EMAVI_2020_ps.pdf?sequence=3	A-primer-on-Open-Source-Intelligence--OSINT--leveraging-existing-tools	6/2/2021 12:55:56 PM
Fighting against petty crimes: new methods to prevent, investigate and mitigate high impact petty crimes	https://re.public.polimi.it/handle/11311/1063859	A Ronchi - 2017 - re.public.polimi.it	- Criminals started long time ago to take advantage from the global networking- social media---telecommunication means and darknet- this is valid for a - amount of time they spend in a locality--where they experience petty crime may defer their complaints to online forums and social -	Related articles	https://re.public.polimi.it/bitstream/11311/1063859/1/Petty%20Crimes.pdf	Fighting-against-petty-crimes--new-methods-to-prevent--investigate-and-mitigate-high-impact-petty-crimes	6/2/2021 12:56:03 PM
Forensic analysis of privacy-oriented cryptocurrencies	https://www.sciencedirect.com/science/article/pii/S1742287619302312	W Koerhuis, T Kechadi, NA Le-Khac - Forensic Science International …, 2020 - Elsevier	- practices attract criminals- as they can use cryptocurrencies to launder money- fund terrorism--and buy illegal goods on Darknet markets -Europol - There are many discussions about Verge--and other currencies on the news and technology websites and forums from people who -	Cited by 7	https://www.researchgate.net/profile/Nhien-An-Le-Khac/publication/337154357_Forensic_Analysis_of_Privacy-Oriented_Cryptocurrencies/links/6050e3ff299bf173674abdd3/Forensic-Analysis-of-Privacy-Oriented-Cryptocurrencies.pdf	Forensic-analysis-of-privacy-oriented-cryptocurrencies	6/2/2021 12:56:07 PM
An Automatic Generation Approach of the Cyber Threat Intelligence Records Based on Multi-Source Information Fusion	https://www.mdpi.com/983870	T Sun, P Yang, M Li, S Liao - Future Internet, 2021 - mdpi.com	- These blogs or forums are established to publish CTI about the current cybersecurity events---as we call open-source threat intelligence publishing - In Porter -20-- a method using LDA topic--modeling was proposed to analyze the darknet market subreddit for evolutions of tools -	Cited by 1	https://www.mdpi.com/1999-5903/13/2/40/pdf	An-Automatic-Generation-Approach-of-the-Cyber-Threat-Intelligence-Records-Based-on-Multi-Source-Information-Fusion	6/2/2021 12:56:14 PM
No need to cut the Gordian Knot: An analytic framework for finding middle way in Digital Policy setting	https://www.delab.uw.edu.pl/wp-content/uploads/2020/07/Digital-Ecosystems-3.pdf#page=55	M Koziej - Digital Ecosystems - delab.uw.edu.pl	- This- Darknet hypothesis-- cited by Julie E. Cohen -Cohen 2012- 174-- suggests that some means--of law enforcement- such as protecting content from - channels such as peer-to-peer networks---physical media -CD and DVD-- or sharing in encrypted form using forums and e-mails -	Related articles	https://www.delab.uw.edu.pl/wp-content/uploads/2020/07/Digital-Ecosystems-3.pdf#page=55	No-need-to-cut-the-Gordian-Knot--An-analytic-framework-for-finding-middle-way-in-Digital-Policy-setting	6/2/2021 12:56:22 PM
How the use of the internet is affecting drug trafficking practices	https://eprints.soton.ac.uk/388522/1/TDXD16001ENN_FINAL.pdf	A Lavorgna - 2016 - eprints.soton.ac.uk	- legal highs- in online shops. Alongside these markets- the growth of social media--has seen the emergence of forums and mobile applications where drugs are--discussed- advertised and sometimes sold. This publication aims to -	Cited by 15	https://eprints.soton.ac.uk/388522/1/TDXD16001ENN_FINAL.pdf	How-the-use-of-the-internet-is-affecting-drug-trafficking-practices	6/2/2021 12:56:31 PM
Mattia Thibault & Gabriele Marino	https://www.academia.edu/download/57551898/vv.pdf	IJS Law - academia.edu	- the periphery inwards- covering every area of the semiosphere and beyond -some areas of the--Deep Web and the whole Darknet can easily - We can find here- for instance- image boards such--as 4chan and 8chan- forums such as Gaia Online- and online encyclopaedias such -	Related articles	https://www.academia.edu/download/57551898/vv.pdf	Mattia-Thibault---Gabriele-Marino	6/2/2021 12:56:37 PM
Data Thieves	https://financialservices.house.gov/uploadedfiles/03.15.2018_lilian_ablon_testimony.pdf	L Ablon - The Motivations of Cyber Threat Actors and …, 2018 - financialservices.house.gov	- As digital goods- payment systems- techniques- tools- and malware continue to evolve- forums--with -how to- sections remain popular - 19 A darknet or dark web is an anonymous or--semianonymous private network that uses encryption and proxies to obfuscate who is -	Cited by 6	https://financialservices.house.gov/uploadedfiles/03.15.2018_lilian_ablon_testimony.pdf	Data-Thieves	6/2/2021 12:56:41 PM
Flying in cyberspace: Policing global travel fraud	https://academic.oup.com/policing/article-abstract/15/1/103/5094543	A Hutchings - Policing: A Journal of Policy and Practice, 2021 - academic.oup.com	- Buyers selling other goods and services. The only reference found of buyers selling other products--related to re-sellers- who were on-selling the fraudulently obtained tickets. This was evidenced--by their reference to -clients- when leaving feedback on the forums -	Cited by 3	https://academic.oup.com/policing/article-pdf/15/1/103/38095830/pay063.pdf	Flying-in-cyberspace--Policing-global-travel-fraud	6/2/2021 12:56:49 PM
Blockchain research in information systems: Current trends and an inclusive future research agenda	https://aisel.aisnet.org/jais/vol20/iss9/14/	M Rossi, C Mueller-Bloch, JB Thatcher… - Journal of the …, 2019 - aisel.aisnet.org	- These forks can have renegotiate the blockchain protocol in other social spaces such as online--forums or in physical meetings - However- such blockchains are often used for criminal purposes--such as ransomware attacks and transactions on darknet marketplaces -	Cited by 52	https://core.ac.uk/download/pdf/301383052.pdf	Blockchain-research-in-information-systems--Current-trends-and-an-inclusive-future-research-agenda	6/2/2021 12:56:56 PM
Leveraging OSINT to improve threat intelligence quality	https://repositorio.ul.pt/handle/10451/37202	RCNC Azevedo - 2019 - repositorio.ul.pt	Page 1. UNIVERSIDADE DE LISBOA FACULDADE DE CI-NCIAS DEPARTAMENTO--DE INFORMATICA C Ci-ncias ULisboa Leveraging OSINT to Improve Threat--Intelligence Ouality Rui Correia Neves Cordeiro de Azevedo -	Related articles	https://repositorio.ul.pt/bitstream/10451/37202/1/ulfc124841_tm_Rui_Azevedo.pdf	Leveraging-OSINT-to-improve-threat-intelligence-quality	6/2/2021 12:57:13 PM
Social media and access to drugs online: a nationwide study in the United States and Spain among adolescents and young adults	https://helda.helsinki.fi/handle/10138/325048	A Oksanen, BL Miller, I Savolainen, A Sirola… - European journal of …, 2021 - helda.helsinki.fi	- Next- respondents were asked to identify different online resources for purchasing drugs---including darknet marketplaces and various social media platforms such as Facebook- Instagram---online dating services- and general discussion forums. Self-control -	Cited by 4	https://helda.helsinki.fi/bitstream/handle/10138/325048/1889_1861_ejpalc_13_1_0029.pdf?sequence=1	Social-media-and-access-to-drugs-online--a-nationwide-study-in-the-United-States-and-Spain-among-adolescents-and-young-adults	6/2/2021 12:57:21 PM
inTIME: A Machine Learning-Based Framework for Gathering and Leveraging Web Data to Cyber-Threat Intelligence	https://www.mdpi.com/1053772	P Koloveas, T Chantzios, S Alevizopoulou… - Electronics, 2021 - mdpi.com	- Previous Article in Journal Modular Compilation for a Hybrid Non-Causal Modelling Language.--Previous Article in Special Issue Darknet Traffic Big - share cyber-threat intelligence from a wide--variety of online sources including clear-deep-dark web sites- forums and marketplaces -	All 2 versions	https://www.mdpi.com/2079-9292/10/7/818/pdf	inTIME--A-Machine-Learning-Based-Framework-for-Gathering-and-Leveraging-Web-Data-to-Cyber-Threat-Intelligence	6/2/2021 12:57:32 PM
Social Data Mining for Crime Intelligence: Contributions to Social Data Quality Assessment and Prediction Methods	https://bradscholars.brad.ac.uk/handle/10454/16066	H Isah - 2017 - bradscholars.brad.ac.uk	- currency. The commonly traded products on these and many darknet markets - and it aimed--to achieve this through the following objectives -i- analyses of social media including--user-generated content such as blogs- forums- message boards -	Cited by 3	https://bradscholars.brad.ac.uk/bitstream/handle/10454/16066/Final_Submission.pdf?sequence=1&isAllowed=y	Social-Data-Mining-for-Crime-Intelligence--Contributions-to-Social-Data-Quality-Assessment-and-Prediction-Methods	6/2/2021 12:57:39 PM
Tomato Anomalies Detection in Greenhouse Scenarios Based on YOLO-Dense	https://www.frontiersin.org/articles/10.3389/fpls.2021.634103/full	X Wang, J Liu - Frontiers in Plant Science, 2021 - frontiersin.org	- YOLOv3 is an end-to-end object detection algorithm based on Darknet-53- and multiscale--feature fusion is done via FPN -Feature Pyramid Networks- -Lin et al.- 2017- - In the YOLOv3--network structure- the Darknet-53 network was used to extract features -	All 4 versions	https://www.frontiersin.org/articles/10.3389/fpls.2021.634103/full	Tomato-Anomalies-Detection-in-Greenhouse-Scenarios-Based-on-YOLO-Dense	6/2/2021 12:57:45 PM
Inductive and deductive reasoning to assist in cyber-attack prediction	https://ieeexplore.ieee.org/abstract/document/9031154/	E Marin, M Almukaynizi… - 2020 10th Annual …, 2020 - ieeexplore.ieee.org	- hacking activity x is observed- then there will be a cyber-attack of type y- targeting organization--0- after exactly ---It time units- with probability in -l-u--. We consider as malicious hacking activity--any vulnerability mentioned by a hacker in a collection of darkweb forums- and its -	Cited by 3	https://drive.google.com/file/d/15MDPJU_GSmgRXzTF4IG2VBX_RSgBhRBx/view	Inductive-and-deductive-reasoning-to-assist-in-cyber-attack-prediction	6/2/2021 12:57:48 PM
A market in dream: the rapid development of anonymous cybercrime	https://link.springer.com/article/10.1007/s11036-019-01440-2	G Zhou, J Zhuge, Y Fan, K Du, S Lu - Mobile Networks and Applications, 2020 - Springer	- In many dark market forums- Dream Market-s score is much higher than the other two -4- - Fig. 1--figure1. Dream Market front page. Full size image. Similar to other darknet sites- before entering--Dream Market- user needs to access the market page by Tor browser -	Cited by 3	https://www.gwern.net/docs/sr/2020-zhou.pdf	A-market-in-dream--the-rapid-development-of-anonymous-cybercrime	6/2/2021 12:57:54 PM
Organized financial cybercrime: Criminal cooperation, logistic bottlenecks, and money flows	https://link.springer.com/content/pdf/10.1007/978-3-319-78440-3_65.pdf	ER Leukfeldt, EW Kruisbergen, ER Kleemans… - The Palgrave Handbook …, 2020 - Springer	- 965 Forums as Online Meeting Places - Offender convergence settings and brokers--can be used to do just that -for more information about offender convergence settings---see the subsection -Forums as Online Meeting Places-- -	Cited by 1	https://www.researchgate.net/profile/Ew_Kruisbergen/publication/338402386_Organized_Financial_Cybercrime_Criminal_Cooperation_Logistic_Bottlenecks_and_Money_Flows/links/5e12e723a6fdcc283759b08b/Organized-Financial-Cybercrime-Criminal-Cooperation-Logistic-Bottlenecks-and-Money-Flows.pdf	Organized-financial-cybercrime--Criminal-cooperation--logistic-bottlenecks--and-money-flows	6/2/2021 12:57:58 PM
The Shift to Online Tobacco Trafficking	http://cybercrimejournal.com/HetuetalVol12Issue1IJCC2018.pdf	D Décary-Hétu, V Mousseau… - International Journal of …, 2018 - cybercrimejournal.com	- Hosted on chat-rooms and discussion forums- these first generation online illicit markets -D-cary---H-tu- 2015- are convergence settings -Soudijn - Zegers- 2012- that bring together thousands---and sometimes even more- offenders -Motoyama et al.- 2011- who can contact each -	Cited by 2	http://cybercrimejournal.com/HetuetalVol12Issue1IJCC2018.pdf	The-Shift-to-Online-Tobacco-Trafficking	6/2/2021 12:58:02 PM
Assessing market competition and vendors' size and scope on AlphaBay	https://www.sciencedirect.com/science/article/pii/S0955395918300033	M Paquet-Clouston, D Décary-Hétu… - International Journal of …, 2018 - Elsevier	- anonymizing technologies that have led to the creation of cryptomarkets -Martin- 2014a- Martin---2014b-- also known as darknet markets -Rhumorbarbe - al.- 2011- has shown that online illicit--markets have been active for more than 25 years- including discussion forums and chat -	Cited by 43	https://www.researchgate.net/profile/Masarah_Paquet-Clouston/publication/323016094_Assessing_market_competition_and_vendors'_size_and_scope_on_AlphaBay/links/5bb282f7299bf13e6059f541/Assessing-market-competition-and-vendors-size-and-scope-on-AlphaBay.pdf	Assessing-market-competition-and-vendors--size-and-scope-on-AlphaBay	6/2/2021 12:58:06 PM
CRYPTO CURRENCY‒A NEW PHENOMENON IN MONETARY CIRCULATION	https://jhumansoc-sc.kaznu.kz/index.php/1-eurasian/article/view/287	FA Jam - Central Asian Journal of Social Sciences and …, 2019 - jhumansoc-sc.kaznu.kz	- Because most of the markets in the darknet work through Tor- they can be found relatively easily--in public domains. This means that their addresses can be found- as well as customer reviews--and open forums relating to drugs sold on the market- without exposing users -		https://jhumansoc-sc.kaznu.kz/index.php/1-eurasian/article/download/287/244	CRYPTO-CURRENCY-A-NEW-PHENOMENON-IN-MONETARY-CIRCULATION	6/2/2021 12:58:18 PM
Pirates of the Pacific rim	https://www.mitpressjournals.org/doi/abs/10.1162/leon.2006.39.4.377	S Cisler - Leonardo, 2006 - MIT Press	- are traded over file-sharing networks each month -4-. As bandwidth increases- ever-larger media--files are being shared and Darknet -5- activities surge - Li- braries- however- are also trying to have--their voices heard in forums like the WIPO- long dominated by copyright holders- to -	Cited by 8	https://www.mitpressjournals.org/doi/pdf/10.1162/leon.2006.39.4.377	Pirates-of-the-Pacific-rim	6/2/2021 12:58:23 PM
Can we continue to effectively police digital crime?	https://www.sciencedirect.com/science/article/pii/S1355030617300801	G Horsman - Science & justice, 2017 - Elsevier	- Moore and Rid -41- have highlighted the -overwhelming presence of illicit content on the Tor--darknet- ranging from facilities to - prime examples include academic portals used to publish the--latest strategies and techniques for crime fighting- practitioner driven forums and blogs -	Cited by 21	http://sure.sunderland.ac.uk/id/eprint/7400/1/DF%20Threats.pdf	Can-we-continue-to-effectively-police-digital-crime-	6/2/2021 12:58:30 PM
Between Imagined Reality and Real Terrorism	https://www.inss.org.il/he/wp-content/uploads/sites/2/systemfiles/INSS.MASA-7.3-01Cohen(ENG).pdf	D Cohen - Military and Strategic Affairs, 2015 - inss.org.il	- active on the Internet- and its contents are distributed through sharing sites as well as closed--forums.48 Osama Bin Laden- the organization-s founder - This would involve a more massive use--of dual-purpose commercial encryption technologies and Darknet-TOR networks -	Cited by 4	https://www.inss.org.il/he/wp-content/uploads/sites/2/systemfiles/INSS.MASA-7.3-01Cohen(ENG).pdf	Between-Imagined-Reality-and-Real-Terrorism	6/2/2021 12:58:35 PM
Angry and Afraid: Race, Public Opinion, and the Politics of Punishment in the States	https://rave.ohiolink.edu/etdc/view?acc_num=osu1586110727735148	SW Duxbury - 2020 - rave.ohiolink.edu	- 2018. -The Network Structure of Opioid Distribution on a Darknet Cryptomarket.- Journal of--Quantitative Criminology 34 -4-- 921 - 941. Duxbury- Scott W.- and Dana L. Haynie. 2018 - Duxbury---Scott W. 2018. -Information Creation on Online Drug Forums- How Drug Use -	Related articles	https://etd.ohiolink.edu/apexprod/rws_etd/send_file/send?accession=osu1586110727735148&disposition=inline	Angry-and-Afraid--Race--Public-Opinion--and-the-Politics-of-Punishment-in-the-States	6/2/2021 12:58:47 PM
Fuzzy Graph Modelling of Anonymous Networks	https://link.springer.com/chapter/10.1007/978-3-030-52190-5_31	V Duddu, D Samanta, DV Rao - International Workshop Soft Computing …, 2018 - Springer	- While Darknet mode of operation allows nodes to connect to known nodes or run by known and--trusted people- Opennet allows nodes to connect to any - An initial seed list of TOR links was--scraped from various online dumps and forums and we used an open source tool -2- 5- to -	Cited by 1	https://arxiv.org/pdf/1803.11377	Fuzzy-Graph-Modelling-of-Anonymous-Networks	6/2/2021 12:58:54 PM
The impact of Tether grants on Bitcoin	https://www.sciencedirect.com/science/article/pii/S0165176518302556	WC Wei - Economics Letters, 2018 - Elsevier	- In October 2013- the FBI shut down the darknet marketplace- Silk Road- that operated entirely--using Bitcoin as the medium of - Contrary to anonymous claims and internet forums- we do not--find any evidence suggesting that Tether issuances can cause subsequent increases in -	Cited by 42	http://smallake.kr/wp-content/uploads/2018/12/SSRN-id3175876.pdf	The-impact-of-Tether-grants-on-Bitcoin	6/2/2021 12:58:58 PM
أدوات البحث عبر الويب ودورها في الرفع من کفاءة البحث عن المعلومة العلمية والتقنية	https://ejev.journals.ekb.eg/article_42383.html	رتيبة نحاسية, رتيبة, نوفيل… - المجلة العربية للتربية …, 2019 - ejev.journals.ekb.eg	Page 1. ------- ------ ------- ------- ----- - 7 - ------ 1029 - -- -- ----- ----- -- --------- ------ ----- --- ----- ----- -------- ------- -------- --- --- -- - ----- ------ .-- ---- -------------- ----- 3 -- ----- ----- -- -- -- - ---- -- ----- --- -------- -- -- - -- - ---- -	All 3 versions	https://ejev.journals.ekb.eg/article_42383_2433153db25ae606b533c0d822b446c1.pdf	---------------------------------------------------------------------------------	6/2/2021 12:59:03 PM
Anonymity networks and the fragile cyber ecosystem	https://www.sciencedirect.com/science/article/pii/S1353485816300289	H Haughey, G Epiphaniou, HM Al-Khateeb - Network Security, 2016 - Elsevier	- network that allows users to anonymously publish and access files and websites -called freesites---in so-called Opennet and Darknet modes. 14 The system is also extended via a number of--applications to allow anonymous social networking- discussion forums and email -	Cited by 9	https://pdfs.semanticscholar.org/0e4c/52209bf53674a73d72e7880028a0c28004b3.pdf#page=10	Anonymity-networks-and-the-fragile-cyber-ecosystem	6/2/2021 12:59:08 PM
Scanning the scanners: Sensing the Internet from a massively distributed network telescope	https://dl.acm.org/doi/abs/10.1145/3355369.3355595	P Richter, A Berger - Proceedings of the Internet Measurement …, 2019 - dl.acm.org	- address space. Thus- darknets will only be able to detect scanning activity that targets--either the entire IPv4 space- a sufficiently large random subset- or the unlikely case--of scans targeting the darknet itself -10- 18-. They cannot -	Cited by 8	https://www.akamai.com/it/it/multimedia/documents/technical-publication/scanning-the-scanners-the-internet-from-a-massively-distributed-network-telescope.pdf	Scanning-the-scanners--Sensing-the-Internet-from-a-massively-distributed-network-telescope	6/2/2021 12:59:12 PM
DERİN WEB VE KARANLIK WEB'TE SAĞLIK TİCARETİ	https://www.academia.edu/download/65499704/62_70_Sebnem_Ozdemir_Halil_Ibrahim_Gurcan.pdf	Ş ÖZDEMİR, Hİ GÜRCAN - academia.edu	- People search official and unofficial sites about health- share ideas in social media or online--communities- get support from forums- In short- people use - Deep and dark web -or darknet- are--the leading online environments where illegal health products and services are traded -	All 3 versions	https://www.academia.edu/download/65499704/62_70_Sebnem_Ozdemir_Halil_Ibrahim_Gurcan.pdf	DERİN-WEB-VE-KARANLIK-WEB-TE-SA-LIK-TİCARETİ	6/2/2021 12:59:18 PM
An Online Australian Drug Discussion: Illicit Drug Policy and the Australian Drug Discussion (AusDD) Forum	https://researchprofiles.canberra.edu.au/files/42024074/Final_Thesis_Liam_Engel_RR.pdf	LB Engel - 2020 - researchprofiles.canberra.edu.au	- This thesis is some of the first sensitive and inclusive research of online forums explicitly--concerned with drug policy - This thesis is the first sensitive and participant inclusive analysis of--forums from the iconic Bluelight platform that is attentive to drug policy- addressing a distinct -	Related articles	https://researchprofiles.canberra.edu.au/files/42024074/Final_Thesis_Liam_Engel_RR.pdf	An-Online-Australian-Drug-Discussion--Illicit-Drug-Policy-and-the-Australian-Drug-Discussion--AusDD--Forum	6/2/2021 12:59:28 PM
THE RANSOMWARE REVOLUTION: HOW EMERGING ENCRYPTION TECHNOLOGIES CREATED A PRODIGIOUS CYBER THREAT	http://unsworks.unsw.edu.au/fapi/datastream/unsworks:72179/SOURCE02?view=true	MS Ryan - 2019 - unsworks.unsw.edu.au	Page 1. THE RANSOMWARE REVOLUTION- HOW EMERGING ENCRYPTION TECHNOLOGIES--CREATED A PRODIGIOUS CYBER THREAT Matthew S. Ryan BA- MA- MPICT- MCSSD This--thesis is submitted in partial fulfilment for the degree of Doctor of Cyber Security -	Related articles	http://unsworks.unsw.edu.au/fapi/datastream/unsworks:72179/SOURCE02?view=true	THE-RANSOMWARE-REVOLUTION--HOW-EMERGING-ENCRYPTION-TECHNOLOGIES-CREATED-A-PRODIGIOUS-CYBER-THREAT	6/2/2021 12:59:35 PM
Dis-organised crime: Towards a distributed model of the organization of cybercrime	https://papers.ssrn.com/sol3/papers.cfm?abstract_id=2677113	DS Wall - The European Review of Organised Crime, 2015 - papers.ssrn.com	- It is a model that has persisted- and persists in many contemporary cybercrime forums- see for--example the reports of the takedown of the Darkode - But the structure also occurs with regularity--in investigations into -darkweb- or -darknet- activities -see for example- Martin- 2014- -	Cited by 40	https://standinggroups.ecpr.eu/sgoc/wp-content/uploads/sites/51/2020/01/wall.pdf	Dis-organised-crime--Towards-a-distributed-model-of-the-organization-of-cybercrime	6/2/2021 12:59:39 PM
