Securing cyberspace: Identifying key actors in hacker communities	https://ieeexplore.ieee.org/abstract/document/6283296/	V Benjamin, H Chen - 2012 IEEE International Conference on …, 2012 - ieeexplore.ieee.org	As the computer becomes more ubiquitous throughout society- the security of networks and--information technologies is a growing concern. Recent research has found hackers making--use of social media platforms to form communities where sharing of knowledge and tools -	Cited by 82	http://www.cryptome.org/2013/03/key-hackers.pdf	Securing-cyberspace--Identifying-key-actors-in-hacker-communities	6/2/2021 9:12:57 PM
Exploring key hackers and cybersecurity threats in chinese hacker communities	https://ieeexplore.ieee.org/abstract/document/7745436/	Z Fang, X Zhao, Q Wei, G Chen… - … IEEE Conference on …, 2016 - ieeexplore.ieee.org	Chinese hacker communities are of interest to cybersecurity researchers and investigators.--When examining Chinese hacker communities- researchers and investigators face many--challenges- including understanding the Chinese language- detecting variations in topic -	Cited by 21	https://www.researchgate.net/profile/Zhen_Fang8/publication/310496900_Exploring_key_hackers_and_cybersecurity_threats_in_Chinese_hacker_communities/links/5cae66c7a6fdcc1d498c0a39/Exploring-key-hackers-and-cybersecurity-threats-in-Chinese-hacker-communities.pdf	Exploring-key-hackers-and-cybersecurity-threats-in-chinese-hacker-communities	6/2/2021 9:13:01 PM
Tracing controversies in hacker communities: ethical considerations for internet research	https://www.tandfonline.com/doi/abs/10.1080/1369118X.2018.1486867	A Richterich - Information, Communication & Society, 2020 - Taylor & Francis	This paper reflects on the ethics of internet research on community controversies.--Specifically- it focuses on controversies concerning gendered- social interaction in hacking--communities. It addresses the question how internet researchers should treat and represent -	Cited by 7	https://www.tandfonline.com/doi/pdf/10.1080/1369118X.2018.1486867	Tracing-controversies-in-hacker-communities--ethical-considerations-for-internet-research	6/2/2021 9:13:09 PM
Developing understanding of hacker language through the use of lexical semantics	https://ieeexplore.ieee.org/abstract/document/7165943/	V Benjamin, H Chen - 2015 IEEE International Conference on …, 2015 - ieeexplore.ieee.org	- Abstract- The need for more research scrutinizing online hacker communities is a common--suggestion in recent years - Foreign language issues may also arise due to hacker communities--existing globally- presenting yet another barrier to research -	Cited by 23	http://victorbenjamin.com/papers/conference/2015/Developing%20Understanding%20of%20Hacker%20Language%20through%20the%20use%20of%20Lexical%20Semantics.pdf	Developing-understanding-of-hacker-language-through-the-use-of-lexical-semantics	6/2/2021 9:13:13 PM
Time-to-event modeling for predicting hacker IRC community participant trajectory	https://ieeexplore.ieee.org/abstract/document/6975550/	V Benjamin, H Chen - 2014 IEEE Joint Intelligence and Security …, 2014 - ieeexplore.ieee.org	- Past work documents the existence of many hacker communities with participants sharing various--cybercriminal assets and knowledge - For example- much is unknown concerning hacker behaviors---the cybercriminal supply chain- underground hacker communities- etc -	Cited by 19	http://www.victorbenjamin.com/papers/conference/2014/Time-to-event%20Modeling%20for%20Predicting%20Hacker%20IRC%20Community%20Participant%20Trajectory.pdf	Time-to-event-modeling-for-predicting-hacker-IRC-community-participant-trajectory	6/2/2021 9:13:17 PM
Exploring emerging hacker assets and key hackers for proactive cyber threat intelligence	https://www.tandfonline.com/doi/abs/10.1080/07421222.2017.1394049	S Samtani, R Chinn, H Chen… - Journal of Management …, 2017 - Taylor & Francis	- While useful- researchers and practitioners have been seeking to develop proactive--CTI by better understanding the threats present in hacker communities - What types--of hacker assets are available in underground communities -	Cited by 81	http://sagarsamtani.com/wp-content/uploads/2018/07/Samtani-et-al-2017-Exploring-Emerging-Hacker-Assets-and-Key-Hackers-for-Proactive-CTI.pdf	Exploring-emerging-hacker-assets-and-key-hackers-for-proactive-cyber-threat-intelligence	6/2/2021 9:13:20 PM
Azsecure hacker assets portal: Cyber threat intelligence and malware analysis	https://ieeexplore.ieee.org/abstract/document/7745437/	S Samtani, K Chinn, C Larson… - 2016 IEEE conference on …, 2016 - ieeexplore.ieee.org	- This research demonstrates the AZSecure Hacker Assets Portal. This portal collects and analyzes--malicious assets directly from the largely untapped and rich data source of online hacker--communities by utilizing state-of-the-art machine learning techniques -	Cited by 43	http://sagarsamtani.com/wp-content/uploads/2018/07/Samtani-et-al.-2016-AZSecure-HAP-CTI-and-Malware-Analysis.pdf	Azsecure-hacker-assets-portal--Cyber-threat-intelligence-and-malware-analysis	6/2/2021 9:13:23 PM
An analysis of open source principles in diverse collaborative communities	https://firstmonday.org/ojs/index.php/fm/article/download/1342/1262?inline=1	J Coffin - 2006 - firstmonday.org	This paper applies traits common to successful free software and open source hacker communities--as a framework to analyze three non-hacker collaborative communities. First Monday. Analysis--of open source principles in diverse collaborative communities by Jill Coffin -	Cited by 48	https://firstmonday.org/ojs/index.php/fm/article/download/1342/1262?inline=1	An-analysis-of-open-source-principles-in-diverse-collaborative-communities	6/2/2021 9:13:27 PM
Identifying digital threats in a hacker web forum	https://dl.acm.org/doi/abs/10.1145/2808797.2808878	M Macdonald, R Frank, J Mei, B Monk - Proceedings of the 2015 IEEE …, 2015 - dl.acm.org	- Chapter II provides background on critical infrastructure- before implicating hacker communities--as threats to these systems - For this reason- it becomes pertinent to analyze hacker communities.--ASONAM -15- August 25-28- 2015- Paris- France - 2015 ACM -	Cited by 46	https://www.researchgate.net/profile/Richard_Frank3/publication/301444829_Identifying_Digital_Threats_in_a_Hacker_Web_Forum/links/599d44bdaca272dff12d7b75/Identifying-Digital-Threats-in-a-Hacker-Web-Forum.pdf	Identifying-digital-threats-in-a-hacker-web-forum	6/2/2021 9:13:31 PM
Care and the construction of hacker identities, communities, and society	https://www.researchgate.net/profile/Austin_Toombs/publication/304933161_CARE_AND_THE_CONSTRUCTION_OF_HACKER_IDENTITIES_COMMUNITIES_AND_SOCIETY/links/577d3ffa08aeaee3b27e35dd.pdf	AL Toombs - 2016 - researchgate.net	I cannot meaningfully express the quality and extent of my gratitude for everyone who has--helped me get to where I am in a few pages. Rather than attempt-and inevitably fail-to do--so- I list here all those who deserve a much better thank you than I am able to give. To begin -	Cited by 7	https://www.researchgate.net/profile/Austin_Toombs/publication/304933161_CARE_AND_THE_CONSTRUCTION_OF_HACKER_IDENTITIES_COMMUNITIES_AND_SOCIETY/links/577d3ffa08aeaee3b27e35dd.pdf	Care-and-the-construction-of-hacker-identities--communities--and-society	6/2/2021 9:13:35 PM
Flooding disturbances increase resource availability and productivity but reduce stability in diverse plant communities	https://www.nature.com/articles/ncomms7092	…, T Buchmann, C Fischer, N Hacker… - Nature …, 2015 - nature.com	The natural world is increasingly defined by change. Within the next 100 years- rising--atmospheric CO 2 concentrations will continue to increase the frequency and magnitude of--extreme weather events. Simultaneously- human activities are reducing global biodiversity -	Cited by 90	https://www.nature.com/articles/ncomms7092	Flooding-disturbances-increase-resource-availability-and-productivity-but-reduce-stability-in-diverse-plant-communities	6/2/2021 9:13:40 PM
Hacker cartography: Crowdsourced geography, OpenStreetMap, and the hacker political imaginary	https://142.207.145.31/index.php/acme/article/view/1237	A McConchie - ACME: An International Journal for Critical …, 2015 - 142.207.145.31	- geoweb. Drawing on theorizations of hacker communities and the -hacker ethic- in--the literature- I explore how hacker politics -and their critiques- can be observed on--the geoweb- using specific examples from OpenStreetMap. I -	Cited by 40	https://142.207.145.31/index.php/acme/article/download/1237/1032	Hacker-cartography--Crowdsourced-geography--OpenStreetMap--and-the-hacker-political-imaginary	6/2/2021 9:13:44 PM
Knowledge creation in virtual communities–Exploring practices in open source software hacker communities	http://nrl.northumbria.ac.uk/24960/1/itmr_5_2_94_104.pdf	T Matheus, M Sarma - The International Technology …, 2015 - nrl.northumbria.ac.uk	This paper offers an exploratory conceptual and theoretical examination of knowledge--creation within virtual communities of hackers. By distinguishing between different types of--virtual communities- we argue that hacker communities involved in free and open source -	Cited by 3	http://nrl.northumbria.ac.uk/24960/1/itmr_5_2_94_104.pdf	Knowledge-creation-in-virtual-communities-Exploring-practices-in-open-source-software-hacker-communities	6/2/2021 9:13:50 PM
Towards secure and trustworthy cyberspace: Social media analytics on hacker communities	https://repository.arizona.edu/handle/10150/625640	W Li - 2017 - repository.arizona.edu	Social media analytics is a critical research area spawned by the increasing availability of--rich and abundant online user-generated content. So far- social media analytics has had a--profound impact on organizational decision making in many aspects- including product and -	Cited by 1	https://repository.arizona.edu/bitstream/handle/10150/625640/azu_etd_15764_sip1_m.pdf?sequence=1	Towards-secure-and-trustworthy-cyberspace--Social-media-analytics-on-hacker-communities	6/2/2021 9:13:56 PM
Emerging hackerspaces–peer-production generation	https://link.springer.com/chapter/10.1007/978-3-642-33442-9_7	J Moilanen - IFIP International Conference on Open Source Systems, 2012 - Springer	- The emergence of hackerspaces- fablabs and makerspaces is changing how hacker communities--and other like-minded communities function - The diversity and autonomy of hacker communities--can be described through the different type of activities that hackers participate in -	Cited by 128	https://link.springer.com/content/pdf/10.1007/978-3-642-33442-9_7.pdf	Emerging-hackerspaces-peer-production-generation	6/2/2021 9:14:01 PM
The predictability of phytophagous insect communities: host specialists as habitat specialists	https://journals.plos.org/plosone/article?id=10.1371/journal.pone.0025986	J Müller, J Stadler, A Jarzabek-Müller, H Hacker… - PLoS …, 2011 - journals.plos.org	The difficulties specialized phytophagous insects face in finding habitats with an appropriate--host should constrain their dispersal. Within the concept of metacommunities- this leads to--the prediction that host-plant specialists should sort into local assemblages according to the -	Cited by 27	https://journals.plos.org/plosone/article?id=10.1371/journal.pone.0025986	The-predictability-of-phytophagous-insect-communities--host-specialists-as-habitat-specialists	6/2/2021 9:14:05 PM
Descriptive analytics: Examining expert hackers in web forums	https://ieeexplore.ieee.org/abstract/document/6975554/	A Abbasi, W Li, V Benjamin, S Hu… - 2014 IEEE Joint …, 2014 - ieeexplore.ieee.org	- The framework encompasses text analytics for key hacker identification and analysis. In the Text--Analytics module- we employ an interaction coherence analysis -ICA- framework- to extract--interactions among the users in hacker communities as topological feature -	Cited by 67	https://www.researchgate.net/profile/Ahmed_Abbasi4/publication/286670223_Descriptive_Analytics_Examining_Expert_Hackers_in_Web_Forums/links/5a5ff6fbaca2727352458701/Descriptive-Analytics-Examining-Expert-Hackers-in-Web-Forums.pdf	Descriptive-analytics--Examining-expert-hackers-in-web-forums	6/2/2021 9:14:09 PM
Using social network analysis to identify key hackers for keylogging tools in hacker forums	https://ieeexplore.ieee.org/abstract/document/7745500/	S Samtani, H Chen - 2016 IEEE conference on intelligence and …, 2016 - ieeexplore.ieee.org	- However- the current methods of identifying and reprimanding hackers generally occurs after--attacks- rather than prior -1-. Online hacker communities can provide a valuable data source--for law enforcement to proactively identify and catch malicious individual -	Cited by 19	https://www.researchgate.net/profile/Sagar_Samtani/publication/310501083_Using_social_network_analysis_to_identify_key_hackers_for_keylogging_tools_in_hacker_forums/links/5b5cb1d5a6fdccf0b2fe8a49/Using-social-network-analysis-to-identify-key-hackers-for-keylogging-tools-in-hacker-forums.pdf	Using-social-network-analysis-to-identify-key-hackers-for-keylogging-tools-in-hacker-forums	6/2/2021 9:14:12 PM
Exploring hacker assets in underground forums	https://ieeexplore.ieee.org/abstract/document/7165935/	S Samtani, R Chinn, H Chen - 2015 IEEE international …, 2015 - ieeexplore.ieee.org	- Researching hacker assets within underground communities can help identify the tools which--may be used in a cyberattack- provide knowledge on how to implement and use such assets--and assist in organizing tools in a manner conducive to ethical reuse and education -	Cited by 70	http://sagarsamtani.com/wp-content/uploads/2018/07/Samtani-et-al-2015-Exploring-Hacker-Assets-in-Underground-Forums.pdf	Exploring-hacker-assets-in-underground-forums	6/2/2021 9:14:16 PM
Identifying, collecting, and presenting hacker community data: Forums, IRC, carding shops, and DNMs	https://ieeexplore.ieee.org/abstract/document/8587327/	PY Du, N Zhang, M Ebrahimi, S Samtani… - … on intelligence and …, 2018 - ieeexplore.ieee.org	- Key threat actor identification- sharing of hacking tools- indication of access to other hacker--communities - Access to DNMs are often indicated by other hacker communities such as hacker--forums and IRC channels -4-. Two categories of DNM data exist- product and seller -	Cited by 14	https://par.nsf.gov/servlets/purl/10086709	Identifying--collecting--and-presenting-hacker-community-data--Forums--IRC--carding-shops--and-DNMs	6/2/2021 9:14:31 PM
Hacktivism: How to respond and build around hacker communities	https://www.arifyildirim.com/ilt510/eric.sembrat.pdf	E Sembrat - 2011 - arifyildirim.com	To understand the true nature of incident response -IR-- disaster recovery -DR-- and--business continuity -BC-- company case studies prove to be excellent examples of realistic--in-practice processes. Sony Corporation- most popular for their electronics division- was -	Cited by 1	https://www.arifyildirim.com/ilt510/eric.sembrat.pdf	Hacktivism--How-to-respond-and-build-around-hacker-communities	6/2/2021 9:14:36 PM
Co-variation in soil biodiversity and biogeochemistry in northern and southern Victoria Land, Antarctica	https://scholarsarchive.byu.edu/facpub/296/	…, JE Barrett, RA Virginia, DH Wall, SC Cary, AL Hacker… - 2006 - scholarsarchive.byu.edu	Data from six sites in Victoria Land -72-77degrees S- investigating co-variation in soil--communities -microbial and invertebrate- with biogeochemical properties show the influence--of soil properties on habitat suitability varied among local landscapes as well as across -	Cited by 137	https://scholarsarchive.byu.edu/cgi/viewcontent.cgi?article=1295&context=facpub	Co-variation-in-soil-biodiversity-and-biogeochemistry-in-northern-and-southern-Victoria-Land--Antarctica	6/2/2021 9:14:39 PM
Physical stress and positive associations among marsh plants	https://www.journals.uchicago.edu/doi/abs/10.1086/285681	MD Bertness, SD Hacker - The American Naturalist, 1994 - journals.uchicago.edu	The contribution of positive interactions such as facilitations and mutualisms to the structure--and organization of natural communities has received little recent attention. Here we show--that distribution patterns of New England salt-marsh plants are strongly influenced by -	Cited by 509	https://www.researchgate.net/profile/Mark_Bertness/publication/201996159_Physical_Stress_and_Positive_Associations_Among_Marsh_Plants/links/5405c9250cf2bba34c1d98be/Physical-Stress-and-Positive-Associations-Among-Marsh-Plants.pdf	Physical-stress-and-positive-associations-among-marsh-plants	6/2/2021 9:14:43 PM
… , facilitation, and the structure of ecological communities: positive interactions play a critical, but underappreciated, role in ecological communities by reducing physical …	https://academic.oup.com/bioscience/article-abstract/51/3/235/256224	JJ Stachowicz - Bioscience, 2001 - academic.oup.com	- of interactions under a range of environmental conditions -eg- Bertness and Hacker 1994- Menge--et al. 1994- Greenlee and Callaway 1996- Bertness and Leonard 1997- have helped to answer--the question of whether positive interactions impact communities-and the answer -	Cited by 1083	https://academic.oup.com/bioscience/article/51/3/235/256224	----facilitation--and-the-structure-of-ecological-communities--positive-interactions-play-a-critical--but-underappreciated--role-in-ecological-communities-by-reducing-physical--	6/2/2021 9:14:49 PM
Achieving population health in accountable care organizations	https://ajph.aphapublications.org/doi/abs/10.2105/AJPH.2013.301254	K Hacker, DK Walker - American journal of public health, 2013 - ajph.aphapublications.org	Although -population health- is one of the Institute for Healthcare Improvement-s Triple Aim--goals- its relationship to accountable care organizations -ACOs- remains ill-defined and--lacks clarity as to how the clinical delivery system intersects with the public health system -	Cited by 141	https://www.ncbi.nlm.nih.gov/pmc/articles/PMC3682617/	Achieving-population-health-in-accountable-care-organizations	6/2/2021 9:14:56 PM
Microbial analyses of airborne dust collected from dormitory rooms predict the sex of occupants	https://onlinelibrary.wiley.com/doi/abs/10.1111/ina.12302	JC Luongo, A Barberán, R Hacker‐Cary… - Indoor …, 2017 - Wiley Online Library	We have long known that human occupants are a major source of microbes in the built--environment- thus raising the question- How much can we learn about the occupants of a--building by analyzing the microbial communities found in indoor air- We investigated -	Cited by 45	http://fiererlab.org/wp-content/uploads/2014/09/Luongo_et_al-2016-Indoor_Air.pdf	Microbial-analyses-of-airborne-dust-collected-from-dormitory-rooms-predict-the-sex-of-occupants	6/2/2021 9:15:00 PM
The role of positive interactions in communities: lessons from intertidal habitats	https://esajournals.onlinelibrary.wiley.com/doi/abs/10.1890/0012-9658(1997)078[1976:TROPII]2.0.CO;2	MD Bertness, GH Leonard - Ecology, 1997 - Wiley Online Library	- Diagrammatic summary of the roles of positive and negative interactions on the structure of--southern New England marsh plant communities- based on Howes et al. -1981- 1986-- Bertness---1991a-b-- Bertness and Shumway -1993-- Bertness and Hacker -1994-- and Bertness -	Cited by 668	https://www.researchgate.net/profile/Mark_Bertness/publication/201996160_The_Role_of_Positive_Interactions_in_Communities_Lessons_from_Intertidal_Habitats/links/53e203330cf2d79877a9fdda/The-Role-of-Positive-Interactions-in-Communities-Lessons-from-Intertidal-Habitats.pdf	The-role-of-positive-interactions-in-communities--lessons-from-intertidal-habitats	6/2/2021 9:15:04 PM
External hacker communities and industry-wide innovation sources	https://www.researchgate.net/profile/Mike_Pinder/publication/335740535_External_hacker_communities_and_industry-wide_innovation_sources_The_role_of_disruptive_autonomous_end-users_and_consumers_on_internal_RD_teams_within_device_manufacturing_firms/links/5d78bf50a6fdcc9961c006f4/External-hacker-communities-and-industry-wide-innovation-sources-The-role-of-disruptive-autonomous-end-users-and-consumers-on-internal-R-D-teams-within-device-manufacturing-firms.pdf	BA Mike Pinder - 2016 - researchgate.net	In a qualitative study of hacker innovation communities and their influence internally on--firms- it is found that strategically significant codified feature-based knowledge generated--externally by hacker communities is absorbed by firms through passive- non-engaged -	Related articles	https://www.researchgate.net/profile/Mike_Pinder/publication/335740535_External_hacker_communities_and_industry-wide_innovation_sources_The_role_of_disruptive_autonomous_end-users_and_consumers_on_internal_RD_teams_within_device_manufacturing_firms/links/5d78bf50a6fdcc9961c006f4/External-hacker-communities-and-industry-wide-innovation-sources-The-role-of-disruptive-autonomous-end-users-and-consumers-on-internal-R-D-teams-within-device-manufacturing-firms.pdf	External-hacker-communities-and-industry-wide-innovation-sources	6/2/2021 9:15:08 PM
Coastal ecosystem-based management with nonlinear ecological functions and values	https://science.sciencemag.org/content/319/5861/321.abstract	EB Barbier, EW Koch, BR Silliman, SD Hacker… - …, 2008 - science.sciencemag.org	A common assumption is that ecosystem services respond linearly to changes in habitat--size. This assumption leads frequently to an -all or none- choice of either preserving coastal--habitats or converting them to human use. However- our survey of wave attenuation data -	Cited by 967	https://www.researchgate.net/profile/Carrie_Kappel/publication/5649837_Coastal_Ecosystem-Based_Management_with_Nonlinear_Ecological_Functions_and_Values/links/09e41509abcd4e7045000000.pdf	Coastal-ecosystem-based-management-with-nonlinear-ecological-functions-and-values	6/2/2021 9:15:12 PM
The classification of hackers by knowledge exchange behaviors	https://link.springer.com/article/10.1007/s10796-015-9567-0	X Zhang, A Tsang, WT Yue, M Chau - Information Systems Frontiers, 2015 - Springer	- Overall- it is found that hacker communities very much represent learning communities where--meritocracy is in place - Previous studies have shown that hacker communities are heterogeneous---Chantler 1997-- which has prompted many to categorize hacker communities -	Cited by 46	https://www.researchgate.net/profile/Xiong_Zhang42/publication/279275975_The_Classification_of_Hackers_by_Knowledge_Exchange_Behaviors/links/5c91ed8c299bf111693976c9/The-Classification-of-Hackers-by-Knowledge-Exchange-Behaviors.pdf	The-classification-of-hackers-by-knowledge-exchange-behaviors	6/2/2021 9:15:15 PM
Community capacity building and sustainability: outcomes of community-based participatory research	https://www.ncbi.nlm.nih.gov/pmc/articles/PMC3557849/	K Hacker, SA Tendulkar, C Rideout… - … in community health …, 2012 - ncbi.nlm.nih.gov	Background For communities- the value of community-based participatory research -CBPR---is often manifested in the outcomes of increased capacity and sustainable adoption of--evidence-based practices for social change. Educational opportunities that promote -	Cited by 96	https://www.ncbi.nlm.nih.gov/pmc/articles/PMC3557849/	Community-capacity-building-and-sustainability--outcomes-of-community-based-participatory-research	6/2/2021 9:15:21 PM
The Protestant ethic strikes back: Open source developers and the ethic of capitalism	http://journals.uic.edu/ojs/index.php/fm/article/view/1623	T Mikkonen, T Vadén, N Vainio - First Monday, 2007 - journals.uic.edu	- has received increasing attention in both empirical studies and theories of the nature of work--in the digital age -2-. Voluntary and self-organized hacker communities have been hailed as germ--forms of a new emerging type of work- social organization and value creation -	Cited by 45	https://journals.uic.edu/ojs/index.php/fm/article/download/1623/1538	The-Protestant-ethic-strikes-back--Open-source-developers-and-the-ethic-of-capitalism	6/2/2021 9:15:24 PM
How to become a hacker	https://d.cxcore.net/Eric%20S%20Raymond/How%20To%20Become%20A%20Hacker.pdf	ES Raymond - Database and Network Journal, 2003 - d.cxcore.net	- While there had been some earlier -pre-Linux- attempts to change this situation- their impact--was at best very marginal and confined to communities of dedicated true believers which were--tiny minorities even within the hacker community- let alone with respect to the larger world -	Cited by 163	https://d.cxcore.net/Eric%20S%20Raymond/How%20To%20Become%20A%20Hacker.pdf	How-to-become-a-hacker	6/2/2021 9:15:28 PM
Linking patterns and processes in alpine plant communities: a global study	https://esajournals.onlinelibrary.wiley.com/doi/abs/10.1890/04-1926	Z Kikvidze, FI Pugnaire, RW Brooker, P Choler… - Ecology, 2005 - Wiley Online Library	- occur -Brewer et al. 1997- Hacker and Gaines 1997- Bruno et al. 2003-. In--intermediate communities- however- these processes may cancel out each other---thus impeding development of richness-enhancing spatial niches -	Cited by 253	https://scholarworks.umt.edu/cgi/viewcontent.cgi?article=1305&context=biosci_pubs	Linking-patterns-and-processes-in-alpine-plant-communities--a-global-study	6/2/2021 9:15:32 PM
