Darknet and deepnet mining for proactive cybersecurity threat intelligence	https://ieeexplore.ieee.org/abstract/document/7745435/	E Nunes, A Diab, A Gunn, E Marin… - … IEEE Conference on …, 2016 - ieeexplore.ieee.org	- Admin- istrators set up Darknet forums with communication safety for their members in mind.--While structure and organization of Darknet-hosted forums might be very similar to more familiar--web-forums- the topics and concerns of the users vary distinctly -	Cited by 137	https://arxiv.org/pdf/1607.08583	Darknet-and-deepnet-mining-for-proactive-cybersecurity-threat-intelligence	6/2/2021 12:01:57 PM
The not so dark side of the darknet: a qualitative study	https://link.springer.com/article/10.1057/s41284-018-0150-5	M Mirea, V Wang, J Jung - Security Journal, 2019 - Springer	- This paper reports on a recent research in four Darknet forums that reveals a different--aspect of the Darknet. Drawing - websites. Secondly- for various ethical reasons- not all--forums on the Darknet could be used to conduct this research -	Cited by 26	https://link.springer.com/article/10.1057/s41284-018-0150-5	The-not-so-dark-side-of-the-darknet--a-qualitative-study	6/2/2021 12:02:03 PM
The Ransomware-as-a-Service economy within the darknet	https://www.sciencedirect.com/science/article/pii/S0167404820300468	PH Meland, YFF Bayoumy, G Sindre - Computers & Security, 2020 - Elsevier	- We have studied contemporary darknet markets and forums over a period of two years using--a netnographic research approach - Open darknet forums allow members to share knowledge--and eventually improve their skills and create partnerships with others -	Cited by 5	https://www.sciencedirect.com/science/article/pii/S0167404820300468	The-Ransomware-as-a-Service-economy-within-the-darknet	6/2/2021 12:02:07 PM
Using stylometry to track cybercriminals in darknet forums	https://essay.utwente.nl/75908/	A Ekambaranathan - 2018 - essay.utwente.nl	Darknet markets are becoming increasingly popular- making it important for law enforcement--agencies to be aware of state of the art techniques on tracking and analysing key--participants. In this work- we present an unsupervised method for linking user pseudonyms -	Cited by 2	http://essay.utwente.nl/75908/1/Ekambaranathan_MA_EEMCS.pdf	Using-stylometry-to-track-cybercriminals-in-darknet-forums	6/2/2021 12:02:14 PM
Black-hat hackers' crisis information processing in the darknet: a case study of cyber underground market shutdowns	https://www.emerald.com/insight/content/doi/10.1108/S2050-206020180000017007/full/html	KH Kwon, J Shakarian - Networks, Hacking, and Media–CITA MS …, 2018 - emerald.com	- network structure of black-hat markets. The chapter concludes that- while darknet--forums may constitute resilient- solution-oriented users- market crises potentially make--the community vulnerable by engendering internal distrust -	Cited by 7	https://www.researchgate.net/profile/Kyounghee_Kwon/publication/328751879_Chapter_7_Black-Hat_Hackers'_Crisis_Information_Processing_in_the_Darknet_A_Case_Study_of_Cyber_Underground_Market_Shutdowns/links/5c1a9082a6fdccfc70599bae/Chapter-7-Black-Hat-Hackers-Crisis-Information-Processing-in-the-Darknet-A-Case-Study-of-Cyber-Underground-Market-Shutdowns.pdf	Black-hat-hackers--crisis-information-processing-in-the-darknet--a-case-study-of-cyber-underground-market-shutdowns	6/2/2021 12:02:19 PM
DICE-E: A Framework for Conducting Darknet Identification, Collection, Evaluation with Ethics.	https://pdfs.semanticscholar.org/0689/7bd04d2ba50901d41978d4a5414cd0f4e934.pdf	V Benjamin, JS Valacich, H Chen - MIS Quarterly, 2019 - pdfs.semanticscholar.org	- data. Although the lack of research seems paradoxical given the high societal impact--of cybersecurity- this shortcoming may be explained by understanding that Darknet--forums greatly differ from traditional online commu- nities -	Cited by 22	https://pdfs.semanticscholar.org/0689/7bd04d2ba50901d41978d4a5414cd0f4e934.pdf	DICE-E--A-Framework-for-Conducting-Darknet-Identification--Collection--Evaluation-with-Ethics-	6/2/2021 12:02:23 PM
Availability of COVID-19 related products on Tor darknet markets	https://search.informit.org/doi/abs/10.3316/informit.435787950413234	R Broadhurst, M Ball, CJ Jiang - Australasian Policing, 2020 - search.informit.org	- We also reviewed six popular darknet forums or information centres for qualitative--sources of information about the response of darknet markets and consumers to the--pandemic. These information hubs were two -clearnet- forums -	Cited by 12	https://openresearch-repository.anu.edu.au/bitstream/1885/216072/1/01_Broadhurst_Availability_of_COVID-19_2020.pdf	Availability-of-COVID-19-related-products-on-Tor-darknet-markets	6/2/2021 12:02:48 PM
Darknet mining and game theory for enhanced cyber threat intelligence	https://www.jstor.org/stable/26267362	J Robertson, A Diab, E Marin, E Nunes, V Paliath… - The Cyber Defense …, 2016 - JSTOR	- To address the first question- we explore Darknet exploit markets and hacker forums through--a data collection system to scrape- parse- and filter the web data - mWhat vendors and users--have a presence in multiple Darknet-deepnet markets-forums -	Cited by 15	https://www.jstor.org/stable/pdf/26267362.pdf	Darknet-mining-and-game-theory-for-enhanced-cyber-threat-intelligence	6/2/2021 12:02:54 PM
Crimebb: Enabling cybercrime research on underground forums at scale	https://dl.acm.org/doi/abs/10.1145/3178876.3186178	S Pastrana, DR Thomas, A Hutchings… - Proceedings of the 2018 …, 2018 - dl.acm.org	- that the crawler -addresses design challenges like accessibility- unresponsive server- repeated--links- etc.-- but do not detail how the system manages access control and the potential--anti-crawling techniques implemented by underground forums. The -Darknet Market Archives -	Cited by 42	https://strathprints.strath.ac.uk/69760/1/Pastrana_etal_WWW2018_CrimeBB_enabling_cybercrime_research_underground_forums_scale.pdf	Crimebb--Enabling-cybercrime-research-on-underground-forums-at-scale	6/2/2021 12:03:00 PM
Drug dealing on Facebook, Snapchat and Instagram: A qualitative analysis of novel drug markets in the Nordic countries	https://onlinelibrary.wiley.com/doi/abs/10.1111/dar.12932	J Demant, SA Bakken, A Oksanen… - Drug and alcohol …, 2019 - Wiley Online Library	- Buyers and sellers also use encrypted platforms- such as darknet forums and the Wickr--app on their smartphones. The medium used varies across the countries- as well as--motivations for usage in connection with risk perceptions. Discussion -	Cited by 29	https://trepo.tuni.fi/bitstream/handle/10024/115882/drug_dealing_on_facebook_2019.pdf?sequence=2&isAllowed=y	Drug-dealing-on-Facebook--Snapchat-and-Instagram--A-qualitative-analysis-of-novel-drug-markets-in-the-Nordic-countries	6/2/2021 12:03:06 PM
New cyber threat discovery from darknet marketplaces	https://ieeexplore.ieee.org/abstract/document/8629658/	F Dong, S Yuan, H Ou, L Liu - 2018 IEEE Conference on Big …, 2018 - ieeexplore.ieee.org	- on darknet forums- which include 1.4 billion accounts- emails- passwords and other login--credentials in plaintext - With the downfall of several markets including Utopia and Silk Road- the--number of vendors and posts declined sharply in the darknet markets and forums -12- -	Cited by 5	https://www.researchgate.net/profile/Fangzhou_Dong2/publication/329799638_New_Cyber_Threat_Discovery_from_Darknet_Marketplaces/links/5c6fb7b0458515831f652d14/New-Cyber-Threat-Discovery-from-Darknet-Marketplaces.pdf	New-cyber-threat-discovery-from-darknet-marketplaces	6/2/2021 12:03:10 PM
The language of legal and illegal activity on the Darknet	https://arxiv.org/abs/1905.05543	L Choshen, D Eldad, D Hershcovich, E Sulem… - arXiv preprint arXiv …, 2019 - arxiv.org	- This simple classifier features fre- quently in work on text classification in the Darknet - Illegal Onion--Forums NB 74.1 50.9 78.4 50.9 72.4 SVM 85.3 75.9 56.0 81.9 81.0 BoEsum 25.9 32.8 21.6 36.2--35.3 BoEaverage 40.5 42.2 31.9 48.3 53.4 seq2vec 50.0 48.9 50.9 28.4 51.7 -	Cited by 4	https://arxiv.org/pdf/1905.05543	The-language-of-legal-and-illegal-activity-on-the-Darknet	6/2/2021 12:03:15 PM
Data capture and analysis of darknet markets	https://papers.ssrn.com/sol3/papers.cfm?abstract_id=3344936	M Ball, R Broadhurst - Available at SSRN 3344936, 2021 - papers.ssrn.com	- Examples include dedicated clearnet information sites such as the now defunct -Deep-dot-web---and sub-reddit darknet forums now replaced by other clearnet sites -eg https---dark.fail- and--https---darknetlive.com-- and some hidden services -eg The Hub- Dread- the Hidden Wiki- -	Cited by 15	https://www.gwern.net/docs/sr/2019-ball.pdf	Data-capture-and-analysis-of-darknet-markets	6/2/2021 12:03:19 PM
Identifying mobile malware and key threat actors in online hacker forums for proactive cyber threat intelligence	https://ieeexplore.ieee.org/abstract/document/8004867/	J Grisham, S Samtani, M Patton… - 2017 IEEE International …, 2017 - ieeexplore.ieee.org	- C. Hacker Forum Research Hackers utilize many avenues of communication and--information sharing such as Internet-Relay-Chat -IRC-- carding shops- DarkNet--Marketplaces- and hacker forums -11-. Among these- forums offer -	Cited by 24	https://www.researchgate.net/profile/Sagar_Samtani/publication/319053742_Identifying_mobile_malware_and_key_threat_actors_in_online_hacker_forums_for_proactive_cyber_threat_intelligence/links/5b5cb23b0f7e9bc79a6c4897/Identifying-mobile-malware-and-key-threat-actors-in-online-hacker-forums-for-proactive-cyber-threat-intelligence.pdf	Identifying-mobile-malware-and-key-threat-actors-in-online-hacker-forums-for-proactive-cyber-threat-intelligence	6/2/2021 12:03:22 PM
Concepts of illicit drug quality among darknet market users: Purity, embodied experience, craft and chemical knowledge	https://www.sciencedirect.com/science/article/pii/S0955395915003503	A Bancroft, PS Reid - International Journal of Drug Policy, 2016 - Elsevier	- Qualitative interviews with darknet users were conducted- then forum data was analysed--again - Market forums are a case of indigenous harm reduction where users share advise--and experiences and can be usefully engaged with on these terms -	Cited by 120	https://osf.io/preprints/socarxiv/ruk4e/download	Concepts-of-illicit-drug-quality-among-darknet-market-users--Purity--embodied-experience--craft-and-chemical-knowledge	6/2/2021 12:03:28 PM
Predicting cyber threats through the dynamics of user connectivity in darkweb and deepweb forums	https://drive.google.com/file/d/1QezNal8QuJcy-sju5-M_4j37gQza8hJX/view	M Almukaynizi, A Grimm, E Nunes… - ACM Computational …, 2017 - drive.google.com	- are missing from the JSON les -eg- the disclosure date-. D2web Forums. We use--a database of posts collected from 151 darknet and deepnet forums. The data--collection system is described 3https---www.symantec.com in -12- -	Cited by 12	https://drive.google.com/file/d/1QezNal8QuJcy-sju5-M_4j37gQza8hJX/view	Predicting-cyber-threats-through-the-dynamics-of-user-connectivity-in-darkweb-and-deepweb-forums	6/2/2021 12:03:32 PM
Key player identification in underground forums over attributed heterogeneous information network embedding framework	https://dl.acm.org/doi/abs/10.1145/3357384.3357876	Y Zhang, Y Fan, Y Ye, L Zhao, C Shi - Proceedings of the 28th ACM …, 2019 - dl.acm.org	Page 1. Key Player Identification in Underground Forums over - ABSTRACT Online underground--forums have been widely used by cybercrimi- nals to exchange knowledge and trade in illicit--products or services- which have played a central role in the cybercriminal ecosystem -	Cited by 13	https://par.nsf.gov/servlets/purl/10135593	Key-player-identification-in-underground-forums-over-attributed-heterogeneous-information-network-embedding-framework	6/2/2021 12:03:54 PM
Extracting cyber threat intelligence from hacker forums: Support vector machines versus convolutional neural networks	https://ieeexplore.ieee.org/abstract/document/8258359/	I Deliu, C Leichter, K Franke - 2017 IEEE International …, 2017 - ieeexplore.ieee.org	- -28-- uses binomial classification to categorize hacker forums posts and marketplace products--into two classes- -a- relevant and -b- irrelevant to cyber security. The authors reported the--discovery of 16 zero-day exploits by monitoring multiple marketplaces from Darknet over a -	Cited by 31	https://www.researchgate.net/profile/Carl_Leichter/publication/322515698_Extracting_cyber_threat_intelligence_from_hacker_forums_Support_vector_machines_versus_convolutional_neural_networks/links/5fd7cea0a6fdccdcb8c9b2a9/Extracting-cyber-threat-intelligence-from-hacker-forums-Support-vector-machines-versus-convolutional-neural-networks.pdf	Extracting-cyber-threat-intelligence-from-hacker-forums--Support-vector-machines-versus-convolutional-neural-networks	6/2/2021 12:03:58 PM
The 21st Century DarkNet Market: Lessons from the Fall of Silk Road.	https://www.zenodo.net/record/58521/files/LacsonJonesvol10issue1IJCC2016.pdf	W Lacson, B Jones - International Journal of Cyber Criminology, 2016 - zenodo.net	- 53 2a. Does this opinion differ between forums- Figure 6 Figure 7 Page 15. Lacson--- Jones - The 21st Century DarkNet Market- Lessons from the Fall of Silk Road - 2016--International Journal of Cyber Criminology. All rights reserved -	Cited by 37	https://www.zenodo.net/record/58521/files/LacsonJonesvol10issue1IJCC2016.pdf	The-21st-Century-DarkNet-Market--Lessons-from-the-Fall-of-Silk-Road-	6/2/2021 12:04:02 PM
D-miner: A framework for mining, searching, visualizing, and alerting on darknet events	https://ieeexplore.ieee.org/abstract/document/8228628/	H Lawrence, A Hughes, R Tonic… - 2017 IEEE Conference …, 2017 - ieeexplore.ieee.org	- Nunes et al. -1- made a large contribution in this area by creating a similar scraper-parser system--that analyzed deepnet and darknet forums and marketplace listings. Their machine learning--algorithm was able to correctly identify zero day exploits for sale -	Cited by 7	https://www.cs.ucf.edu/~czou/research/D-miner-CNS2017.pdf	D-miner--A-framework-for-mining--searching--visualizing--and-alerting-on-darknet-events	6/2/2021 12:04:06 PM
StyleML: Stylometry with Structure and Multitask Learning for Darkweb Markets	https://arxiv.org/abs/2104.00764	P Maneriker, Y He, S Parthasarathy - arXiv preprint arXiv:2104.00764, 2021 - arxiv.org	- We provide a comprehensive evaluation of our methods across four different darknet--forums demonstrating its efficacy over the state-of-the- art- with a lift of up to 2.5X on--Mean Retrieval Rank and 2X on Recall-10. 1 Introduction -	All 2 versions	https://arxiv.org/pdf/2104.00764	StyleML--Stylometry-with-Structure-and-Multitask-Learning-for-Darkweb-Markets	6/2/2021 12:04:13 PM
Authorship analysis on dark marketplace forums	https://ieeexplore.ieee.org/abstract/document/7379716/	M Spitters, F Klaver, G Koot… - 2015 European …, 2015 - ieeexplore.ieee.org	- For example- a drug vendor will discuss and promote his merchandise on the marketplace forums---but it is very unlikely that he would do the same on his Facebook account. Also- a user-s typical--activity profile on a darknet market does not have to be similar to his activity profile -	Cited by 27	https://www.researchgate.net/profile/Martijn_Spitters/publication/279848313_Authorship_Analysis_on_Dark_Marketplace_Forums/links/55f9345008aeba1d9f188820/Authorship-Analysis-on-Dark-Marketplace-Forums.pdf	Authorship-analysis-on-dark-marketplace-forums	6/2/2021 12:04:16 PM
It's dark in there: Using systems analysis to investigate trust and engagement in dark web forums	https://link.springer.com/chapter/10.1007/978-3-319-20373-7_12	D Lacey, PM Salmon - International conference on engineering …, 2015 - Springer	- This research paved the way for future efforts in exploring how enforcement agencies and--regulators could detect and respond to the darknet- or as - et al.-s 2008- research fell short of--understanding the specific tasks involved in hosting and participating in such forums that could -	Cited by 31	https://link.springer.com/chapter/10.1007/978-3-319-20373-7_12	It-s-dark-in-there--Using-systems-analysis-to-investigate-trust-and-engagement-in-dark-web-forums	6/2/2021 12:04:20 PM
Identifying, collecting, and presenting hacker community data: Forums, IRC, carding shops, and DNMs	https://ieeexplore.ieee.org/abstract/document/8587327/	PY Du, N Zhang, M Ebrahimi, S Samtani… - … on intelligence and …, 2018 - ieeexplore.ieee.org	- Exploring threats and vulnerabilities in hacker web- Forums- IRC and carding shops ---Studying illicit drug trafficking on Darknet markets- structure and organisation from a--Canadian perspective. Forensic science international- 264- 7-14 -	Cited by 14	https://par.nsf.gov/servlets/purl/10086709	Identifying--collecting--and-presenting-hacker-community-data--Forums--IRC--carding-shops--and-DNMs	6/2/2021 12:04:41 PM
Mining key-hackers on darkweb forums	https://ieeexplore.ieee.org/abstract/document/8367642/	E Marin, J Shakarian… - 2018 1st International …, 2018 - ieeexplore.ieee.org	Page 1. Mining Key-Hackers on Darkweb Forums Ericsson Marin- Jana - this task.--We conduct our experiments using a carefully selected set of features extracted from--three highly ranked hacker forums on darkweb. Information -	Cited by 23	https://www.academia.edu/download/61049873/ICDIS_201820191028-119009-11v9gpz.pdf	Mining-key-hackers-on-darkweb-forums	6/2/2021 12:04:45 PM
You are your photographs: Detecting multiple identities of vendors in the darknet marketplaces	https://dl.acm.org/doi/abs/10.1145/3196494.3196529	X Wang, P Peng, C Wang, G Wang - Proceedings of the 2018 on Asia …, 2018 - dl.acm.org	- A key dif- ference between the darknet markets and traditional underground forums---2- 15- 23- 27- 35- 42- is that darknet markets are hosted behind Tor- making them difficult--to trace and take down. User Identities in the Darknet Markets -	Cited by 17	https://dl.acm.org/doi/pdf/10.1145/3196494.3196529	You-are-your-photographs--Detecting-multiple-identities-of-vendors-in-the-darknet-marketplaces	6/2/2021 12:04:50 PM
Predicting enterprise cyber incidents using social network analysis on dark web hacker forums	https://www.jstor.org/stable/26846122	S Sarkar, M Almukaynizi, J Shakarian… - The Cyber Defense …, 2019 - JSTOR	- -Exploring hacker assets in underground forums.- IEEE -ISI-- 2015. 2. Liu- Yang- et al. -Cloudy--with a Chance of Breach- Forecasting Cyber Security Incidents.- USENIX Security Symposium.--2015. 3. Nunes- Eric- et al. -Darknet and deepnet mining for proactive cybersecurity -	Cited by 12	https://www.jstor.org/stable/pdf/26846122.pdf	Predicting-enterprise-cyber-incidents-using-social-network-analysis-on-dark-web-hacker-forums	6/2/2021 12:04:56 PM
Complex network analysis of darknet black market forum structure	https://core.ac.uk/download/pdf/94139125.pdf	T Reksna - 2017 - core.ac.uk	- Chapter 2 Data extraction In my original darknet black market survey- I obtained virtual copies--of 35 darknet black market forums spanning over a period of 4 years -8-. 2.1 Market crawling A--large part of the work was to create a crawler to extract relevant data from these full -	Cited by 5	https://core.ac.uk/download/pdf/94139125.pdf	Complex-network-analysis-of-darknet-black-market-forum-structure	6/2/2021 12:05:01 PM
Using the Event Analysis of Systemic Teamwork (EAST) broken-links approach to understand vulnerabilities to disruption in a darknet market	https://www.tandfonline.com/doi/abs/10.1080/00140139.2019.1621392	BR Lane, PM Salmon, A Cherney, D Lacey… - Ergonomics, 2019 - Taylor & Francis	- Data collection. Working in conjunction with a third-party organisation- which works with law--enforcement to monitor darknet markets- screenshots of Dream Market and forums for our source--data were collected -eg see Figure 1-. About 40 screenshots were used in total -	Cited by 10	https://research.usc.edu.au/discovery/fulldisplay/alma99450794002621/61USC_INST:ResearchRepository?tags=scholar	Using-the-Event-Analysis-of-Systemic-Teamwork--EAST--broken-links-approach-to-understand-vulnerabilities-to-disruption-in-a-darknet-market	6/2/2021 12:05:05 PM
Structure and content of the visible Darknet	https://arxiv.org/abs/1811.01348	G Avarikioti, R Brunner, A Kiayias… - arXiv preprint arXiv …, 2018 - arxiv.org	- Con- trary to folklore belief- the visible part of the darknet is surprisingly well-connected--through hub websites such as wikis and forums. We performed a comprehensive--categorization of the content using supervised machine learning -	Cited by 6	https://arxiv.org/pdf/1811.01348	Structure-and-content-of-the-visible-Darknet	6/2/2021 12:05:14 PM
Cyber threat discovery from dark web	https://easychair.org/publications/download/MK31	A Zenebe, M Shumba, A Carillo… - Proceedings of 28th …, 2019 - easychair.org	- Looking further into the system exploit tools shows the most common tools in the dataset--that shared on the forums in the darknet - Using descriptive analytics- the research has helped--to find trends in exploit type and key actors in darknet forums -	Cited by 2	https://easychair.org/publications/download/MK31	Cyber-threat-discovery-from-dark-web	6/2/2021 12:05:19 PM
'Nice people doing shady things': Drugs and the morality of exchange in the darknet cryptomarkets	https://www.sciencedirect.com/science/article/pii/S0955395918301555	K Masson, A Bancroft - International Journal of Drug Policy, 2018 - Elsevier	- To this technical infrastructure is added the wider social infrastructure of supporting discussion--forums on the darknet and the open clearnet on which vendors- buyers and other parties exchange--information- criticise and assess different products and share experiences -	Cited by 22	https://core.ac.uk/download/pdf/210513582.pdf	-Nice-people-doing-shady-things---Drugs-and-the-morality-of-exchange-in-the-darknet-cryptomarkets	6/2/2021 12:05:24 PM
Differences in structure and dynamics of networks retrieved from dark and public web forums	https://www.sciencedirect.com/science/article/pii/S037843711930281X	M Zamani, F Rabbani, A Horicsányi, A Zafeiris… - Physica A: Statistical …, 2019 - Elsevier	- Advanced. Elsevier. Physica A- Statistical Mechanics and its Applications. Volume 525- 1 July--2019- Pages 326-336. Physica A- Statistical Mechanics and its Applications. Differences in--structure and dynamics of networks retrieved from dark and public web forums - 2. Forums -	Cited by 6	https://arxiv.org/pdf/1909.10259	Differences-in-structure-and-dynamics-of-networks-retrieved-from-dark-and-public-web-forums	6/2/2021 12:05:34 PM
Knowing your Bitcoin customer: money laundering in the Bitcoin economy	https://ieeexplore.ieee.org/abstract/document/9133692/	J Crawford, Y Guan - 2020 13th International Conference on …, 2020 - ieeexplore.ieee.org	- significant sample of existing mixing services. Because the Bitcoin forums are on--the public internet- they may underrepresent darknet-based mixing ser- vices which--are advertised on various more ephemeral darknet forums -	Cited by 5	http://sadfe.org/papers/SADFE_2020_crawford.pdf	Knowing-your-Bitcoin-customer--money-laundering-in-the-Bitcoin-economy	6/2/2021 12:05:38 PM
Detecting Cyber Threats in Non-English Hacker Forums: An Adversarial Cross-Lingual Knowledge Transfer Approach	https://ieeexplore.ieee.org/abstract/document/9283883/	M Ebrahimi, S Samtani, Y Chai… - 2020 IEEE Security and …, 2020 - ieeexplore.ieee.org	- that allows hackers to share- sell- and discuss hacking tools- knowledge- and other cyber threats--across multiple geopolitical regions such as the US- Russia- France- and others -1-. The Dark--Web comprises four major platforms- hacker forums- DarkNet Marketplaces -DNMs- -	Related articles	https://www.researchgate.net/profile/Mohammadreza_Ebrahimi/publication/342048613_Detecting_Cyber_Threats_in_Non-English_Hacker_Forums_An_Adversarial_Cross-Lingual_Knowledge_Transfer_Approach/links/5edfa743a6fdcc47689144e2/Detecting-Cyber-Threats-in-Non-English-Hacker-Forums-An-Adversarial-Cross-Lingual-Knowledge-Transfer-Approach.pdf	Detecting-Cyber-Threats-in-Non-English-Hacker-Forums--An-Adversarial-Cross-Lingual-Knowledge-Transfer-Approach	6/2/2021 12:05:42 PM
Deep & Darknet: The origins of threats	https://www.researchgate.net/profile/Claudio-Cilli/publication/340183299_Deep_Darknet_The_Origins_of_Threats/links/5e7cbbb2299bf1a91b7e8130/Deep-Darknet-The-Origins-of-Threats.pdf	C Cilli - 2020 - researchgate.net	- The soul of the black trade of the Darknet is represented- however- by the forums- among them--relies the well-known -4chan- or -7chan-- where the language used is that of hackers- defined---Leet- -also -1337-- and characterized by the use of many non-alphabetic characters and -	Cited by 2	https://www.researchgate.net/profile/Claudio-Cilli/publication/340183299_Deep_Darknet_The_Origins_of_Threats/links/5e7cbbb2299bf1a91b7e8130/Deep-Darknet-The-Origins-of-Threats.pdf	Deep---Darknet--The-origins-of-threats	6/2/2021 12:05:46 PM
The growing industry of darknet marketing	http://fileserver.idpc.net/library/the-growing-industry-of-darknet-marketing%20(1).pdf	A Afilipoaie, P Shortis - … Analysis. http://www. swansea. ac. uk …, 2015 - fileserver.idpc.net	- posting positive reviews and adverts across the Dark Net- as well as offering to -bump- vendor--offers and write reviews in forums to help - As this continues- we can expect to see more adverts--for markets going out both on the clearnet and the darknet- progressively normalising -	Cited by 9	http://fileserver.idpc.net/library/the-growing-industry-of-darknet-marketing%20(1).pdf	The-growing-industry-of-darknet-marketing	6/2/2021 12:05:51 PM
