ВИКОРИСТАННЯ МЕТОДІВ ІНТЕЛЕКТУАЛЬНОЇ ОБРОБКИ ІН-ФОРМАЦІЇ В МЕРЕЖІ DARKNET ДЛЯ ПРОТИДІЇ ТОРГІВЛІ ЛЮДЬМИ	https://core.ac.uk/download/pdf/187223214.pdf#page=141	ОФ ЛАНОВИЙ - ББК 67.611. 31я43 А43, 2017 - core.ac.uk	- web forums. Engi- neering Psychology and Cognitive Ergonomics. Vol. 9174 of Lec- ture Notes--in Computer Science. 2015 PP. 117-128. URL- https---link. springer. com-chapter-10.1007-978---3-319-20373- 7-12 ----- ---------- 22.10. 2017-. 2. Rathod Digvijaysinh. Darknet -	Related articles	https://core.ac.uk/download/pdf/187223214.pdf#page=141	------------------------------------------------------------------DARKNET-----------------------------	6/2/2021 12:18:08 PM
Classifying illegal activities on TOR network based on web textual contents	https://www.aclweb.org/anthology/E17-1004.pdf	MW Al Nabki, E Fidalgo, E Alegre, I de Paz - Proceedings of the 15th …, 2017 - aclweb.org	- 3.2 Dataset Characteristics Darknet researchers have analyzed the HS con- tents and categorized--them into a different num- ber of categories. Biryukov et al - For example- we assign Forum label--to the multi- topic forums unless the whole forum is related to a single topic -	Cited by 60	https://www.aclweb.org/anthology/E17-1004.pdf	Classifying-illegal-activities-on-TOR-network-based-on-web-textual-contents	6/2/2021 12:18:12 PM
Strafbarkeit des Unterhaltens einer Handels-und Diskussionsplattform insbesondere im sog. Darknet	http://www.zis-online.com/dat/artikel/2019_9_1314.pdf	L Greco - zis-online.com	- Darknet Von Prof - I. Einleitung Vor allem seit einigen medienwirksamen Ereignissen wird die--Einf-hrung eines eigenst-ndigen Straftatbestands gegen das Unterhalten einer Tauschb-rse--insbesondere im sog. Darknet zunehmend zur Diskussion gestellt -		http://www.zis-online.com/dat/artikel/2019_9_1314.pdf	Strafbarkeit-des-Unterhaltens-einer-Handels-und-Diskussionsplattform-insbesondere-im-sog--Darknet	6/2/2021 12:18:18 PM
Detecting and disrupting criminal networks	https://www.academia.edu/download/60877449/Detecting_and_Disrupting_Criminal_Networks__P.A.C._Duijn_201620191012-24593-vbpgus.pdf	PAC Duijn - University of Amsterdam, 2016 - academia.edu	- This process is enabled by the presence of offender convergence settings- which can be--represented by physical or virtual meeting places- such as local bars- private parties- sports clubs---prisons or Darknet forums- where criminal accomplishes can be found or disclosed -	Cited by 2	https://www.academia.edu/download/60877449/Detecting_and_Disrupting_Criminal_Networks__P.A.C._Duijn_201620191012-24593-vbpgus.pdf	Detecting-and-disrupting-criminal-networks	6/2/2021 12:18:28 PM
Cyber Threats and Asymmetric Military challenges In the Context of Nuclear Security: Ukrainian and International Cases Analysis	https://www.ceeol.com/search/article-detail?id=916820	A Guchua, T Zedelashvili - ceeol.com	- Ukrainian Policymaker- Volume 7- 2020 23 drugs- renting a killer- and so on. Darknet has many--illegal forums- social networks and non- standard websites. We do not consciously discuss the--instructions for entering this system in the paper. It can be understood as an incentive -	Cited by 2	http://www.ukrpolitic.com/journals/2020/03/UP_vol_7_GochuaZedelashvili.pdf	Cyber-Threats-and-Asymmetric-Military-challenges-In-the-Context-of-Nuclear-Security--Ukrainian-and-International-Cases-Analysis	6/2/2021 12:18:34 PM
Cybercrime in East and Southeast Asia: The Case of Taiwan	https://link.springer.com/chapter/10.1007/978-3-319-61729-9_4	LSF Lin, J Nomikos - Asia-Pacific Security Challenges, 2018 - Springer	- 20. According to the SOCTA report- a growing number of Darknet forums facilitating the--exchange of CSEM- coupled with the ease of access to these networks- is leading to an--increase in the volume of material exchanged through the Darknet. 21 -	Cited by 4	http://ndl.ethernet.edu.et/bitstream/123456789/76215/1/2018_Book_Asia-PacificSecurityChallenges.pdf#page=76	Cybercrime-in-East-and-Southeast-Asia--The-Case-of-Taiwan	6/2/2021 12:18:44 PM
Trustworthy systems design using semantic risk modelling	https://eprints.soton.ac.uk/383465/	A Chakravarthy, S Wiegand, X Chen, B Nasser… - 2015 - eprints.soton.ac.uk	- As these techniques are improved- it may be possible to apply these techniques in order--to identify influential players within DarkNet forums or other criminal networks in order to--help with criminal convictions. Research Question and Approach -	Cited by 8	https://eprints.soton.ac.uk/383465/1/383465.pdf	Trustworthy-systems-design-using-semantic-risk-modelling	6/2/2021 12:18:53 PM
Producing Trust Among Illicit Actors: A Techno-Social Approach to an Online Illicit Market	https://journals.sagepub.com/doi/abs/10.1177/1360780419881158	A Bancroft, T Squirrell, A Zaunseder… - Sociological …, 2020 - journals.sagepub.com	Illicit market exchanges in cybercriminal markets are plagued by problems--of verifiability and enforceability- trust is one way to ensure reliable--exchange. It is fragile and hard to establish. One...	Cited by 4	https://www.gwern.net/docs/sr/2019-bancroft.pdf	Producing-Trust-Among-Illicit-Actors--A-Techno-Social-Approach-to-an-Online-Illicit-Market	6/2/2021 12:18:57 PM
Metagraph Aggregated Heterogeneous Graph Neural Network for Illicit Traded Product Identification in Underground Market	https://ieeexplore.ieee.org/abstract/document/9338341/	Y Fan, Y Ye, Q Peng, J Zhang, Y Zhang… - … Conference on Data …, 2020 - ieeexplore.ieee.org	- Abstract-The emerging underground markets -eg- Hack Forums- have been widely--used by cybercriminals to trade in illicit products or services- which have played a--vital role in the cybercriminal ecosystem. In order to combat -	All 4 versions	https://engineering.case.edu/groups/xusheng-xiao/sites/engineering.case.edu.groups.xusheng-xiao/files/docs/metagraph.pdf	Metagraph-Aggregated-Heterogeneous-Graph-Neural-Network-for-Illicit-Traded-Product-Identification-in-Underground-Market	6/2/2021 12:19:02 PM
Dark Vendor Profiling	https://search.proquest.com/openview/fbed63f297c7ce94c3d9bb786ff881b1/1?pq-origsite=gscholar&cbl=18750&diss=y	S Jeziorowski - 2020 - search.proquest.com	- 5.1 Darknet Market Archives - Several effective Dark Web analysis techniques have been proposed--for Dark Web Forums and primarily focus on authorship analysis where the goal is one of two--tasks- -a- user attribution- where a user is profiled and identified given an artifact they -	Related articles	https://www.gwern.net/docs/sr/2020-jeziorowski-2.pdf	Dark-Vendor-Profiling	6/2/2021 12:19:06 PM
Deep Web: The 'Dark'Side of IS	https://www.rsis.edu.sg/wp-content/uploads/2016/11/CO16275.pdf	SA Rathore - RSIS Commentaries, 2016 - rsis.edu.sg	- hacking. This and its migration into the -darknet- will make IS more dangerous than--before. Commentary TERRORIST - before. Starting from websites- terrorist groups moved--to more interactive mediums like chatrooms and forums. It -	Cited by 2	https://www.rsis.edu.sg/wp-content/uploads/2016/11/CO16275.pdf	Deep-Web--The--Dark-Side-of-IS	6/2/2021 12:19:11 PM
Οι επιθέσεις στο darknet	http://repository.library.teiwest.gr/xmlui/bitstream/handle/123456789/4485/%CE%9F%CE%99%20%CE%95%CE%A0%CE%99%CE%98%CE%95%CE%A3%CE%95%CE%99%CE%A3%20%CE%A3%CE%A4%CE%9F%20DARKNET..pdf?sequence=1&isAllowed=y	ΔΝ Δαββέτα, Γ Κοντού, Ε Μήτου - 2016 - repository.library.teiwest.gr	- ----- --------- ------------ -------- ------- -- --------- --- DARKNET--------------- ------- ------- -------- ------ ------- ----- ------ -------------- -- ------- -------- --- -------. 8 Page 9. -------- 1 - DARKNET 1.1. ------- -	Related articles	http://repository.library.teiwest.gr/xmlui/bitstream/handle/123456789/4485/%CE%9F%CE%99%20%CE%95%CE%A0%CE%99%CE%98%CE%95%CE%A3%CE%95%CE%99%CE%A3%20%CE%A3%CE%A4%CE%9F%20DARKNET..pdf?sequence=1&isAllowed=y	-----------------darknet	6/2/2021 12:19:21 PM
Das Darknet-Im Licht der Ö entlichkeit	https://blogs.urz.uni-halle.de/informatikundgesellschaft/files/2019/10/Najjar_und_Schwass.pdf	M Najjar, H Schwaÿ - blogs.urz.uni-halle.de	- Forums -Deutschland im Deep Web- zu sechs Jahren Haft verurteilt. -33- Die Formulierung--des -126a hat einige Kritik geerntet. Denn auch wenn die Zielobjek- te Darknet-Marktpl-tze--illegaler Waren sind- so ist die Formulierung -internetbasierte -	Related articles	https://blogs.urz.uni-halle.de/informatikundgesellschaft/files/2019/10/Najjar_und_Schwass.pdf	Das-Darknet-Im-Licht-der---entlichkeit	6/2/2021 12:19:28 PM
Prevention, disruption and deterrence of online child sexual exploitation and abuse	https://link.springer.com/article/10.1007/s12027-020-00625-7	E Quayle - ERA Forum, 2020 - Springer	- definition of cybercrime or cyberattacks- but while they use the cyber-enabled-cyber-dependent--dichotomy- they add a further specific-crime type- online child sexual exploitation and abuse---which includes abuse on the clear internet- darknet forums and- increasingly- the -	Related articles	https://link.springer.com/article/10.1007/s12027-020-00625-7	Prevention--disruption-and-deterrence-of-online-child-sexual-exploitation-and-abuse	6/2/2021 12:19:33 PM
Behind the curtain: The illicit trade of firearms, explosives and ammunition on the dark web	https://www.research.manchester.ac.uk/portal/files/57841517/RAND_Behind_the_curtain.pdf	GP Paoli, J Aldridge, R Nathan, R Warnes - 2017 - research.manchester.ac.uk	- to cryptomarkets. - Review of darknet community discussion forums to shed light--on the question of scamming by firearms vendors. - Preliminary investigation of--cryptomar- kets to identify those selling firearms. This included -	Cited by 34	https://www.research.manchester.ac.uk/portal/files/57841517/RAND_Behind_the_curtain.pdf	Behind-the-curtain--The-illicit-trade-of-firearms--explosives-and-ammunition-on-the-dark-web	6/2/2021 12:19:41 PM
Sex, drugs, and bitcoin: How much illegal activity is financed through cryptocurrencies?	https://academic.oup.com/rfs/article-abstract/32/5/1798/5427781	S Foley, JR Karlsen, TJ Putniņš - The Review of Financial …, 2019 - academic.oup.com	- There is little doubt that by providing a digital and anonymous payment mechanism---cryptocurrencies- such as bitcoin- have facilitated the growth of online -darknet---marketplaces in which illegal goods and services are traded -	Cited by 409	https://www.gwern.net/docs/sr/2019-foley.pdf	Sex--drugs--and-bitcoin--How-much-illegal-activity-is-financed-through-cryptocurrencies-	6/2/2021 12:19:45 PM
New psychoactive substances on dark web markets: from deal solicitation to forensic analysis of purchased substances	https://onlinelibrary.wiley.com/doi/abs/10.1002/dta.2901	B Jurásek, I Čmelo, J Svoboda, J Čejka… - Drug testing and …, 2021 - Wiley Online Library	- Keywords Darknet- Dark web- New psychoactive substances- Dream Market- MPF-47700---NPS identification 1. Introduction - their study participants22- that claimed the substances--originated on darknet. Both works- however- corroborated -	Cited by 2	https://onlinelibrary.wiley.com/doi/pdf/10.1002/dta.2901	New-psychoactive-substances-on-dark-web-markets--from-deal-solicitation-to-forensic-analysis-of-purchased-substances	6/2/2021 12:19:50 PM
Identités en confrontation: confiance et anonymat au sein des darknet markets	https://serval.unil.ch/resource/serval:BIB_S_27047.P002/REF.pdf	A Stephan - 2018 - serval.unil.ch	- M-moire de Master Identit-s en confrontation - confiance et anonymat au sein des darknet markets--Auteur - Arnaud Stephan - Abstract Master en Humanit-s Num-riques Identit-s en confrontation ---confiance et anonymat au sein des darknet markets par Arnaud Stephan -	Related articles	https://serval.unil.ch/resource/serval:BIB_S_27047.P002/REF.pdf	Identit-s-en-confrontation--confiance-et-anonymat-au-sein-des-darknet-markets	6/2/2021 12:20:02 PM
Vente de drogues illicites sur le darknet: Enchâssement des marchés de drogues physiques et virtuels	https://papyrus.bib.umontreal.ca/xmlui/handle/1866/21092	C Flamand - 2018 - papyrus.bib.umontreal.ca	Page 1. Universit- de Montr-al Vente de drogues illicites sur le darknet- Ench-ssement des--march-s de drogues physiques et virtuels Par Claudia Flamand - utilis-es par les individus--commettant des actes criminels. Il existe plusieurs sites et forums qui -	Cited by 1	https://papyrus.bib.umontreal.ca/xmlui/bitstream/handle/1866/21092/Flamand_Claudia_2018_memoire.pdf?sequence=1	Vente-de-drogues-illicites-sur-le-darknet--Ench-ssement-des-march-s-de-drogues-physiques-et-virtuels	6/2/2021 12:20:06 PM
Mixing politics and crime–the prevalence and decline of	https://www.gwern.net/docs/sr/2016-munksgaard-2.pdf	RMJ Demant - Poetics, 2016 - gwern.net	- In line with earlier research- it is found that libertarianism has a significant position within--the discussion forums. One out of 100 topics expressed a libertarian discourse - DeepDotWeb---2016-. Updated- List of darknet marketplace -tor - i2p-- 2015 -	Related articles	https://www.gwern.net/docs/sr/2016-munksgaard-2.pdf	Mixing-politics-and-crime-the-prevalence-and-decline-of	6/2/2021 12:20:10 PM
Hur svenska myndigheterna begränsas då de ska agera mot illegal verksamhet på Darknet:-Definition samt myndigheters påverkan-Svenska lagstiftningens …	https://www.diva-portal.org/smash/record.jsf?pid=diva2:1442138	P Alyass, W Samuelsson - 2020 - diva-portal.org	- opinion on the chosen topic. Statistical data is from conducting surveys with knowledgeable--respondents from forums. Due to this- the work can serve as an essential understanding of--how Darknet may impact present and future criminal investigations -	Related articles	https://www.diva-portal.org/smash/get/diva2:1442138/FULLTEXT02	Hur-svenska-myndigheterna-begr-nsas-d--de-ska-agera-mot-illegal-verksamhet-p--Darknet--Definition-samt-myndigheters-p-verkan-Svenska-lagstiftningens--	6/2/2021 12:20:15 PM
Identifier, comprendre et intervenir sur les espaces sociaux numériques liés aux drogues	https://www.cairn.info/revue-psychotropes-2017-3-page-75.htm	V Benso - Psychotropes, 2017 - cairn.info	- chemsex- les interventions de Not For Human- une action de promotion de la vaccination men-e--par l-INPES- et - l-international - pr-vention des conduites d-automutilation sur les sites de--partage de vid-os au Qu-bec- action d-Energy Control sur les forums du darknet -	Related articles	https://www.cairn.info/revue-psychotropes-2017-3-page-75.htm	Identifier--comprendre-et-intervenir-sur-les-espaces-sociaux-num-riques-li-s-aux-drogues	6/2/2021 12:20:19 PM
Crisis and collective problem solving in dark web: An exploration of a black hat forum	https://dl.acm.org/doi/abs/10.1145/3097286.3097331	KH Kwon, JH Priniski, S Sarkar, J Shakarian… - Proceedings of the 8th …, 2017 - dl.acm.org	- P. 2016. Darknet and deepnet mining for proactive cybersecurity threat intelligence.--Proceedings of - P. 2016. Exploring Malicious Hacker Forums- in Jajodia- S.---Subrahmanian- VS- Swarup- V.- and Wang- C. -Eds.-. Cyber Deception -	Cited by 7	https://www.researchgate.net/profile/Kyounghee_Kwon/publication/318477668_Crisis_and_Collective_Problem_Solving_in_Dark_Web_An_Exploration_of_a_Black_Hat_Forum/links/59e78e74a6fdccfe7f8ae1a0/Crisis-and-Collective-Problem-Solving-in-Dark-Web-An-Exploration-of-a-Black-Hat-Forum.pdf	Crisis-and-collective-problem-solving-in-dark-web--An-exploration-of-a-black-hat-forum	6/2/2021 12:20:23 PM
Revolution in crime: How cryptocurrencies have changed the criminal landscape	https://academicworks.cuny.edu/jj_etds/87/	I Groysman - 2018 - academicworks.cuny.edu	- They scraped darknet forums for the period of 2013-2017 for postings with addresses that might--not -have been caught by authorities and might not be otherwise identified in the data through--transactions with known darknet marketplaces- -Foley- et al.- 2018-. These -	Cited by 1	https://academicworks.cuny.edu/cgi/viewcontent.cgi?article=1088&context=jj_etds	Revolution-in-crime--How-cryptocurrencies-have-changed-the-criminal-landscape	6/2/2021 12:20:27 PM
Fintech forensics: Criminal investigation and digital evidence in financial technologies	https://www.sciencedirect.com/science/article/pii/S2666281720300287	B Nikkel - Forensic Science International: Digital Investigation, 2020 - Elsevier	- 3.10. Criminal financing in the underground economy. Criminals also buy and sell goods and--services from-to other criminals. Today this is most often done using various crypto currencies---with the products and services available on darknet or underground online forums -	Cited by 12	https://digitalforensics.ch/nikkel20.pdf	Fintech-forensics--Criminal-investigation-and-digital-evidence-in-financial-technologies	6/2/2021 12:20:32 PM
Social order of anonymous digital markets: Towards an economic sociology of cryptomarkets	https://www.researchgate.net/profile/Meropi_Tzanetakis/publication/328944080_Social_order_of_anonymous_digital_markets_Towards_an_economic_sociology_of_cryptomarkets/links/5becb17a299bf1124fd31f5e/Social-order-of-anonymous-digital-markets-Towards-an-economic-sociology-of-cryptomarkets.pdf	M Tzanetakis - Place, Space and Time in European Drug Use …, 2018 - researchgate.net	- structured face-to-face and four encrypted online interviews with cryptomarket users- digital--monitoring of cryptomarkets including AlphaBay- Agora- Dream Market- Nucleus and Outlaw---associated discussion forums -eg- official market forums- Subreddit DarkNet- Markets- and -	Cited by 2	https://www.researchgate.net/profile/Meropi_Tzanetakis/publication/328944080_Social_order_of_anonymous_digital_markets_Towards_an_economic_sociology_of_cryptomarkets/links/5becb17a299bf1124fd31f5e/Social-order-of-anonymous-digital-markets-Towards-an-economic-sociology-of-cryptomarkets.pdf	Social-order-of-anonymous-digital-markets--Towards-an-economic-sociology-of-cryptomarkets	6/2/2021 12:20:36 PM
Automatic Classification of text regarding Child Sexual Abusive Material	https://www.diva-portal.org/smash/record.jsf?pid=diva2:1238800	E Fleron - 2018 - diva-portal.org	- and videos. This study evaluates how methods of supervised machine learning solely--based on textual data can point us to posts on forums which are connected to the--distribution of child sexual abusive material. Feature representation -	Related articles	https://www.diva-portal.org/smash/get/diva2:1238800/FULLTEXT01.pdf	Automatic-Classification-of-text-regarding-Child-Sexual-Abusive-Material	6/2/2021 12:20:42 PM
3.10| Harm Reduction durch anonyme Drogenmärkte und Diskussionsforen im Internet?	https://www.researchgate.net/profile/Alfred_Uhl/publication/303824359_Angsterzeugung_und_Ubertreibung_als_bedenkliche_Strategie_der_Suchtpravention_und_-forschung/links/5756946a08ae155a87bab92c/Angsterzeugung-und-Uebertreibung-als-bedenkliche-Strategie-der-Suchtpraevention-und-forschung.pdf#page=193	M Tzanetakis, R von Laufenberg - Drogen-und Suchtbericht, 2016 - researchgate.net	- diese prim-r den Einfluss staatlicher Internetfilter auf die Verbreitung von Diskussionen -ber--illegale Aktivit-ten -inklusive Drogenkonsum- erforscht- stellen sie erstmals den Zusammenhang--zu Marktpl-tzen im Darknet her. So spielen f-r Barratt et al.--I- nternet forums and the -	Cited by 8	https://www.researchgate.net/profile/Alfred_Uhl/publication/303824359_Angsterzeugung_und_Ubertreibung_als_bedenkliche_Strategie_der_Suchtpravention_und_-forschung/links/5756946a08ae155a87bab92c/Angsterzeugung-und-Uebertreibung-als-bedenkliche-Strategie-der-Suchtpraevention-und-forschung.pdf#page=193	3-10--Harm-Reduction-durch-anonyme-Drogenm-rkte-und-Diskussionsforen-im-Internet-	6/2/2021 12:20:46 PM
INTRODUCING THE DEEP AND DARK WEB INTO HIGHER EDUCATION PEDAGOGY: AN EXPLORATORY STUDY.	https://iacis.org/iis/2020/1_iis_2020_141-146.pdf	G Janchenko, K Paullet, F Hartle - Issues in Information Systems, 2020 - iacis.org	- The interview link was posted in the following forums which resided on the Dark Net in 2018---The Hub- Intel Exchange- Darknet Central- and DArknetM Avengers. The forums were selected--because they were put in place for general discussions and not specific purposes -	Related articles	https://iacis.org/iis/2020/1_iis_2020_141-146.pdf	INTRODUCING-THE-DEEP-AND-DARK-WEB-INTO-HIGHER-EDUCATION-PEDAGOGY--AN-EXPLORATORY-STUDY-	6/2/2021 12:20:50 PM
UWS Academic Portal	https://core.ac.uk/download/pdf/270145787.pdf	A Bancroft, T Squirrell, A Zaunseder, I Rafanell - core.ac.uk	- Page 17. 15 be an important and useful drug there. One member asks- -Do any forums--on the darknet permit K to be bought and discussed- Reddit-s rules now make it difficult--and shady and the cryptomarkets are full of scammers or useless.- -	Related articles	https://core.ac.uk/download/pdf/270145787.pdf	UWS-Academic-Portal	6/2/2021 12:20:59 PM
Bipartite network model for inferring hidden ties in crime data	https://dl.acm.org/doi/abs/10.1145/2808797.2808842	H Isah, D Neagu, P Trundle - Proceedings of the 2015 IEEE/ACM …, 2015 - dl.acm.org	- activity- degree of cohesion and organisation. The organisation of crime may also--occur in the darknet where individuals interact within online discussion forums and--chat rooms. Identifying criminal groups within a network and -	Cited by 15	https://arxiv.org/pdf/1510.02343	Bipartite-network-model-for-inferring-hidden-ties-in-crime-data	6/2/2021 12:21:06 PM
Online drug distribution: Alternatives to physical violence in conflict resolution	https://www.researchgate.net/profile/Meropi_Tzanetakis/publication/329196318_Online_drug_distribution_Alternatives_to_physical_violence_in_conflict_resolution/links/5bfc3418458515b41d105e8b/Online-drug-distribution-Alternatives-to-physical-violence-in-conflict-resolution.pdf	M Tzanetakis - Between street and screen. Traditions and …, 2015 - researchgate.net	- This chapter discusses how the concept of using violence is transformed on darknet market- places--that offer the technological infrastructure - the interplay of vendors- customers and market--administrators- using a feedback system and information on various forums addressing a -	Cited by 9	https://www.researchgate.net/profile/Meropi_Tzanetakis/publication/329196318_Online_drug_distribution_Alternatives_to_physical_violence_in_conflict_resolution/links/5bfc3418458515b41d105e8b/Online-drug-distribution-Alternatives-to-physical-violence-in-conflict-resolution.pdf	Online-drug-distribution--Alternatives-to-physical-violence-in-conflict-resolution	6/2/2021 12:21:09 PM
0-day vulnerabilities and cybercrime	https://ieeexplore.ieee.org/abstract/document/7299983/	J Armin, P Foti, M Cremonini - 2015 10th International …, 2015 - ieeexplore.ieee.org	- the opinions of the interviewed experts are mixed. Boris Sharov believes that in--order to conduct transactions you first need to be introduced in specific darknet forums---Int-10-. According to our experience- to access the Black -	Cited by 12	http://www.cyberroad-project.eu/m/filer_public/2016/05/03/foti_ares2015.pdf	0-day-vulnerabilities-and-cybercrime	6/2/2021 12:21:22 PM
Policing virtual spaces: public and private online challenges in a legal perspective	https://www.elgaronline.com/view/edcoll/9781785369100/9781785369100.00020.xml	T Munk - Comparative Policing from a Legal Perspective, 2018 - elgaronline.com	- offenders by their online footprints. To be effective- law enforcement has been called--upon to actively monitor and secretly infiltrate virtual spaces such as the Darknet and--different social media forums. Moreover- the growing use of -	Cited by 1	https://eprints.mdx.ac.uk/28444/1/Munk%2C%20Tine%20%282018%29%20Policing%20Virtual%20Spaces.%20Public%20and%20Private%20Online%20Challenges%20in%20a%20Legal%20Perspective..pdf	Policing-virtual-spaces--public-and-private-online-challenges-in-a-legal-perspective	6/2/2021 12:21:32 PM
Nuria Lorenzo-Dus	https://www.gwern.net/docs/sr/2018-lorenzodus.pdf	M Di Cristofaro - 2018 - gwern.net	- Gwern Branwen summarises its contents as a mirror of -89 Tor-bitcoin darknet markets and--forums 2011-2015- and related material -Bitcoin- Silk Road-- created- 1 December 2013---modified- 8 March 2017- status- finished- confidence- highly likely.5 -	Related articles	https://www.gwern.net/docs/sr/2018-lorenzodus.pdf	Nuria-Lorenzo-Dus	6/2/2021 12:21:36 PM
Trailblazing the Artificial Intelligence for Cybersecurity Discipline: A Multi-Disciplinary Research Roadmap	https://dl.acm.org/doi/abs/10.1145/3430360	S Samtani, M Kantarcioglu, H Chen - 2020 - dl.acm.org	- others. However- recent years have seen a significant expansion to external data--sources such as hacker forums- DarkNet Marketplaces- carding shops- IRC channels---public news sources- and others. Conventional analytics -	Cited by 4	https://dl.acm.org/doi/pdf/10.1145/3430360	Trailblazing-the-Artificial-Intelligence-for-Cybersecurity-Discipline--A-Multi-Disciplinary-Research-Roadmap	6/2/2021 12:21:40 PM
The Cyber Defense Review: Discussions from the Front Lines of the Cyber Domain	https://www.jstor.org/stable/26267353	AO Hall - The Cyber Defense Review, 2016 - JSTOR	- The Research section concludes with Dr. Paulo Shakarian and his world class research team--at Arizona State University taking readers into the Darknet hacker communities and forums for--an intense look at this rich source of cyber threat intelligence for security analysts -		https://www.jstor.org/stable/pdf/26267353.pdf	The-Cyber-Defense-Review--Discussions-from-the-Front-Lines-of-the-Cyber-Domain	6/2/2021 12:21:45 PM
