Antarctic nematode communities: observed and predicted responses to climate change	https://link.springer.com/article/10.1007/s00300-011-1021-2	UN Nielsen, DH Wall, BJ Adams, RA Virginia - Polar Biology, 2011 - Springer	- Search SpringerLink Search. Download PDF. Original Paper- Published- 27 April 2011.--Antarctic nematode communities- observed and predicted responses to climate change ---Current nematode communities of Antarctic terrestrial ecosystems -	Cited by 38	https://citeseerx.ist.psu.edu/viewdoc/download?doi=10.1.1.662.6455&rep=rep1&type=pdf	Antarctic-nematode-communities--observed-and-predicted-responses-to-climate-change	6/2/2021 9:41:09 PM
Popularity dynamics and intrinsic quality in reddit and hacker news	https://ojs.aaai.org/index.php/ICWSM/article/view/14636	G Stoddard - Proceedings of the International AAAI Conference on …, 2015 - ojs.aaai.org	- 3 Data The design of Reddit and Hacker News are quite similar. The interface of each site--is an ordered list of articles- with 25 or 30 articles appearing on each page - Reddit Reddit--is composed of many different sub- communities called -subreddits- -	Cited by 52	https://ojs.aaai.org/index.php/ICWSM/article/download/14636/14485	Popularity-dynamics-and-intrinsic-quality-in-reddit-and-hacker-news	6/2/2021 9:41:15 PM
A case of mistaken identity? News accounts of hacker, consumer, and organizational responsibility for compromised digital records	https://academic.oup.com/jcmc/article-abstract/12/4/1229/4582987	K Erickson, PN Howard - Journal of computer-mediated …, 2007 - academic.oup.com	- be particularly malicious. Criminals who make use of hacker techniques to access--private data are rarely members of hacker communities- and often less sophisticated--in their hacker skill-set -Skibell- 2002-. More legitimate computer -	Cited by 38	https://academic.oup.com/jcmc/article/12/4/1229/4582987	A-case-of-mistaken-identity--News-accounts-of-hacker--consumer--and-organizational-responsibility-for-compromised-digital-records	6/2/2021 9:41:21 PM
Changes in epiphytic bacterial communities of intertidal seaweeds modulated by host, temporality, and copper enrichment	https://link.springer.com/content/pdf/10.1007/s00248-010-9647-0.pdf	MB Hengst, S Andrade, B González, JA Correa - Microbial ecology, 2010 - Springer	MICROBIOLOGY OF AQUATIC SYSTEMS Changes in Epiphytic Bacterial Communities of--Intertidal - resulting from copper-mine waste disposals. We found a clear and strong effect in the--structure of the bacterial communities associated with the algal species serving as host -	Cited by 44	https://www.academia.edu/download/50759635/Changes_in_epiphytic_bacterial_communiti20161206-14909-1lu2h3.pdf	Changes-in-epiphytic-bacterial-communities-of-intertidal-seaweeds-modulated-by-host--temporality--and-copper-enrichment	6/2/2021 9:41:26 PM
Does invasion of Spartina alterniflora alter microhabitats and benthic communities of salt marshes in Yangtze River estuary?	https://www.sciencedirect.com/science/article/pii/S0925857415303384	W Quan, H Zhang, Z Wu, S Jin, F Tang, J Dong - Ecological Engineering, 2016 - Elsevier	- Advanced. Elsevier. Ecological Engineering. Volume 88- March 2016- Pages 153-164. Ecological--Engineering. Does invasion of Spartina alterniflora alter microhabitats and benthic communities--of salt marshes in Yangtze River estuary - 3.4. Benthic macrofaunal communities -	Cited by 21	https://www.researchgate.net/profile/Wei-Min_Quan/publication/289557068_Does_invasion_of_Spartina_alterniflora_alter_microhabitats_and_benthic_communities_of_salt_marshes_in_Yangtze_River_estuary/links/5b84b77b92851c1e1236d154/Does-invasion-of-Spartina-alterniflora-alter-microhabitats-and-benthic-communities-of-salt-marshes-in-Yangtze-River-estuary.pdf	Does-invasion-of-Spartina-alterniflora-alter-microhabitats-and-benthic-communities-of-salt-marshes-in-Yangtze-River-estuary-	6/2/2021 9:41:30 PM
Scale, environment, and trophic status: the context dependency of community saturation in rocky intertidal communities	https://www.journals.uchicago.edu/doi/abs/10.1086/504603	R Russell, SA Wood, G Allison… - The American …, 2006 - journals.uchicago.edu	- determinant of community composition -Connell 1961- Menge and Sutherland 1987- and lead--to more regionally dominated communities higher in - documented to become increasingly important--at higher levels of abiotic stress -Bertness and Leonard 1997- Hacker and Gaines -	Cited by 61	https://www.journals.uchicago.edu/doi/full/10.1086/504603	Scale--environment--and-trophic-status--the-context-dependency-of-community-saturation-in-rocky-intertidal-communities	6/2/2021 9:41:35 PM
Measures of physical ability are unrelated to objectively measured physical activity behavior in older adults residing in continuing care retirement communities	https://www.sciencedirect.com/science/article/pii/S0003999309001567	KR Zalewski, JC Smith, J Malzahn, M VanHart… - Archives of Physical …, 2009 - Elsevier	- of physical performance are not good predictors of objectively measured daily physical activity--behavior among residents of continuing care rehabilitation communities. Supplier. Recommended--articles Citing articles -0-. References. 1 T. Steffen- T. Hacker- L. MollingerAge- and -	Cited by 44	https://www.archives-pmr.org/article/S0003-9993(09)00156-7/fulltext	Measures-of-physical-ability-are-unrelated-to-objectively-measured-physical-activity-behavior-in-older-adults-residing-in-continuing-care-retirement-communities	6/2/2021 9:41:41 PM
Temperate coastal wetlands: morphology, sediment processes, and plant communities	https://www.sciencedirect.com/science/article/pii/B9780444638939000034	P Pratolongo, N Leonardi, JR Kirby, A Plater - Coastal Wetlands, 2019 - Elsevier	- An Integrated Ecosystem Approach. 2019- Pages 105-152. Coastal Wetlands. Chapter 3 ---Temperate Coastal Wetlands- Morphology- Sediment Processes- and Plant Communities - In humid--climates- the upper salt marsh commonly grades into freshwater communities -	Cited by 50	https://www.researchgate.net/profile/Paula_Pratolongo/publication/258902602_Temperate_Coastal_Wetlands_Morphology_Sediment_Processes_and_Plant_Communities/links/5419aa970cf2218008bf9a71/Temperate-Coastal-Wetlands-Morphology-Sediment-Processes-and-Plant-Communities.pdf	Temperate-coastal-wetlands--morphology--sediment-processes--and-plant-communities	6/2/2021 9:41:45 PM
Noctuid and geometrid moth assemblages show divergent elevational gradients in body size and color lightness	https://onlinelibrary.wiley.com/doi/abs/10.1111/ecog.05558	…, S Pinkert, R Brandl, C Bässler, H Hacker… - …, 2021 - Wiley Online Library	Previous macroecological studies have suggested that larger and darker insects are favored--in cold environments and that the importance of body size and color for the absorption of--solar radiation is not limited to diurnal insects. However- whether these effects hold true for -		https://onlinelibrary.wiley.com/doi/pdf/10.1111/ecog.05558	Noctuid-and-geometrid-moth-assemblages-show-divergent-elevational-gradients-in-body-size-and-color-lightness	6/2/2021 9:41:49 PM
I am not a Hacker	https://www.alexandria.unisg.ch/260938/	P Bialski - Limn, 2017 - alexandria.unisg.ch	- many of their actions resemble those we commonly attribute to the hacker. As we have seen in--many other ethnographies of hacker communities- hacking is about experimentation- po- litical--gestures- and craftiness -Coleman 2013- 2014-. Software developers are no exception -	Cited by 2	https://www.alexandria.unisg.ch/260938/1/Bialski2017_Limn_I_am_Not_a_Hacker_-_Bialski.pdf	I-am-not-a-Hacker	6/2/2021 9:41:55 PM
Species recruitment in alpine plant communities: the role of species interactions and productivity	https://besjournals.onlinelibrary.wiley.com/doi/abs/10.1111/j.1365-2745.2010.01703.x	K Klanderud - Journal of Ecology, 2010 - Wiley Online Library	- Thus- in high-productivity communities- disturbance is needed to release competition and enhance--establishment of arriving propagules -Huston 1999 - from the resident vegetation may be important--for species recruitment -Ryser 1993- Eriksson - Fr-borg 1996- Hacker - Gaines -	Cited by 41	https://besjournals.onlinelibrary.wiley.com/doi/pdf/10.1111/j.1365-2745.2010.01703.x	Species-recruitment-in-alpine-plant-communities--the-role-of-species-interactions-and-productivity	6/2/2021 9:41:59 PM
Men's bargaining with patriarchy: The case of primaries within Hamulas in Palestinian Arab communities in Israel	https://journals.sagepub.com/doi/abs/10.1177/0891243207302571	H Herzog, T Yahia-Younis - Gender & Society, 2007 - journals.sagepub.com	- The Case of Primaries within Hamulas in Palestinian Arab Communities in Israel - In the first--section of the article- we introduce a theoretical perspective that ties together the logic of--kinship-based communities and political arrangements in modern states -	Cited by 48	https://www.academia.edu/download/53771310/Mens_Bargaining_with_Patriarchy.pdf	Men-s-bargaining-with-patriarchy--The-case-of-primaries-within-Hamulas-in-Palestinian-Arab-communities-in-Israel	6/2/2021 9:42:04 PM
'Do not hack'. Rules, values, and communal practices in hacker-and makerspaces	http://journals.uic.edu/ojs/index.php/spir/article/view/8384	A Richterich - AoIR Selected Papers of Internet Research, 2016 - journals.uic.edu	- Annika Richterich Maastricht University This paper explores which rules and values are relevant--to contemporary practices of hacking and making. It examines how members in hacker- and--makerspaces conceptualise their communities and their use of digital technology -	Cited by 1	https://journals.uic.edu/ojs/index.php/spir/article/download/8384/6669	-Do-not-hack---Rules--values--and-communal-practices-in-hacker-and-makerspaces	6/2/2021 9:42:10 PM
Temporal change in UK marine communities: trends or regime shifts?	https://onlinelibrary.wiley.com/doi/abs/10.1111/j.1439-0485.2010.00422.x	M Spencer, SNR Birchenough, N Mieszkowska… - Marine …, 2011 - Wiley Online Library	Page 1. ORIGINAL ARTICLE Temporal change in UK marine communities- trends or regime--shifts - Spencer- Birchenough- Mieszkowska- Robinson- Simpson- Frid et al. Temporal--change in UK marine communities Marine Ecology 32 -Suppl -	Cited by 44	https://www.academia.edu/download/42988826/Temporal_change_in_UK_marine_communities20160223-25587-1fg9g6b.pdf	Temporal-change-in-UK-marine-communities--trends-or-regime-shifts-	6/2/2021 9:42:16 PM
Communities of practice and epistemic communities: a renewed approach of organisational learning within the firm	https://www.marsouin.org/IMG/pdf/dupouet.pdf	P Cohendet, F Creplet, O Dupouët - Workshop on Economics and …, 2001 - marsouin.org	Page 1. 1 Communities of Practice and Epistemic Communities- A Renewed Approach--of Organisational Learning within the Firm - The organisational learning results from a--complex process of interaction between heterogeneous communities -	Cited by 55	https://www.marsouin.org/IMG/pdf/dupouet.pdf	Communities-of-practice-and-epistemic-communities--a-renewed-approach-of-organisational-learning-within-the-firm	6/2/2021 9:42:21 PM
The diversity of the bacterial communities associated with the azooxanthellate hexacoral Cirrhipathes lutkeni	https://www.nature.com/articles/ismej200777	LZ Santiago-Vázquez, TB Brück, WM Brück… - The ISME …, 2007 - nature.com	The diversity of the bacterial communities associated with the azooxanthellate hexacoral--Cirrhipathes lutkeni. Download PDF. Published- 18 October 2007 - The diversity of the bacterial--communities associated with the azooxanthellate hexacoral Cirrhipathes lutkeni -	Cited by 40	https://www.nature.com/articles/ismej200777	The-diversity-of-the-bacterial-communities-associated-with-the-azooxanthellate-hexacoral-Cirrhipathes-lutkeni	6/2/2021 9:42:25 PM
Where do we go from here? Alternative control and restoration trajectories for a marine grass (Spartina anglica) invader in different habitat types	http://citeseerx.ist.psu.edu/viewdoc/download?doi=10.1.1.295.3050&rep=rep1&type=pdf#page=224	SD Hacker, MN Dethier - Conference on Invasive Spartina, 2004 - Citeseer	Little is known about the effects of removing invasive species and subsequent--consequences for community restoration. Invasive species removal can have positive effects--for some communities but may cause unexpected changes that lead the system to an -	Cited by 1	http://citeseerx.ist.psu.edu/viewdoc/download?doi=10.1.1.295.3050&rep=rep1&type=pdf#page=224	Where-do-we-go-from-here--Alternative-control-and-restoration-trajectories-for-a-marine-grass--Spartina-anglica--invader-in-different-habitat-types	6/2/2021 9:42:39 PM
Loss of a foundation forest species due to an exotic invader impacts terrestrial arthropod communities	https://www.sciencedirect.com/science/article/pii/S037811271300039X	JK Adkins, LK Rieske - Forest Ecology and Management, 2013 - Elsevier	- Loss of a foundation forest species due to an exotic invader impacts terrestrial arthropod--communities - Our results indicate probable shifts in arthropod communities as the hemlock woolly--adelgid invasion progresses through the Central Appalachian region. Highlights -	Cited by 38	https://www.researchgate.net/profile/Josh_Adkins/publication/278036766_Adkins_and_Rieske_2013_-_Loss_of_a_foundation_species_due_to_an_exotic_invader_impacts_terrestrial_arthropod_communities/links/557b114d08ae26eada8afcc7/Adkins-and-Rieske-2013-Loss-of-a-foundation-species-due-to-an-exotic-invader-impacts-terrestrial-arthropod-communities.pdf	Loss-of-a-foundation-forest-species-due-to-an-exotic-invader-impacts-terrestrial-arthropod-communities	6/2/2021 9:42:43 PM
Antarctic microbial communities are functionally redundant, adapted and resistant to short term temperature perturbations	https://www.sciencedirect.com/science/article/pii/S0038071716301870	SZ De Scally, TP Makhalanyane, A Frossard… - Soil Biology and …, 2016 - Elsevier	- Biochemistry. Antarctic microbial communities are functionally redundant- adapted and--resistant to short term temperature perturbations - Highlights. - The effect of temperature on--Antarctic soil microbial communities was assessed. - Metagenomic -	Cited by 21	https://repository.up.ac.za/bitstream/handle/2263/56767/DeScally_Antarctic_2016a.pdf?sequence=1	Antarctic-microbial-communities-are-functionally-redundant--adapted-and-resistant-to-short-term-temperature-perturbations	6/2/2021 9:42:51 PM
A hacker manifesto [version 4.0]	https://dpya.org/en/images/d/d2/Wark_A-Hacker-Manifesto_4.0.pdf	MK Wark - Subsol, Available at: http://subsol. c3. hu/subsol_2 …, 2004 - dpya.org	- of states and armies- companies and communities depend on it. All contending classes - the--landlords and farmers- the workers and capitalists - revere yet fear the relentless abstraction of--the world on which their fortunes yet depend. All the classes but one. The hacker class -	Cited by 26	https://dpya.org/en/images/d/d2/Wark_A-Hacker-Manifesto_4.0.pdf	A-hacker-manifesto--version-4-0-	6/2/2021 9:42:56 PM
Pyrosequencing revealed shifts of prokaryotic communities between healthy and disease-like tissues of the Red Sea sponge Crella cyathophora	https://peerj.com/articles/890/	ZM Gao, Y Wang, RM Tian, OO Lee, YH Wong… - PeerJ, 2015 - peerj.com	- Pyrosequencing revealed shifts of prokaryotic communities between healthy and--disease-like tissues of the Red Sea sponge Crella cyathophora - Results and--Discussion. Diversity of sponge-associated prokaryotic communities -	Cited by 25	https://peerj.com/articles/890/	Pyrosequencing-revealed-shifts-of-prokaryotic-communities-between-healthy-and-disease-like-tissues-of-the-Red-Sea-sponge-Crella-cyathophora	6/2/2021 9:43:01 PM
Towards a unified taxonomy of health indicators: academic health centers and communities working together to improve population health	https://www.ncbi.nlm.nih.gov/pmc/articles/pmc4124598/	S Aguilar-Gaxiola, S Ahmed, Z Franco… - Academic …, 2014 - ncbi.nlm.nih.gov	- Towards a Unified Taxonomy of Health Indicators- Academic Health Centers and Communities--Working Together to Improve Population Health - Carter-Edwards- PhD- Giselle Corbie-Smith---MD- MSc- Milton -Mickey- Eder- PhD- Carol Ferrans- PhD- RN- Karen Hacker- MD- MPH -	Cited by 29	https://www.ncbi.nlm.nih.gov/pmc/articles/pmc4124598/	Towards-a-unified-taxonomy-of-health-indicators--academic-health-centers-and-communities-working-together-to-improve-population-health	6/2/2021 9:43:07 PM
Chemical control of epibiosis by Hong Kong sponges: the effect of sponge extracts on micro-and macrofouling communities	https://www.int-res.com/abstracts/meps/v297/p119-129/	S Dobretsov, HU Dahms, MY Tsoi… - Marine Ecology Progress …, 2005 - int-res.com	- As a result- complex communities of fouling organisms populate many marine surfaces ---sponges- the effect of sponge extracts on micro- and macrofouling communities Sergey--Dobretsov- Hans-Uwe Dahms- Mandy Y. Tsoi- Pei-Yuan Qian -	Cited by 43	https://www.int-res.com/articles/meps2005/297/m297p119.pdf	Chemical-control-of-epibiosis-by-Hong-Kong-sponges--the-effect-of-sponge-extracts-on-micro-and-macrofouling-communities	6/2/2021 9:43:13 PM
Social networks, social capital, and the use of information and communications technology in socially excluded communities: a study of community groups in …	https://deepblue.lib.umich.edu/handle/2027.42/39370	K Williams - 2005 - deepblue.lib.umich.edu	- information and communications technology in socially excluded communities- a study of--community groups in Manchester- England by - information and communications technology in--socially excluded communities- a study of community groups in Manchester- England by -	Cited by 44	https://deepblue.lib.umich.edu/bitstream/handle/2027.42/39370/williams_kate_2005_dissertation.pdf?sequence=2	Social-networks--social-capital--and-the-use-of-information-and-communications-technology-in-socially-excluded-communities--a-study-of-community-groups-in--	6/2/2021 9:43:20 PM
Zoogeography of intertidal communities in the West Indian Ocean as determined by ocean circulation systems: patterns from the Tetraclita barnacles	https://journals.plos.org/plosone/article?id=10.1371/journal.pone.0045120	LM Tsang, Y Achituv, KH Chu, BKK Chan - PLoS One, 2012 - journals.plos.org	- Loading metrics. Open Access. Peer-reviewed. Research Article. Zoogeography of--Intertidal Communities in the West Indian Ocean as Determined by Ocean Circulation--Systems- Patterns from the Tetraclita Barnacles. Ling Ming Tsang -	Cited by 36	https://journals.plos.org/plosone/article?id=10.1371/journal.pone.0045120	Zoogeography-of-intertidal-communities-in-the-West-Indian-Ocean-as-determined-by-ocean-circulation-systems--patterns-from-the-Tetraclita-barnacles	6/2/2021 9:43:24 PM
Phenotypic and phylogenetic evidence for the role of food and habitat in the assembly of communities of marine amphipods	https://esajournals.onlinelibrary.wiley.com/doi/abs/10.1890/13-0163.1	RJ Best, JJ Stachowicz - Ecology, 2014 - Wiley Online Library	- Phenotypic and phylogenetic evidence for the role of food and habitat in the assembly of--communities of marine amphipods. Rebecca J. Best Corresponding Author. E-mail address---rjbest-ucdavis.edu - habitat in structuring communities of phytophagous invertebrates -	Cited by 29	https://pdfs.semanticscholar.org/de60/1c5b17f502483a78b15a77fb75bbdf88b58c.pdf	Phenotypic-and-phylogenetic-evidence-for-the-role-of-food-and-habitat-in-the-assembly-of-communities-of-marine-amphipods	6/2/2021 9:43:30 PM
From Feminist Hacker Meet-ups to Engineering Educators: Implications of Social Movements in Technology for Change-making at the Level of Higher …	https://peer.asee.org/from-feminist-hacker-meet-ups-to-engineering-educators-implications-of-social-movements-in-technology-for-change-making-at-the-level-of-higher-education.pdf	EK Foster, DM Riley - peer.asee.org	- Another dynamic that the feminist hacker communities and engineering education--researchers shared involved their own gatekeeping mechanisms around collective--values- intentions- and certain forms of expertise. One engineering -	Related articles	https://peer.asee.org/from-feminist-hacker-meet-ups-to-engineering-educators-implications-of-social-movements-in-technology-for-change-making-at-the-level-of-higher-education.pdf	From-Feminist-Hacker-Meet-ups-to-Engineering-Educators--Implications-of-Social-Movements-in-Technology-for-Change-making-at-the-Level-of-Higher--	6/2/2021 9:43:38 PM
Exploring the intersections of technology, crime, and terror	https://www.tandfonline.com/doi/abs/10.1080/09546553.2011.648350	TJ Holt - Terrorism and Political Violence, 2012 - Taylor & Francis	- from various websites. 64 The global connectivity afforded by the adoption of--technology engendered the formation of hacker communities and collectives that--were not bound by geography or region. Individuals could develop -	Cited by 85	https://www.cve-kenya.org/media/library/Holt_2012_Exploring_the_Intersections_of_Technology_Crime_and_Terror.pdf	Exploring-the-intersections-of-technology--crime--and-terror	6/2/2021 9:43:43 PM
Detailed analysis of metagenome datasets obtained from biogas-producing microbial communities residing in biogas reactors does not indicate the presence …	https://biotechnologyforbiofuels.biomedcentral.com/articles/10.1186/1754-6834-6-49	FG Eikmeyer, A Rademacher… - Biotechnology …, 2013 - biotechnologyforbiofuels …	- Published- 04 April 2013. Detailed analysis of metagenome datasets obtained from--biogas-producing microbial communities residing in biogas reactors does not indicate--the presence of putative pathogenic microorganisms -	Cited by 35	https://biotechnologyforbiofuels.biomedcentral.com/articles/10.1186/1754-6834-6-49	Detailed-analysis-of-metagenome-datasets-obtained-from-biogas-producing-microbial-communities-residing-in-biogas-reactors-does-not-indicate-the-presence--	6/2/2021 9:43:48 PM
Developing Proactive Cyber Threat Intelligence from the Online Hacker Community: A Computational Design Science Approach	https://repository.arizona.edu/handle/10150/628454	S Samtani - 2018 - repository.arizona.edu	- unaware of what types of malicious exploits are available in hacker communities- what Page--19. 19 - hackers and exploit sharing communities in online hacker forums-- In this essay- the core--operations of an emerging deep learning approach operating on graphs- the Graph -	Cited by 1	https://repository.arizona.edu/bitstream/handle/10150/628454/azu_etd_16438_sip1_m.pdf?sequence=1	Developing-Proactive-Cyber-Threat-Intelligence-from-the-Online-Hacker-Community--A-Computational-Design-Science-Approach	6/2/2021 9:43:56 PM
Framework for evaluating contributions of ICT to capabilities, empowerment and sustainability in disadvantaged communities	https://www.academia.edu/download/34536441/CPR_South2_paper_Helena_Grunfeld_-_Nov_07.pdf	H Grunfeld - … on Empowering rural communities through ICT policy …, 2007 - academia.edu	- and links between ICT enclaves and the rest of society as factors impeding the use of ICT as--a tool for empowering rural communities - Focussing on inequalities- van Dijk - Hacker -2003---called for further research relating to different types of digital skills and usage to improve -	Cited by 44	https://www.academia.edu/download/34536441/CPR_South2_paper_Helena_Grunfeld_-_Nov_07.pdf	Framework-for-evaluating-contributions-of-ICT-to-capabilities--empowerment-and-sustainability-in-disadvantaged-communities	6/2/2021 9:44:02 PM
What the hack is a hacker?	https://core.ac.uk/download/pdf/223058932.pdf	P Franklin, R Adams, C Henry - 2019 - core.ac.uk	- works- What does a list titled -Hacker Classics- mean to people who identify as hackers---Historically and generally- the computer science and programming communities are future---focused. Their innovations and work are geared towards moving today-s society to the next step -	Cited by 1	https://core.ac.uk/download/pdf/223058932.pdf	What-the-hack-is-a-hacker-	6/2/2021 9:44:12 PM
Copyright or copyleft?: An analysis of property regimes for software development	https://www.sciencedirect.com/science/article/pii/S0048733305001484	PB De Laat - Research Policy, 2005 - Elsevier	- founded. These results are further confirmed by a second- much larger hacker survey--carried out by Ghosh et al. -2002-. Also - due. After a slow start in the 1980s- the number--of open source communities has grown steadily. At -	Cited by 182	https://philpapers.org/archive/DELCOC.pdf	Copyright-or-copyleft---An-analysis-of-property-regimes-for-software-development	6/2/2021 9:44:16 PM
Roles and knowledge management in online technology communities: an ethnography study	https://www.inderscienceonline.com/doi/abs/10.1504/IJWBC.2004.004800	TR Madanmohan, S Navelkar - … of Web Based Communities, 2004 - inderscienceonline.com	- Page 9. Roles and knowledge management in online technology communities 79 - Bottom line---4. Linux is fundamentally a hacker OS- written by programmers for programmers. 2. Certain--commercial companies are trying to change this and bring it to an end user -	Cited by 54	https://pdfs.semanticscholar.org/9162/d6e9d1656202465cbffaddb0bcaebd3d3490.pdf	Roles-and-knowledge-management-in-online-technology-communities--an-ethnography-study	6/2/2021 9:44:21 PM
